10006945;Восточно-Сибирский филиал ФГБОУ ВО "Российский государственный университет правосудия"(г. Иркутск);;;61,25;66,41;69,33;66,9;70,13;73,55;74,08
10006946;Дальневосточный филиал ФГБОУ ВО "Российский государственный университет правосудия" (г. Хабаровск);;;59,66;60,98;66,51;64,71;60,84;70,94;75,14
10006947;Западно-Сибирский филиал Федерального государственного образовательного учреждения высшего образования "Российский государственный университет правосудия" (г. Томск);;;63,34;63,53;72,04;72,06;73,21;61,9;74,34
10006948;Казанский филиал ФГБОУ ВО "Российский государственный университет правосудия"(г. Казань);;;82,63;86,52;86,69;85,61;86,81;88,25;89,38
10006949;Приволжский филиал ФГБОУ ВО "Российский государственный университет правосудия" (г. Нижний Новгород);;;73,23;73,17;82,29;83,21;86,35;89,9;89,32
10006950;Ростовский филиал ФГБОУ ВПО "Российская академия правосудия" (г. Ростов-на-Дону);;;77,41;81,65;88,1;87,51;86,27;85,19;84,43
10006951;Северо-Западный филиал ФГБОУ ВО "Российский государственный университет правосудия" (г. Санкт-Петербург);;;85,36;88,71;90,34;90,19;89,57;89,98;91,7
10006952;Уральский филиал ФГБОУ ВО "Российский государственный университет правосудия" (г. Челябинск);;;54,41;57,55;65,83;66,05;69,97;72,65;75,31
10006953;Центральный филиал ФГБОУ ВО "Российский государственный университет правосудия" (г. Воронеж);;;0;79,77;89,31;85,72;85,14;87,29;88,1
10006954;Барнаульский филиал ФГОБУ ВО "Финансовый университет при Правительстве Российской Федерации" (Барнаульский филиал Финуниверситета);;;56,54;60,46;55,83;65,85;63,6;69,96;55,28
10006955;Брянский филиал ФГОБУ ВО "Финансовый университет при Правительстве Российской Федерации";;;54,27;57,32;58,2;;;;
10006956;Владимирский филиал ФГОБУ ВО "Финансовый университет при Правительстве Российской Федерации";;;50,53;41,44;34,37;37,23;39,07;35,87;32,97
10006959;Краснодарский филиал ФГОБУ ВПО "Финансовый университет при Правительстве Российской Федерации";;;56,74;58,98;64;67,78;67,09;68,92;63,55
10006960;Курский филиал ФГОБУ ВО "Финансовый университет при Правительстве Российской Федерации";;;50,68;42,73;44,6;67,9;60,8;45,26;46,54
10006961;Липецкий филиал ФГОБУ ВО "Финансовый университет при Правительстве Российской Федерации";;;67,86;69,75;70;72,68;75,92;74,05;76,44
10006962;Новороссийский филиал ФГОБУ ВО "Финансовый университет при Правительстве Российской Федерации";;;0;56,08;61,88;69,6;68,58;67,77;60,99
10006963;Орловский филиал ФГОБУ ВО "Финансовый университет при Правительстве Российской Федерации";;;44,25;45,87;51,17;62,92;64,84;49,43;49,01
10006964;Пензенский филиал ФГОБУ ВО "Финансовый университет при Правительстве Российской Федерации";;;45,61;45,33;47,85;60,12;49,88;47,47;45,47
10006965;Смоленский филиал ФГОБУ ВО "Финансовый университет при Правительстве Российской Федерации";;;56,86;59,23;61,59;77,09;78,62;67,48;64,78
10006966;Тульский филиал ФГОБУ ВО "Финансовый университет при Правительстве Российской Федерации";;;69,01;67,38;64,13;72,54;74,53;73,34;76,43
10006967;Уфимский филиал ФГОБУ ВО "Финансовый университет при Правительстве Российской Федерации";;;0;53,23;57,85;56,79;61,27;59,18;50,93
10006968;Челябинский филиал ФГОБУ ВО "Финансовый университет при Правительстве Российской Федерации";;;0,77;46,31;48,32;56,47;62,62;65,92;64,26
10006969;Ярославский филиал ФГОБУ ВО "Финансовый университет при Правительстве Российской Федерации";;;56,59;61,99;63,46;68,81;73,38;63,31;52,75
10006970;Владикавказский филиал ФГОБУ ВО "Финансовый университет при Правительстве Российской Федерации";;;31,17;34,3;38,17;43,83;55,12;41,05;54
10006971;Калужский филиал ФГОБУ ВО "Финансовый университет при Правительстве Российской Федерации";;;34,13;31,24;35,36;37,12;48,64;50,21;45,1
10006972;Омский филиал ФГОБУ ВО "Финансовый университет при Правительстве Российской Федерации";;;33,87;28,45;31,81;33,45;44,89;53,11;53,46
10006973;Санкт-Петербургский филиал ФГОБУ ВО "Финансовый университет при Правительстве Российской Федерации";;;24,46;31,03;37,65;40,3;50,16;53,11;41,93
10006975;Филиал Международного института экономики и права в городе Астрахани;;;100;100;;;;;
10006976;Филиал Международного института экономики и права в городе Белорецке;;;100;100;;;;;
10006977;Филиал Международного института экономики и права в городе Владивостоке;;;100;100;;;;;
10006978;Филиал Международного института экономики и права в городе Волгограде;;;100;100;;;;;
10006979;Филиал Международного института экономики и права в городе Екатеринбурге;;;100;100;;;;;
10006980;Филиал Международного института экономики и права в городе Киселевске;;;100;100;;;;;
10006981;Филиал Международного института экономики и права в городе Магнитогорске;;;100;100;;;;;
10006982;Филиал Международного института экономики и права в городе Мурманске;;;100;;;;;;
10006983;Филиал Международного института экономики и права в городе Омске;;;100;100;;;;;
10006984;Филиал Международного института экономики и права в городе Челябинске;;;100;100;;;;;
10006985;Филиал Международного института экономики и права в городе Ярославле;;;100;100;;;;;
10006986;Сибирский филиал Международного института экономики и права;;;99,17;99,17;;;;;
10006987;Вологодский филиал ОО ВПО (частное учреждение) "Международная академия бизнеса и новых технологий (МУБиНТ)";;;;100;;;;;
10006988;Московский филиал РМАТ;;;;100;100;100;99,7;100;100
10006993;Филиал ФГБОУ ВО "Ивановский государственный политехнический университет" в г. Краснодаре;;;;;;;;;
10006994;Филиал ФГБОУ ВО "Ивановский государственный политехнический университет" в г. Нижнем Новгороде;;;;;;;;;
10006995;Филиал ФГБОУ ВПО "Ивановский государственный политехнический университет" в г. Рязани;;;;;;;;;
10006997;Институт сервиса и технологий (филиал) ФГБОУ ВПО "Донской государственнывй технический университет" в г. Пятигорске Ставропольского края;;;62,66;63,26;62,62;59,07;;;
10006998;Технологический институт сервиса (филиал)ФГБОУ ВО "Донской государственный технический университет" в г. Ставрополе Ставропольского края;;;53,08;54,87;54,98;58,7;67,05;79,55;90,14
10006999;Институт сферы обслуживания и предпринимательства (филиал) ФГОУ ВО "Донской государтсвенный технический университет" в г. Шахты Ростовской области;;;31,9;38,44;46,22;51,82;55,61;51,81;50,69
10007017;Филиал ФГБОУ ВПО "Уральский государственный педагогический университет" в г. Красноуфимске;;;;;;;;;
10007018;Филиал ФГБОУ ВПО "Уральский государственный педагогический университет" в г. Серове;;;;;;;;;
10007029;Тольяттинский филиал Самарского национального исследовательского университета имени академика С.П. Королева;;;;;;;;;
10007043;филиал ФГБОУ ВО "Санкт-Петербургский государственный экономический университет" в г. Великие Луки Псковской области;;;;;;;;;
10007044;филиал ФГБОУ ВО "Санкт-Петербургский государственный экономический университет" в г. Калининграде;;;;;;;;;
10007045;Калужский филиал ФГБОУ ВО "Санкт-Петербургский государственный экономический университет";;;;81,38;;;;;
10007046;Кировский филиал ФГБОУ ВО "Санкт-Петербургский государственный экономический университет";;;;;;;;;
10007047;филиал ФГБОУ ВО "Санкт-Петербургский государственный экономический университет" в г. Сосновый Бор Ленинградской области;;;;;;;;;
10007048;филиал ФГБОУ ВО "Санкт-Петербургский государственный экономический университет" в г. Старая Русса Новгородской области;;;;;;;;;
10007049;филиал ФГБОУ ВО "Санкт-Петербургский государственный экономический университет" в г. Сыктывкар Республики Коми;;;;;;;;;
10007050;филиал ФГБОУ ВО "Санкт-Петербургский государственный экономический университет" в г. Тихвине Ленинградской области;;;;;;;;;
10110172;Филиал АНОО ВПО "Воронежский экономико-правовой институт" в г.Орел;;;100;100;100;100;100;100;100
10110270;Орехово-Зуевский филиал НОУ ВПО "Институт экономики и предпринимательства";;;;;;;;;
10110303;Вышневолоцкий филиал ОАНО ВО "Международный славянский институт";;;;;;;;;
10110306;Калининградский филиал АНОО ВПО "Международный славянский институт";;;;;;;;;
10110307;Волгоградский филиал АНО ВО "Международный славянский институт";;;100;100;;;;;
10110311;Ростовский-на-Дону филиал НОЧУ ВО МОСКОВСКАЯ АКАДЕМИЯ ПРЕДПРИНИМАТЕЛЬСТВА при Правительстве Москвы;;;;;;;;;
10110312;Пермский филиал НОЧУ ВО МОСКОВСКАЯ АКАДЕМИЯ ПРЕДПРИНИМАТЕЛЬСТВА при Правительстве Москвы;;;0;;;;;;
10110322;Кировский филиал Московского гуманитарно-экономического института;;;;100;100;100;100;100;100
10110343;Филиал ОАНО ВО "Московский психолого-социальный университет" в станице Брюховецкая Краснодарского края;;;;;;;;;
10110356;Филиал ОАНО ВО "Московский психолого-социальный университет" в г.Одинцово Московской области;;;;;;;;;
10110385;Псковский филиал НОЧУ ВОП "Санкт-Петербургский институт управления и права";;;;;;;;;
10110397;Абаканский филиал НАЧОУ ВПО Современной гуманитарной академии;;;;;;;;;
10110405;Брянский филиал ЧОУ ВО Современной гуманитарной академии;;;;100;100;;;;
10110440;Самарский филиал ЧОУ ВО Современной гуманитарной академии;;;;;;;;;
10110442;Саранский филиал НАЧОУ ВПО Современной гуманитарной академии;;;;;;;;;
10110443;Саратовский филиал ЧОУ ВО Современной гуманитарной академии;;;;100;100;;;;
10110445;Северодвинский филиал ЧОУ ВО Современной гуманитарной академии;;;;;;;;;
10110446;Смоленский филиал ЧОУ ВО Современной гуманитарной академии;;;;100;;;;;
10110448;Сочинский филиал ЧОУ ВО Современной гуманитарной академии;;;;;;;;;
10110449;Старооскольский филиал НАЧОУ ВПО Современной гуманитарной академии;;;;;;;;;
10110450;Стерлитамакский филиал НАЧОУ ВПО Современной гуманитарной академии;;;;;;;;;
10110451;Сыктывкарский филиал НАЧОУ ВПО Современной гуманитарной академии;;;;;;;;;
10110452;Тамбовский филиал ЧОУ ВО Современной гуманитарной академии;;;;100;100;;;;
10110455;Улан-Удэнский филиал ЧОУ ВО Современной гуманитарной академии;;;;100;;;;;
10110457;Уфимский филиал ЧОУ ВО Современной гуманитарной академии;;;;100;100;;;;
10110458;Ухтинский филиал НАЧОУ ВПО Современной гуманитарной академии;;;;;;;;;
10110459;Хабаровский филиал ЧОУ ВО Современной гуманитарной академии;;;;;;;;;
10110460;Хасавюртовский филиал НАЧОУ ВПО Современной гуманитарной академии;;;;0;;;;;
10110462;Черкесский филиал НАЧОУ ВПО Современной гуманитарной академии;;;;0;;;;;
10110902;Магаданский филиал АНО ВПО "Российская академия предпринимательства";;;;99,46;;99,24;99,47;;
10110903;Новосибирский филиал АНО ВПО Российская академия предпринимательства;;;;;;;;;
10110906;Челябинский филиал АНО ВПО "Российская академия предпринимательства";;;;;;100;100;100;100
12000444;Коломенский институт (филиал) ФГБОУ ВПО "Московский государственный машиностроительный университет (МАМИ)" в г. Коломне Московской области;;;62,3;63,11;;;;;
12000448;Рязанский институт (филиал) ФГБОУ ВПО "Московский государственный машиностроительный университет (МАМИ)";;;58,65;66,34;;;;;
12000450;Губкинский институт (филиал) ФГБОУ ВПО "Московский государственный машиностроительный университет (МАМИ)" в г.Губкине Белгородской области;;;;;;;;;
12000452;Филиал ФГБОУ ВПО "Московский государственный машиностроительный университет (МАМИ)" в г.Воскресенске Московской области;;;;86,16;;;;;
12000459;филиал ФГБОУ ВПО "Московский государственный машиностроительный университет (МАМИ)" в г. Сафоново Смоленской области;;;;100;;;;;
12000463;Филиал ФГБОУ ВПО "Московский государственный машиностроительный университет (МАМИ)" в г. Прокопьевске Кемеровской области;;;;;;;;;
12000464;Филиал ФГБОУ ВПО "Московский государственный машиностроительный университет (МАМИ)" в г. Махачкале Республики Дагестан;;;91,26;;;;;;
12000465;филиал ФГБОУ ВПО "Московский государственный машиностроительный университет (МАМИ)" в г. Смоленске;;;;;;;;;
12003257;Чебоксарский политехнический институт (филиал) ФГБОУ ВПО "Московский государственный машиностроительный университет (МАМИ)" в г.Чебоксары Чувашской Республики;;;75,81;72,85;;;;;
12006915;Таганрогский филиал НОУ ВПО "Российский новый университет";;;;100;100;100;99,37;100;100
12006918;Александровский филиал НОУ ВПО "Российский новый университет";;;100;100;;;;;
12006919;Волоколамский филиал НОУ ВПО "Российский новый университет";;;;;;;;;
12006920;Гагаринский филиал НОУ ВПО "Российский новый университет";;;;;;;;;
12006925;Орехово-Зуевский филиал ОЧУ ВО "Академия МНЭПУ";;;;;;;;;
12006927;Воскресенский филиал НОУ ВПО "Российский новый университет";;;;100;;;;;
12006928;Новоуренгойский филиал НОУ ВПО "Российский новый университет";;;;;;;;;
12006930;Кубанский институт социоэкономики и права (филиал) ОУ профсоюзов ВО "Академия труда и социальных отношений" (КубИСЭП (филиал) ОУП ВО "АТиСО");;;;;100;100;100;100;100
12006936;Волгоградский филиал ОУ профсоюзов ВО "Академия труда и социальных отношений";;;;;0;;;;
12006939;Красноярский филиал ОУ профсоюзов ВО "Академия труда и социальных отношений";;;;100;100;100;100;100;100
12006987;Филиал Международного института экономики и права в городе Петрозаводске;;;100;100;;;;;
12006988;Рыбинский филиал ОО ВО (частное учреждение) "Международная академия бизнеса и новых технологий (МУБиНТ)";;;;;;;;;
12006989;Костромской филиал ОО ВПО (частное учреждение) "Международная академия бизнеса и новых технологий (МУБиНТ)";;;;100;;;;;
12006990;Волоколамский институт гостеприимства - филиал РМАТ;;;;100;;;;;
12006996;Центральный институт управления и экономики туристского бизнеса - филиал НОУ ВПО Российская международная академия туризма;;;;;;;;;
12007008;Владимирский филиал РМАТ;;;;;;;;;
12007010;Тульский филиал РМАТ;;;98,74;;;;;;
12007011;Воскресенский институт туризма - филиал РМАТ;;;100;100;100;100;100;100;98,83
12007013;Западно-Подмосковный институт туризма - филиал РМАТ;;;100;100;100;100;100;100;99,32
12007014;Карельский институт туризма - филиал РМАТ;;;;;;;;;
12007015;Псковский филиал РМАТ;;;;100;100;100;100;97,3;95,85
12007034;Подольский институт (филиал) ФГБОУ ВПО "Московский государственный машиностроительный университет (МАМИ)" в г.Подольске Московской области.;;;;;;;;;
12011608;Тувинский филиал ФГБОУ ВПО "Восточно-Сибирская государственная академия культуры и искусств";;;;;;;;;
12011930;Ступинский филиал НОУ ВПО "Российский новый университет";;;95,81;96,02;98,31;98,82;98,89;;
12012670;Ростовский-на-Дону институт физической культуры и спорта (филиал) ФГБОУ ВПО "Кубанский государственный университет физической культуры, спорта и туризма";;;;;;;;;
12012671;Екатеринбургский филиал ФГБОУ ВПО "Уральский государственный университет физической культуры ";;;51,77;58,93;67,99;68,39;69,27;71,83;50,37
12012672;Башкирский институт физической культуры (филиал) ФГБОУ ВО "Уральский государственный университет физической культуры";;;90,05;92,68;88,59;79,56;81,11;82,05;67,64
12012673;Стерлитамакский институт физической культуры (филиал) ФГОУ ВПО "Уральский государственный университет физической культуры";;;98,24;99,91;99,49;94,05;86,54;;
12012674;Филиал ФГБОУ ВПО "Иркутский государственный университет путей сообщения" в г. Братск;;;;;;;;;
12012682;Филиал ФГБОУ ВПО "Российский государственный университет физической культуры, спорта, молодежи и туризма (ГЦОЛИФК)" в г. Новочебоскарске;;;;;;;;;
12012688;Филиал НОУ ВПО "Институт профессиональных инноваций" в Республике Саха Якутия г. Нерюнгри;;;;;;;;;
12012689;Филиал НОУ ВПО "Институт профессиональных инноваций" в г.Волгограде;;;;;;;;;
12012690;Филиал НОУ ВПО "Институт профессиональных инноваций" в г. Мирный;;;;;;;;;
12012695;Коломенский филиал НОУ ВПО "Московская академия экономики и права";;;;;;;;;
12012696;Моздокский филиал НОУ ВПО "Московская академия экономики и права";;;100;100;100;;;;
12012697;Рязанский филиал НОУ ВПО "Московская академия экономики и права";;;;;;;;;
12012699;Воронежский филиал НОУ ВПО "Московская академия экономики и права";;;;;;;;;
12012700;Смоленский филиал НОУ ВПО "Московская академия экономики и права";;;100;100;100;;;;
12012701;Калмыцкий филиал НОУ ВПО "Московская академия экономики и права";;;100;100;100;;;;
