1999;Балаковский институт бизнеса и управления;;3,56;;;;;;;
2000;ИНСТИТУТ ДРУЖБЫ НАРОДОВ КАВКАЗА;;;8,07;6,04;6,26;3,28;3,86;5,52;5,87
2001;Московский экономико-финансовый институт;;1,19;;;;;;;
2002;Невский институт языка и культуры;;5,4;;4,26;;;2,78;1,04;1,02
2003;Московский институт юриспруденции;;1,73;;;;;;;
2004;Негосудрственное Алтайский экономико-юридический институт;;2,31;3,41;3,36;4,2;;;;
2005;Прикамский социальный институт;;4,51;2,8;4,01;;3,36;3,97;3,7;3,56
2007;Сибирский институт международных отношений и регионоведения;;;8,57;12,11;14,69;13,94;15,13;;
2008;Волгоградский институт бизнеса;;2,22;2,65;2,86;3,35;2,85;2,17;2,02;2,88
2009;Негосударственное Армавирский лингвистический социальный институт;;1,47;3,68;3,07;3,55;3,09;3,25;3,3;3,36
2010;Институт гостиничного и туристического менеджмента;;;;;;;;;
2011;Московский архитектурно-строительный институт;;5,05;4,45;5,51;;;;;
2012;Международный гуманитарно-лингвистический институт;;2,91;;2,53;4,73;4,99;4,28;5,01;5,16
2015;Пермский институт муниципального управления;;;;;;;;;
2016;Институт менеджмента и рынка;;;;;;;;;
2017;ТУЛЬСКИЙ УНИВЕРСИТЕТ (ТИЭИ);;2,63;3,25;3,1;3,5;2,99;2,21;;1,74
2018;Санкт–Петербургский медико-социальный институт;;;;;6,19;6,26;7,43;6,03;4,96
2019;Уральский институт коммерции и права;;1,38;;3,09;;3,19;0,96;1,24;
2022;Владикавказский институт Моды и Дизайна;;8,54;11,39;;;;;;
2023;Высшая школа бизнеса, безопасности и управления;;6,25;;;;;;;
2024;Омский институт международного менеджмента и иностранных языков Ин.яз. - Омск;;8,15;8,05;;;;;;
2025;Сибирский университет потребительской кооперации;;3,73;3,52;3,68;3,78;3,61;3,65;3,7;3,39
2026;Международная Гуманитарно-Техническая Академия (институт);;;;1,52;;;;;
2027;Московская международная академия;;3,7;;4,4;5,4;5,43;5,4;5,64;5,47
2028;Московский институт государственного управления и права;;;4;;2,06;3,6;3,11;;
2029;Институт современных технологий и экономики;;6,63;;;;;;;
2030;Евразийский институт экономики, менеджмента, информатики;;2,24;;;;;;;
2032;Ростовский институт иностранных языков;;6,18;;;;;;;
2033;Открытый технологический институт;;;;2,51;;;;4,7;2,16
2034;Институт социально-экономического прогнозирования и моделирования;;3,44;4,43;2,1;3,09;;;;
2035;Сибирский институт бизнеса, управления и психологии;;;3,22;3,15;3,31;3,07;3,02;3,12;2,5
2036;Новый гуманитарный институт;;12,6;17,48;6,25;10;8,72;10,14;;
2039;Столичный институт переводчиков;;;;;;;;;
2040;Казанский институт финансов, экономики и информатики;;2,4;4,2;7,19;6,99;6,38;8,62;;
2041;Челябинский институт экономики и права им. М.В. Ладошина;;3;3,11;3,08;3,06;;;;
2042;Институт специальной педагогики и психологии;;2,6;;2,91;;5,76;;;
2043;Балтийский Гуманитарный Институт;;;;2,24;2,73;2,4;4,87;6,21;4,75
2044;Институт бизнеса, информационных технологий и финансов;;;;;;;;;
2045;Московская академия творчества;;4,15;;;;;;;
2046;Московский технологический институт ВТУ;;0,44;0,64;0,51;0,5;0,74;;;
2047;Московский финансово-экономический инcтитут;;2,55;;6,42;5,48;5,36;5,24;;
2048;Институт экономики;;5,3;6,51;123,21;;;;;
2049;Институт экономики и управления (г. Пятигорск);;4,42;;2,49;;;;;
2050;Рязанский институт открытого образования;;0,85;;;;;;;
2051;Томский экономико-юридический институт;;6,04;;4,6;;;;;
2052;Экономико-правовой институт;;;;;;;;;
2053;Институт международных экономических связей;;6,16;;4,47;5,1;4,96;5,06;5,16;4,81
2054;Санкт-Петербургский институт гуманитарного образования;;;;;;;;;
2055;Московский университет государственного управления;;2,7;4,83;5,37;;;;;
2056;Кисловодский институт экономики и права;;2,31;3,41;;;;;;
2057;Невский институт управления и дизайна;;5,52;6,79;5,09;;;;;
2059;АЛТАЙСКАЯ АКАДЕМИЯ ЭКОНОМИКИ И ПРАВА (ИНСТИТУТ);;3,72;3,5;3,26;;;;;
2060;Межрегиональный открытый социальный институт;;1,47;1,28;1,03;1,21;1,1;1,23;1,47;3,05
2062;Институт Индустрии Моды;;;;;;;;;
2063;Санкт-Петербургский институт экономики и управления;;;;;5,22;6,54;6,89;5,94;5,94
2064;Калининградский институт управления;;;;;2,52;3,21;3,11;1,97;2,22
2065;Сантк-Петербургский Гуманитарный университет профсоюзов;;4,08;;;3,98;4,33;4,54;4,53;4,57
2066;Владимирский институт туризма и гостеприимства;;4,61;5,66;5,45;3,47;;;;
2067;Уральский институт экономики, управления и права;;2,32;2,57;3,26;13,65;105,71;10,95;36,77;28
2068;Московский институт предпринимательства и права;;3,13;;;;;;;
2069;ростовский международный институт экономики и управления;;2,47;2,6;2,19;;;;;
2070;Ростовский институт защиты предпринимателя;;2,01;3,11;;2,84;2,96;3,69;4,06;3,78
2071;Региональный финансово-экономический институт;;0,31;0,51;0,34;0,69;0,54;1,8;3,1;
2072;Среднерусский гуманитарно-технологический институт;;2,77;2,82;2,83;3,74;3,82;3,46;2,88;3,61
2073;Московский гуманитарный институт имени Е.Р.Дашковой;;2,5;2,36;1,72;;;;;
2074;Кавказский светский институт;;;;;;;;;
2075;Западно-Сибирский Институт Финансов и Права;;1,41;;;;;;;
2076;Московский новый юридический институт;;0,75;;;;;;;
2077;Томский заочный финансово-юридический институт;;57,5;;24,04;;;;;
2078;Российская экономическая школа (институт);;17,66;12,93;13,23;9,86;9,07;3,53;3,08;7,8
2079;Санкт-Петербургский институт внешнеэкономических связей, экономики и права;;7,11;;5,7;5,94;4,64;6,56;;
2080;Институт бизнеса и права;;;;;;;;;
2081;Сочинский институт моды, бизнеса и права ;;4,5;4,62;4,72;4,62;4,84;;;
2082;Институт управления;;;;2,99;3,23;3,36;3,21;3,16;3,83
2083;Гуманитарно-экономический и информационно-технологический институт;;1,34;;;;;;;
2084;МЕЖДУНАРОДНЫЙ УНИВЕРСИТЕТ В МОСКВЕ;;5,54;7,02;7,02;2,02;1,43;0,8;1,13;0,68
2085;Московская гуманитарно-техническая академия;;0,83;1,4;1,37;0,86;0,69;0,58;;
2086;Экономико-юридический институт;;;;;;;;;
2087;СИБИРСКАЯ АКАДЕМИЯ УПРАВЛЕНИЯ И МАССОВЫХ КОММУНИКАЦИЙ (ИНСТИТУТ);;;;1,87;;;;;
2089;Международный еврейский институт экономики, финансов и права;;;;17,8;11,56;8,54;8,33;13;7,44
2090;Институт международных экономических отношений;;;10;;;;;;
2092;Приамурский институт агроэкономики и бизнеса;;2,18;;2,24;;;11,65;32;
2093;Белгородский инженрено-экономический институт;;1,13;1,96;;;;;;
2094;Дагестанская академия образования и культуры;;2,49;;6,47;6,59;8,8;7,19;10,7;
2095;Уральский гуманитарный институт;;1,08;1,32;1,74;;;;;
2096;Институт государственного администрирования;;;;;;3,62;4,38;5,97;4,08
2151;Московский государственный психолого-педагогический университет;;6,07;6,08;5,32;5,11;5,77;4,82;4,79;4,73
2155;Московская государственная академия делового администрирования;;;;;;;;;
2183;Московский городской педагогический университет;;6,1;7,92;7,1;6,87;5,72;5,65;5,88;5,53
2189;Московский институт открытого образования;;;;;;;;;
2197;Институт искусства реставрации;;19,08;13,11;;;18,7;16,85;;
2198;Ивановский государственный политехнический университет;;4,24;4,74;5,25;4,82;4,6;4,12;3,74;3,82
5516;Крымский инженерно-педагогический университет;;;;;3,67;3,58;4,04;4,22;4,45
5517;Крымский университет культуры, искусств и туризма;;;;4,27;2,9;2,8;3,42;3,46;
5518;Крымский институт бизнеса;;;;;;;;;
5519;Образовательная организация высшего образования Университет экономики и управления;;;;;;1,42;1,37;1,67;2,07
5542;Керченский государственный морской технологический университет;;;;;;;;;
5572;Профессиональный институт управления;;7,45;;;;;;;
5616;Институт иностранных языков;;13,97;;15,48;15,87;;;;
5618;Санкт-Петербургский институт искусств и реставрации;;10,58;;1,8;;2,02;3,45;4,26;7,32
5625;Северо-Западный открытый технический университет;;0;;2,14;;2,81;2,03;;
5631;Московский институт управления;;8,45;;;;;;;
5635;Московский институт государственного и муниципального управления;;7,6;;;;;;;
5636;Московский институт психологии;;8,62;;;;;;;
5637;Московский юридический институт;;8,5;;;;;;;
5664;Институт языков и культур имени Льва Толстого;;25;;;33,65;;;;
5675;Сколковский институт науки и технологий;;;;;;;;;
5802;Московский исламский институт;;1,38;2,44;1,81;;;;;
5961;Пензенская духовная семинария Пензенской Епархии Русской Православной Церкви;;;;;;;12,65;12,64;9,47
100256;Санкт-Петербургский государственный экономический университет;;4,58;4,61;4,4;4,62;4,56;4,64;4,87;4,53
100345;Исследовательский центр частного права имени С.С. Алексеева при Президенте Российской Федерации;;;;60,62;40,21;40,93;15,68;19,66;21,55
110134;Мордовский гуманитарный институт;;;;;2,05;1,9;;;
110135;Институт международных связей;;3,83;4,3;1,64;;6,22;4,82;11,59;9,57
110136;Институт права и экономики;;;1,48;2,01;3,86;;;;
110138;Академический Гуманитарный Институт;;;;;;;;;
110139;Академический институт прикладной энергетики;;3,23;5,9;4,36;4,43;4,91;;;
110140;Академический международный институт;;1,92;;2,02;;;;;
110141;Академический правовой институт;;82,35;;22,93;;;;;
110142;Академия гражданской защиты и медицины катастроф;;3,12;;;;;;;
110144;Академия социального образования;;2,89;3,23;3,28;4,48;4,67;6,26;4,8;5,81
110145;Академия социального управления;;9,05;9,12;6,88;6,53;6,54;6,63;5,89;5,32
110147;Академия сферы социальных отношений;;;;;;;;;
110148;Академия труда и социальных отношений;;5,37;;6,31;6,6;5,61;6,89;6,26;7,6
110152;Алтайский институт финансового управления;;1,52;2,45;2,93;;;;;
110153;Альметьевский государственный институт муниципальной службы;;;;;;;;;
110154;Альметьевский государственный нефтяной институт;;2,93;2,97;3,16;3,61;3,55;3,58;3,53;4,18
110155;Астраханский инженерно-строительный институт;;2,91;4,34;4,11;4,32;3,88;4,45;4,21;4,05
110156;Байкальский гуманитарный институт;;;;;1,71;;8,41;5,26;4,21
110157;Байкальский экономико-правовой институт;;;;;;1,82;3,31;;
110158;Балтийский институт иностранных языков и межкультурного сотрудничества;;7,14;;5;4,48;6,6;;;
110159;Балтийский институт экологии, политики и права;;7,16;;3,52;4,66;2,69;;;
110160;Башкирская академия государственной службы и управления при Президенте Республики Башкортотстан;;6,38;3,97;4;3,15;2,89;3,33;3,54;2,43
110161;Белгородский государственный институт искусств и культуры (БГИИК);;7,41;7,72;7,52;6,7;5,43;5,35;5,26;5,07
110162;Владикавказский   институт   экономики, управления    и  права (г. Владикавказ);;7,06;8,46;8,21;;;;;
110163;Владимирский институт бизнеса (ВИБ);;2,51;;;;;;;
110164;Волгоградский государственный институт искусств и культуры;;;3,31;6,67;8,02;8,61;7,33;6,4;6,7
110165;Волгоградская консерватория (институт) имени П.А.Серебрякова;;;10,03;7,09;9,21;7,7;24,85;6,9;11,07
110166;Волгоградский юридический институт;;6,33;;;;;;;
110167;Волжский институт экономики, педагогики и права;;;3,29;4;3,98;3,52;3,69;4,06;4,21
110168;Воронежский институт инновационных систем;;5,35;;;;;;;
110169;Воронежский институт экономики и социального управления;;2,64;3,3;4,02;5,01;5,47;4,35;3,9;4,94
110170;Воронежский экономико-правовой институт;;2,46;3,18;3,59;3,14;3,66;3,58;3,99;3,78
110171;Восточно-Европейский институт;;0,87;0,84;;2,93;3,59;34,72;29,84;
110173;Высшая школа музыки Республики Саха (Якутия) (институт) имени В. А. Босикова;;5,95;6,67;5,3;7,64;8,02;4,73;6,04;5,92
110174;Высшая школа предпринимательства (институт);;1,42;2,1;2,68;3,83;3,42;7,88;10,31;9,32
110176;Высшая школа психологии (Институт);;;;;;;;;
110180;Государственный институт экономики, финансов, права и технологий;;2,33;2,8;3,13;3,32;3,79;3,78;3,61;3,72
110182;Гуманитарно-Прогностический Институт;;;;;;;;;
110183; Гуманитарно-социальный институт;;3,72;3,62;4,68;7,61;6,29;7,67;5,76;5,37
110185;Гуманитарно-Экологический Институт;;;;;;;;;
110186;Открытый Институт - Высшая профессиональная школа;;3,18;;;;4,59;4,3;4,99;5,33
110187;Гуманитарный институт имени П.А.Столыпина;;;;10,94;16,67;20,77;31,38;34,52;37,5
110188;Гуманитарный институт;;;;;;12,94;3,23;4,26;
110189;Дагестанский государственный институт народного хозяйства;;1,91;3,35;3,67;3,65;3,55;3,5;3,88;3,62
110190;Дагестанский медицинский стоматологический институт;;;;;;10,22;9,19;11,11;10,62
110192;Дальневосточный институт коммуникаций;;3,63;5,31;5,15;4,12;4,36;4,14;5,08;7,28
110193;Дальневосточный институт международного бизнеса;;0,95;;;;;;;
110194;Дальневосточный институт международных отношений;;2,66;;3,57;6,9;;;;
110196;Донской институт дистанционного образования;;;;;;;;;
110197;Донской юридический институт;;2,35;2,79;;;;;;
110199;Европейско-Азиатский институт управления и предпринимательства;;;;;;;;;
110200;Екатеринбургская академия современного искусства (институт) ;;5,39;6,21;6,03;5,78;6,28;7,47;5,02;6,03
110202;Ессентукский институт управления, бизнеса и права;;1,82;;4,46;5,59;6,06;5,96;5,97;5,42
110203;Заокский христианский гуманитарно-экономический институт;;7,36;5,38;;;9,41;;;
110204;Западно-Уральский институт экономики и права;;;2,91;3,02;2,9;2,96;2,88;3,16;3,22
110207;Ижевский институт управления;;;;;;;;;
110209;Институт адвокатуры, нотариата и международных отношений;;2,55;;;;;;;
110212;Институт бизнеса, психологии и управления;;3,13;3,58;1,37;;;;;
110214;Институт гуманитарного образования и информационных технологий;;;;4,99;5,37;5,3;4,97;8,6;13,97
110216;Институт деловой карьеры;;;;1,25;1,82;1,93;2,19;2,72;1,17
110218;Институт журналистики и литературного творчества;;;;;;5,75;8,6;;18,35
110219;Институт законоведения и управления ВПА;;;;;;1,08;1,02;;
110221;ИНСТИТУТ ИНОСТРАННЫХ ЯЗЫКОВ;;7,92;;7,35;;7,34;7,95;10;9,71
110222;Институт информационных технологий, экономики и менеджмента;;1,69;;0,88;2,35;1,51;2,26;2,78;3,26
110224;Институт Коммерции и Права;;;8,55;;;;;;
110227;Институт международного права и экономики имени А.С. Грибоедова;;5,4;5,04;4,89;5,26;2,65;1,28;4,38;4,32
110229;Институт международной торговли и права;;;2,9;;2,12;2,07;7,13;;
110230;Институт менеджмента, экономики и инноваций;;;5,62;3,69;2,84;;2,42;2,19;2,15
110231;Институт мировой экономики и финансов;;1,55;1,88;1,74;1,95;9,59;2,18;2,25;
110232;Институт открытого бизнес-образования и дизайна;;;;;3,54;5,47;6,07;3,5;3,63
110236;Институт программных систем УГП имени А.К.Айламазяна;;6,53;14,9;;7,01;;;;
110237;Московский институт психологии;;;;7,44;8,49;;;;
110238;Институт психологии и педагогики;;2,48;;;;;;;
110239;Институт радиоэлектроники, сервиса и диагностики;;9,66;;12,55;9,72;14,1;21,63;45,56;360
110240;Институт русского театра;;;;20,42;;;;;
110241;Институт систем управления экономикой и международного права;;;;;;;;;
110243;Институт современного искусства;;3,52;3,2;3,62;4,93;3,48;3,32;3,49;3,24
110244;Институт современного права и экономики;;;;;;;;;
110245;Институт современного управления, кино и телевидения;;3,03;;;;;;;
110248;Институт социальных наук;;;;;11,07;19,44;39,29;32,19;16,94
110250;Институт технологии туризма;;2,29;3,08;;;;;;
110251;Институт международных отношений;;;;7,37;;;;;
110252;Институт Уник;;;;;;;;;
110254;Институт управления и права;;;;;;5,24;;;
110255;Институт Управления, Бизнеса и Права (г.Пятигорск);;4,02;;;6,32;8,69;10,04;9,76;
110261;Институт финансов и права;;1,8;2,07;2,32;3,07;3,11;2,49;4,09;6,4
110263;Институт финансового контроля и аудита;;;;;;;;;
110264;Институт цивилизации;;22,54;36,05;;;;;;
110265;Институт Экономики Бизнеса;;;20,33;21,02;27,82;;;;
110266;Институт экономики и культуры;;;;;;2,26;2,19;1,94;2,13
110267;Институт экономики и права (г. Воронеж);;;;5,27;3,17;4,14;2,89;4,05;
110269;Институт экономики и предпринимательства;;1,4;;;;;;;
110271;Институт экономики и управления в промышленности;;1,25;1,18;1,22;1,33;1,99;3,59;6;5,89
110273;Институт экономики предпринимательства;;1,53;;;;;;;
110274;Институт экономики, права и гуманитарных специальностей;;16,46;;;;;;;
110275;Кабардино-Балкарский институт бизнеса;;3,97;;5,38;3,93;3,47;6,76;;
110276;Казанский институт предпринимательства и права;;;;;;8,72;11;11;11
110278;Камский институт;;2,09;;;;;;;
110279;Камский институт искусств и дизайна;;3,88;;6,38;7,43;8,01;20,59;30,91;31,08
110280;Кировский институт иностранных языков;;;5,27;25,65;;;;;
110281;Коми республиканская академия государственной службы и управления;;2,99;3,73;3,79;3,05;3,69;3,83;2,93;2,87
110282;КРАСНОДАРСКИЙ МУНИЦИПАЛЬНЫЙ МЕДИЦИНСКИЙ ИНСТИТУТ ;;7,45;7,43;8,03;10,52;9,31;9,67;16,12;
110283; Кубанский институт информзащиты;;;;;;3,81;4,39;;
110284;Кубанский медицинский институт;;10,98;8,33;6,9;7,97;8,27;13,41;6,19;3,75
110285;Кузбасский институт экономики и права;;;;;;;;;
110286;Кумертауский институт экономики и права;;;7,22;7,85;10,56;12,61;14,56;34,88;31,91
110288;Курская академия государственной и муниципальной службы;;;2,43;3,06;3,05;2,91;2,85;2,88;2,85
110289;Курский автодорожный институт;;;;;;;;;
110291;Ленинградский государственный университет имени А.С. Пушкина;;3,44;4,92;4,86;4,86;4,95;5,84;5,56;4,94
110292;Липецкий инстиут управления;;2,75;;;;;;;
110293;Магнитогорская государственная консерватория (академия) имени М.И. Глинки;;10,23;11,69;10,02;9,61;9,7;10,2;10,55;8,89
110294;Махачкалинский инновационный университет;;2;;;;;;;
110295;Международная академия бизнеса и управления;;3,51;1,43;0,89;4,61;4,34;4,39;4,38;2,43
110296;Международная академия оценки и консалтинга;;3,3;;2,11;2,72;;;;
110297;Международный инновационный университет;;3,37;3,56;4,87;5,34;3,77;3,3;3,29;3,71
110298;Международный институт бизнес-образования;;;2,91;;;;;;
