10006923;Филиал ЧОУ ВО "Самарская гуманитарная академия" в г.Тольятти;;;;598;66;31;24;;
10006924;Краснознаменский филиал НОУ ВПО "Московский финансово-промышленный университет "Синергия";;;;525;;;;;
10006925;Омский филиал НОЧУ ВО "Московский финансово-промышленный университет "Синергия";;;;1 692;1 811;1 681;2 030;2 127;1970
10006926;Курганский филиал ОУ профсоюзов ВО "Академия труда и социальных отношений";;;;1 628;1 195;935;685;453;331
10006927;Башкирский институт социальных технологий (филиал) ОУ профсоюзов ВО "Академия труда и социальных отношений";;;;727;;368;353;300;294
10006928;Азовский филиал АНО ВПО "Евразийский открытый институт";;;;;;;;;
10006929;Донской филиал АНО ВПО "Евразийский открытый институт";;;;;;;;;
10006931;Электростальский филиал АНО ВПО "Евразийский открытый институт";;;;;;;;;
10006932;Северо-Кавказский филиал ФГОБУ ВПО Московского технического университета связи и информатики;;;;1 493;1 334;1 142;1 114;1 123;1051
10006933;Филиал ФГБОУ ВПО "Уральский государственный университет путей сообщения" в г. Тюмени;;;;180;234;;45;55;63
10006934;Филиал ФГБОУ ВПО "Уральский государственный университет путей сообщения" в. г. Нижнем Тагиле;;;;295;333;;20;73;101
10006935;Улан-Удэнский институт железнодорожного транспорта - филиал ФГБОУ ВПО "Иркутский государственный университет путей сообщения";;;;613;590;136;;;
10006936;Забайкальский институт железнодорожного транспорта - филиал ФГБОУ ВПО "Иркутский государственный университет путей сообщения";;;;3 125;2 716;2 345;2 235;2 317;2229
10006937;Красноярский институт железнодорожного транспорта - филиал ФГБОУ ВПО "Иркутский государственный университет путей сообщения";;;;2 449;2 696;2 625;2 545;2 410;2362
10006938;Хакасский филиал ФГБОУ ВПО "Красноярский государственный аграрный университет";;;;;;;;;
10006939;Ачинский филиал ФГБОУ ВПО "Красноярский государственный аграрный университет";;;;1 079;977;865;803;755;696
10006940;Калужский филиал ФГБОУ ВО "Российский государственный аграрный университет - МСХА имени К.А. Тимирязева";;;;1 014;1 103;1 208;1 315;1 437;1453
10006943;Филиал ФГБОУ ВПО "Российский государственный университет физической культуры, спорта, молодежи и туризма (ГЦОЛИФК)" в г. Иркутске;;;;508;440;425;433;433;428
10006944;Северо-Кавказский филиал ФГБОУ ВО "Российский государственный университет правосудия"(г.Краснодар);;;;2 025;2 173;2 182;2 193;2 404;2300
10006945;Восточно-Сибирский филиал ФГБОУ ВО "Российский государственный университет правосудия"(г. Иркутск);;;;801;844;872;889;875;755
10006946;Дальневосточный филиал ФГБОУ ВО "Российский государственный университет правосудия" (г. Хабаровск);;;;663;662;615;578;626;630
10006947;Западно-Сибирский филиал Федерального государственного образовательного учреждения высшего образования "Российский государственный университет правосудия" (г. Томск);;;;643;641;665;712;731;638
10006948;Казанский филиал ФГБОУ ВО "Российский государственный университет правосудия"(г. Казань);;;;1 384;1 369;1 290;1 237;1 467;1456
10006949;Приволжский филиал ФГБОУ ВО "Российский государственный университет правосудия" (г. Нижний Новгород);;;;1 107;1 171;1 324;2 194;1 919;1549
10006950;Ростовский филиал ФГБОУ ВПО "Российская академия правосудия" (г. Ростов-на-Дону);;;;1 402;1 390;1 343;1 242;1 315;1315
10006951;Северо-Западный филиал ФГБОУ ВО "Российский государственный университет правосудия" (г. Санкт-Петербург);;;;1 338;1 435;1 479;1 526;1 810;2006
10006952;Уральский филиал ФГБОУ ВО "Российский государственный университет правосудия" (г. Челябинск);;;;656;682;740;693;770;722
10006953;Центральный филиал ФГБОУ ВО "Российский государственный университет правосудия" (г. Воронеж);;;;1 192;1 193;1 196;1 189;1 232;1285
10006954;Барнаульский филиал ФГОБУ ВО "Финансовый университет при Правительстве Российской Федерации" (Барнаульский филиал Финуниверситета);;;;1 423;937;929;829;714;586
10006955;Брянский филиал ФГОБУ ВО "Финансовый университет при Правительстве Российской Федерации";;;;1 214;825;;;;
10006956;Владимирский филиал ФГОБУ ВО "Финансовый университет при Правительстве Российской Федерации";;;;1 042;871;756;681;540;502
10006959;Краснодарский филиал ФГОБУ ВПО "Финансовый университет при Правительстве Российской Федерации";;;;1 120;944;976;979;944;917
10006960;Курский филиал ФГОБУ ВО "Финансовый университет при Правительстве Российской Федерации";;;;632;525;464;473;409;405
10006961;Липецкий филиал ФГОБУ ВО "Финансовый университет при Правительстве Российской Федерации";;;;1 817;1 467;1 421;1 406;1 281;1240
10006962;Новороссийский филиал ФГОБУ ВО "Финансовый университет при Правительстве Российской Федерации";;;;760;653;625;561;524;496
10006963;Орловский филиал ФГОБУ ВО "Финансовый университет при Правительстве Российской Федерации";;;;467;429;407;401;355;330
10006964;Пензенский филиал ФГОБУ ВО "Финансовый университет при Правительстве Российской Федерации";;;;577;479;469;440;439;442
10006965;Смоленский филиал ФГОБУ ВО "Финансовый университет при Правительстве Российской Федерации";;;;814;801;888;985;1 001;956
10006966;Тульский филиал ФГОБУ ВО "Финансовый университет при Правительстве Российской Федерации";;;;1 686;1 314;1 354;1 361;1 201;1141
10006967;Уфимский филиал ФГОБУ ВО "Финансовый университет при Правительстве Российской Федерации";;;;1 770;1 787;1 801;1 809;1 695;1626
10006968;Челябинский филиал ФГОБУ ВО "Финансовый университет при Правительстве Российской Федерации";;;;872;739;810;822;765;616
10006969;Ярославский филиал ФГОБУ ВО "Финансовый университет при Правительстве Российской Федерации";;;;990;726;617;679;708;763
10006970;Владикавказский филиал ФГОБУ ВО "Финансовый университет при Правительстве Российской Федерации";;;;852;877;937;1 017;1 021;964
10006971;Калужский филиал ФГОБУ ВО "Финансовый университет при Правительстве Российской Федерации";;;;1 683;1 360;1 158;1 078;912;812
10006972;Омский филиал ФГОБУ ВО "Финансовый университет при Правительстве Российской Федерации";;;;1 619;1 343;1 172;1 235;1 060;910
10006973;Санкт-Петербургский филиал ФГОБУ ВО "Финансовый университет при Правительстве Российской Федерации";;;;552;570;520;479;423;367
10006975;Филиал Международного института экономики и права в городе Астрахани;;;;2 269;;;;;
10006976;Филиал Международного института экономики и права в городе Белорецке;;;;2 507;;;;;
10006977;Филиал Международного института экономики и права в городе Владивостоке;;;;843;;;;;
10006978;Филиал Международного института экономики и права в городе Волгограде;;;;1 687;;;;;
10006979;Филиал Международного института экономики и права в городе Екатеринбурге;;;;402;;;;;
10006980;Филиал Международного института экономики и права в городе Киселевске;;;;2 267;;;;;
10006981;Филиал Международного института экономики и права в городе Магнитогорске;;;;558;;;;;
10006982;Филиал Международного института экономики и права в городе Мурманске;;;;;;;;;
10006983;Филиал Международного института экономики и права в городе Омске;;;;2 219;;;;;
10006984;Филиал Международного института экономики и права в городе Челябинске;;;;658;;;;;
10006985;Филиал Международного института экономики и права в городе Ярославле;;;;517;;;;;
10006986;Сибирский филиал Международного института экономики и права;;;;1 211;;;;;
10006987;Вологодский филиал ОО ВПО (частное учреждение) "Международная академия бизнеса и новых технологий (МУБиНТ)";;;;526;;;;;
10006988;Московский филиал РМАТ;;;;539;443;403;370;289;267
10006993;Филиал ФГБОУ ВО "Ивановский государственный политехнический университет" в г. Краснодаре;;;;;;;;;
10006994;Филиал ФГБОУ ВО "Ивановский государственный политехнический университет" в г. Нижнем Новгороде;;;;;;;;;
10006995;Филиал ФГБОУ ВПО "Ивановский государственный политехнический университет" в г. Рязани;;;;;;;;;
10006997;Институт сервиса и технологий (филиал) ФГБОУ ВПО "Донской государственнывй технический университет" в г. Пятигорске Ставропольского края;;;;898;732;465;;;
10006998;Технологический институт сервиса (филиал)ФГБОУ ВО "Донской государственный технический университет" в г. Ставрополе Ставропольского края;;;;1 538;1 467;1 398;1 304;1 164;1319
10006999;Институт сферы обслуживания и предпринимательства (филиал) ФГОУ ВО "Донской государтсвенный технический университет" в г. Шахты Ростовской области;;;;6 665;6 823;6 582;7 229;7 258;7204
10007017;Филиал ФГБОУ ВПО "Уральский государственный педагогический университет" в г. Красноуфимске;;;;;;;;;
10007018;Филиал ФГБОУ ВПО "Уральский государственный педагогический университет" в г. Серове;;;;;;;;;
10007029;Тольяттинский филиал Самарского национального исследовательского университета имени академика С.П. Королева;;;;;;;;;
10007043;филиал ФГБОУ ВО "Санкт-Петербургский государственный экономический университет" в г. Великие Луки Псковской области;;;;;;;;;
10007044;филиал ФГБОУ ВО "Санкт-Петербургский государственный экономический университет" в г. Калининграде;;;;;;;;;
10007045;Калужский филиал ФГБОУ ВО "Санкт-Петербургский государственный экономический университет";;;;275;;;;;
10007046;Кировский филиал ФГБОУ ВО "Санкт-Петербургский государственный экономический университет";;;;;;;;;
10007047;филиал ФГБОУ ВО "Санкт-Петербургский государственный экономический университет" в г. Сосновый Бор Ленинградской области;;;;;;;;;
10007048;филиал ФГБОУ ВО "Санкт-Петербургский государственный экономический университет" в г. Старая Русса Новгородской области;;;;;;;;;
10007049;филиал ФГБОУ ВО "Санкт-Петербургский государственный экономический университет" в г. Сыктывкар Республики Коми;;;;;;;;;
10007050;филиал ФГБОУ ВО "Санкт-Петербургский государственный экономический университет" в г. Тихвине Ленинградской области;;;;;;;;;
10110172;Филиал АНОО ВПО "Воронежский экономико-правовой институт" в г.Орел;;;;317;145;126;154;143;93
10110270;Орехово-Зуевский филиал НОУ ВПО "Институт экономики и предпринимательства";;;;;;;;;
10110303;Вышневолоцкий филиал ОАНО ВО "Международный славянский институт";;;;;;;;;
10110306;Калининградский филиал АНОО ВПО "Международный славянский институт";;;;;;;;;
10110307;Волгоградский филиал АНО ВО "Международный славянский институт";;;;432;;;;;
10110311;Ростовский-на-Дону филиал НОЧУ ВО МОСКОВСКАЯ АКАДЕМИЯ ПРЕДПРИНИМАТЕЛЬСТВА при Правительстве Москвы;;;;;;;;;
10110312;Пермский филиал НОЧУ ВО МОСКОВСКАЯ АКАДЕМИЯ ПРЕДПРИНИМАТЕЛЬСТВА при Правительстве Москвы;;;;;;;;;
10110322;Кировский филиал Московского гуманитарно-экономического института;;;;1 180;964;679;498;200;719
10110343;Филиал ОАНО ВО "Московский психолого-социальный университет" в станице Брюховецкая Краснодарского края;;;;;;;;;
10110356;Филиал ОАНО ВО "Московский психолого-социальный университет" в г.Одинцово Московской области;;;;;;;;;
10110385;Псковский филиал НОЧУ ВОП "Санкт-Петербургский институт управления и права";;;;;;;;;
10110397;Абаканский филиал НАЧОУ ВПО Современной гуманитарной академии;;;;;;;;;
10110405;Брянский филиал ЧОУ ВО Современной гуманитарной академии;;;;2 935;2 198;;;;
10110440;Самарский филиал ЧОУ ВО Современной гуманитарной академии;;;;;;;;;
10110442;Саранский филиал НАЧОУ ВПО Современной гуманитарной академии;;;;;;;;;
10110443;Саратовский филиал ЧОУ ВО Современной гуманитарной академии;;;;1 842;2 233;;;;
10110445;Северодвинский филиал ЧОУ ВО Современной гуманитарной академии;;;;;;;;;
10110446;Смоленский филиал ЧОУ ВО Современной гуманитарной академии;;;;170;;;;;
10110448;Сочинский филиал ЧОУ ВО Современной гуманитарной академии;;;;;;;;;
10110449;Старооскольский филиал НАЧОУ ВПО Современной гуманитарной академии;;;;;;;;;
10110450;Стерлитамакский филиал НАЧОУ ВПО Современной гуманитарной академии;;;;;;;;;
10110451;Сыктывкарский филиал НАЧОУ ВПО Современной гуманитарной академии;;;;;;;;;
10110452;Тамбовский филиал ЧОУ ВО Современной гуманитарной академии;;;;1 157;2 180;;;;
10110455;Улан-Удэнский филиал ЧОУ ВО Современной гуманитарной академии;;;;313;;;;;
10110457;Уфимский филиал ЧОУ ВО Современной гуманитарной академии;;;;1 053;103;;;;
10110458;Ухтинский филиал НАЧОУ ВПО Современной гуманитарной академии;;;;;;;;;
10110459;Хабаровский филиал ЧОУ ВО Современной гуманитарной академии;;;;;;;;;
10110460;Хасавюртовский филиал НАЧОУ ВПО Современной гуманитарной академии;;;;1 107;;;;;
10110462;Черкесский филиал НАЧОУ ВПО Современной гуманитарной академии;;;;707;;;;;
10110902;Магаданский филиал АНО ВПО "Российская академия предпринимательства";;;;300;;150;71;;
10110903;Новосибирский филиал АНО ВПО Российская академия предпринимательства;;;;;;;;;
10110906;Челябинский филиал АНО ВПО "Российская академия предпринимательства";;;;;;412;205;149;133
12000444;Коломенский институт (филиал) ФГБОУ ВПО "Московский государственный машиностроительный университет (МАМИ)" в г. Коломне Московской области;;;;1 435;;;;;
12000448;Рязанский институт (филиал) ФГБОУ ВПО "Московский государственный машиностроительный университет (МАМИ)";;;;2 214;;;;;
12000450;Губкинский институт (филиал) ФГБОУ ВПО "Московский государственный машиностроительный университет (МАМИ)" в г.Губкине Белгородской области;;;;;;;;;
12000452;Филиал ФГБОУ ВПО "Московский государственный машиностроительный университет (МАМИ)" в г.Воскресенске Московской области;;;;227;;;;;
12000459;филиал ФГБОУ ВПО "Московский государственный машиностроительный университет (МАМИ)" в г. Сафоново Смоленской области;;;;106;;;;;
12000463;Филиал ФГБОУ ВПО "Московский государственный машиностроительный университет (МАМИ)" в г. Прокопьевске Кемеровской области;;;;;;;;;
12000464;Филиал ФГБОУ ВПО "Московский государственный машиностроительный университет (МАМИ)" в г. Махачкале Республики Дагестан;;;;;;;;;
12000465;филиал ФГБОУ ВПО "Московский государственный машиностроительный университет (МАМИ)" в г. Смоленске;;;;;;;;;
12003257;Чебоксарский политехнический институт (филиал) ФГБОУ ВПО "Московский государственный машиностроительный университет (МАМИ)" в г.Чебоксары Чувашской Республики;;;;2 674;;;;;
12006915;Таганрогский филиал НОУ ВПО "Российский новый университет";;;;307;280;262;248;211;230
12006918;Александровский филиал НОУ ВПО "Российский новый университет";;;;409;;;;;
12006919;Волоколамский филиал НОУ ВПО "Российский новый университет";;;;;;;;;
12006920;Гагаринский филиал НОУ ВПО "Российский новый университет";;;;;;;;;
12006925;Орехово-Зуевский филиал ОЧУ ВО "Академия МНЭПУ";;;;;;;;;
12006927;Воскресенский филиал НОУ ВПО "Российский новый университет";;;;855;;;;;
12006928;Новоуренгойский филиал НОУ ВПО "Российский новый университет";;;;;;;;;
12006930;Кубанский институт социоэкономики и права (филиал) ОУ профсоюзов ВО "Академия труда и социальных отношений" (КубИСЭП (филиал) ОУП ВО "АТиСО");;;;;585;497;431;439;511
12006936;Волгоградский филиал ОУ профсоюзов ВО "Академия труда и социальных отношений";;;;;395;;;;
12006939;Красноярский филиал ОУ профсоюзов ВО "Академия труда и социальных отношений";;;;781;654;571;417;310;314
12006987;Филиал Международного института экономики и права в городе Петрозаводске;;;;1 338;;;;;
12006988;Рыбинский филиал ОО ВО (частное учреждение) "Международная академия бизнеса и новых технологий (МУБиНТ)";;;;;;;;;
12006989;Костромской филиал ОО ВПО (частное учреждение) "Международная академия бизнеса и новых технологий (МУБиНТ)";;;;134;;;;;
12006990;Волоколамский институт гостеприимства - филиал РМАТ;;;;113;;;;;
12006996;Центральный институт управления и экономики туристского бизнеса - филиал НОУ ВПО Российская международная академия туризма;;;;;;;;;
12007008;Владимирский филиал РМАТ;;;;;;;;;
12007010;Тульский филиал РМАТ;;;;;;;;;
12007011;Воскресенский институт туризма - филиал РМАТ;;;;124;104;92;107;115;109
12007013;Западно-Подмосковный институт туризма - филиал РМАТ;;;;318;409;395;360;274;224
12007014;Карельский институт туризма - филиал РМАТ;;;;;;;;;
12007015;Псковский филиал РМАТ;;;;229;159;152;134;115;132
