miccedu_id;clear_name;ind_2013_value;ind_2014_value;ind_2015_value;ind_2016_value;ind_2017_value;ind_2018_value;ind_2019_value;ind_2020_value;ind_2021_value
1;Адыгейский государственный университет;;;130;121;101;105;94;87;100
2;Алтайская государственная педагогическая академия;;;93;97;109;96;85;91;93
3;Алтайский государственный технический университет им. И.И. Ползунова;;;199;178;117;120;109;97;120
4;Алтайский государственный университет;;;269;260;254;284;282;304;329
5;Амурский государственный университет;;;76;68;66;62;62;66;74
6;Амурский гуманитарно-педагогический государственный университет;;;40;36;21;15;9;12;12
7;Ангарская государственная техническая академия;;;11;10;5;7;9;7;12
9;Армавирская государственная педагогическая академия;;;90;180;217;245;220;193;184
11;Астраханский государственный университет;;;235;208;163;150;145;152;181
12;Байкальский государственный университет экономики и права;;;486;347;306;243;207;188;207
13;Балтийский государствнный технический университет ВОЕНМЕХ им. Д.Ф. Устинова;;;128;135;138;135;121;106;132
14;Башкирский государственный педагогический университет им. М. Акмуллы;;;188;189;195;171;149;148;134
15;Башкирский государственный университет;;;593;583;496;438;368;360;395
16;Белгородский государственный технологический университет им. В.Г. Шухова;;;457;449;480;416;330;340;312
17;Белгородский государственный национальный исследовательский университет;;;680;1 093;1 186;1 079;1 289;1 490;1748
19;Алтайская государственная академия образования имени В.М. Шукшина;;;37;38;37;27;24;15;23
21;Благовещенский государственный педагогический университет;;;28;21;23;26;30;27;27
23;Братский государственный университет;;;163;123;61;51;36;17;37
24;Брянская государственная инженерно-технологическая академия;;;31;27;17;34;40;42;53
25;Брянский государственный технический университет;;;149;115;112;120;113;97;104
26;Брянский государственный университет имени академика И.Г. Петровского.;;;130;121;99;107;98;109;118
27;Бурятский государственный университет;;;271;403;387;281;278;271;283
28;Владивостокский государственный университет экономики и сервиса;;;311;256;197;68;56;58;60
30;Владимирский государственный университет имени Александра Григорьевича и Николая Григорьевича Столетовых;;;380;348;323;260;225;240;250
33;Волгоградский государственный архитектурно-строительный университет;;;204;;;;;;
34;Волгоградский государственный социально-педагогический университет;;;160;;80;45;34;30;47
35;Волгоградский государственный технический университет;;;245;245;298;286;270;256;267
36;Волгоградский государственный университет;;;269;211;168;161;153;164;189
39;Вологодский государственный университет;;;123;98;59;35;27;26;45
40;Воронежский государственный лесотехнический университете имени Г.Ф. Морозова;;;59;73;88;80;84;98;108
41;Воронежский государственный университет инженерных технологий;;;137;111;98;64;50;42;45
42;Воронежский государственный архитектурно-строительный университет;;;221;;;;;;
43;Воронежский государственный педагогический университет;;;87;104;105;98;82;90;110
44;Воронежский государственный технический университет;;;225;203;361;351;348;347;338
45;Воронежский государственный университет ;;;652;733;697;611;577;559;570
46;Восточно-Сибирский государственный университет технологий и управления;;;219;199;147;130;90;76;75
48;Высшая школа народных искусств (институт);;;19;16;4;3;6;12;16
49;Вятский государственный гуманитарный университет;;;197;;;;;;
50;Вятский государственный университет;;;151;340;306;296;300;271;211
51;Гжельский государственный художественно-промышленный институт;;;26;25;30;44;44;41;59
52;Глазовский государственный педагогический институт имени В.Г. Короленко;;;17;8;5;3;3;8;10
53;Горно-Алтайский государственный университет;;;66;57;50;42;38;30;30
54;Государственная академия славянской культуры;;;14;;;;;;
55;Государственная классическая академия имени Маймонида;;;;;;;;;
56;Государственная полярная академия;;;50;;;;;;
57;Государственный академический университет гуманитарных наук;;;88;75;78;51;49;44;47
58;Государственный институт русского языка им. А.С. Пушкина;;;72;77;80;64;70;80;88
59;Национальный исследовательский технологический университет МИСиС;;;483;461;419;510;523;545;554
60;Государтвенный университет управления;;;625;509;321;282;187;184;232
61;Грозненский государственный нефтяной технический университет имени академика М.Д. Миллионщикова;;;42;56;61;59;53;57;55
62;Дагестанский государственный педагогический университет;;;201;202;183;166;111;111;85
63;Дагестанский государственный технический университет;;;167;157;167;100;91;88;83
64;Дагестанский государственный университет;;;225;210;178;169;144;143;150
66;Приамурский государственный университет имени Шолом-Алейхема;;;36;25;24;15;11;5;9
67;Дальневосточный государственный гуманитарный университет;;;;;;;;;
70;Донской государственный технический университет;;;200;189;363;315;266;296;384
72;Елецкий государственный университет им. И.А. Бунина;;;137;121;96;85;72;67;58
76;Ивановский государственный университет;;;128;111;90;68;75;55;60
77;Ивановский государственный химико-технологический университет;;;129;97;76;74;59;57;47
78;Ивановский государственный энергетический университет имени В.И. Ленина;;;67;53;31;28;19;14;26
79;Ижевский государственный технический университет имени М.Т. Калашникова;;;196;185;172;166;159;124;119
80;Ингушский государственный университет;;;200;281;252;177;208;228;255
82;Иркутский национальный исследовательский технический университет;;;473;444;371;337;311;296;294
83;Иркутский государственный университет;;;365;173;182;206;190;193;210
85;Кабардино-Балкарский государственный университет им. Х.М. Бербекова;;;246;569;528;536;631;718;732
86;Казанский государственный архитектурно-строительный университет;;;133;118;98;118;109;125;158
87;Казанский национальный исследовательский технический университет им. А.Н.Туполева-КАИ;;;462;453;392;332;285;294;296
88;Казанский национальный исследовательский технологический университет;;;593;591;550;484;426;381;345
91;Казанский государственный энергетический университет;;;147;132;112;91;80;66;78
92;Калмыцкий государственный университет;;;324;329;211;153;171;137;145
93;Калужский государственный университет им. К.Э. Циолковского;;;121;110;91;87;68;70;98
95;Камчатский государственный университет имени Витуса Беринга;;;39;35;27;21;20;17;
96;Северо-Кавказская государственная гуманитарно-технологическая академия;;;85;111;77;88;86;86;93
97;Карачаево-Черкесского государственного университета имени У.Д. Алиева;;;97;100;90;95;90;73;62
99;Кемеровский государственный университет;;;202;199;187;197;246;196;194
100;Кемеровский технологический институт пищевой промышленности;;;241;194;98;73;;;
101;Ковровская государственная технологическая академия имени В.А.Дегтярева;;;25;22;13;16;8;1;1
103;Комсомольский-на-Амуре государственный технический университет;;;69;81;68;65;62;52;51
104;Костромской государственный технологический университет.;;;84;61;184;176;165;166;178
105;Костромской государственный университет имени Н.А. Некрасова;;;159;;;;;;
106;Красноярский государственный педагогический университетим. В.П. Астафьева;;;202;199;271;210;191;167;137
108;Кубанский государственный технологический университет;;;208;208;197;224;269;274;290
109;Кубанский государственный университет;;;481;424;453;416;340;313;330
111;Кузбасский государственный технический университет имени Т.Ф.Горбачева;;;116;111;87;74;89;89;106
112;Курганский государственный университет;;;89;89;67;61;65;55;54
113;Юго-Западный государственный университет;;;393;404;384;343;365;385;367
114;Курский государственный университет;;;189;183;130;116;102;87;113
116;Липецкий государственный педагогический университет;;;93;70;35;34;26;27;25
117;Липецкий государственный технический университет;;;160;156;126;130;128;118;116
118;Литературный институт имени А.М. Горького;;;19;22;27;40;49;43;47
119;МАТИ - Российский государственный технологический университет имени К.Э. Циолковского;;;;;;;;;
120;Магнитогорский государственный технический университет им. Г.И. Носова;;;254;239;174;169;150;143;149
122;Майкопский государственный технологический университет;;;153;122;55;72;95;112;123
123;Поволжский государственный технологический университет;;;266;206;193;133;94;94;101
124;Марийский государственный университет;;;91;109;121;128;143;150;153
126;Мордовский государственный педагогический институт имени М.Е. Евсевьева;;;99;94;94;97;83;66;61
127;Мордовский государственный университет им. Н.П. Огарёва;;;568;880;860;798;828;837;886
129;Московский государственный университет тонких химических технологий имени М.В. Ломоносова;;;176;;;;;;
130;Московский государственный юридический университет имени О.Е. Кутафина;;;324;293;262;218;187;229;245
131;Московский авиационный институт (национальный исследовательский университет);;;459;590;462;553;543;561;564
132;Московский автомобильно-дорожный государственный технический университет (МАДИ);;;235;183;156;142;124;105;159
133;Московский архитектурный институт (государственная академия);;;60;58;58;39;51;54;53
134;МИРЭА - Российский технологический университет;;;286;529;613;588;580;554;554
136;Московский государственный горный университет;;;;;;;;;
137;Московский государственный гуманитарный университет имени М.А. Шолохова;;;;;;;;;
138;Московский государственный индустриальный университет;;;;;;;;;
140;Национальный исследовательский университет МИЭТ;;;235;236;215;206;189;189;180
141;Московский государственный лингвистический университет;;;217;198;170;158;146;140;140
143;Московский государственный гуманитарно-экономический университет;;;21;18;12;16;13;16;13
144;Московский государственный строительный университет;;;482;464;382;384;387;387;443
146;Московский государственный машиностроительный университет (МАМИ);;;337;;;;;;
147;Московский государственный технический университет имени Н.Э. Баумана;;;910;946;869;875;843;941;880
148;Московский государственный технологический университет СТАНКИН;;;304;259;237;309;324;311;329
149;Московский государственный университет экономики, статистики и информатики (МЭСИ);;;;;;;;;
150;Московский государственный университет геодезии и картографии (МИИГАиК);;;135;118;85;65;68;81;101
151;Российский государственный университет им. А.Н. Косыгина (Технологии. Дизайн. Искусство);;;213;185;175;150;149;160;215
153;Московский государственный университет леса;;;115;;;;;;
154;Московский государственный университет печати имени Ивана Федорова;;;130;;;;;;
155;Московский государственный университет пищевых производств;;;285;;223;118;192;294;424
156;Московский государственный университет приборостроения и информатики;;;;;;;;;
158;Московский государственный университет технологий и управления имени К.Г.Разумовского;;;259;171;105;82;70;101;101
159;Московская государственная художественно-промышленная академия имени С.Г. Строганова;;;41;47;41;39;42;44;64
160;Московский педагогический государственный университет;;;570;840;596;491;499;399;503
161;Московский физико-технический институт (государственный университет);;;655;789;847;889;895;856;855
162;Национальный исследовательский университет МЭИ;;;610;651;673;647;608;583;576
163;Мурманский арктический государственный университет;;;42;39;36;48;43;49;58
164;Набережночелнинский институт социально-педагогических технологий и ресурсов;;;26;40;36;44;53;25;27
165;Национальный исследовательский ядерный университет МИФИ;;;489;582;601;611;594;562;577
166;Нижегородский  осударственный архитектурно-строительный университет;;;92;64;39;33;34;40;37
167;Нижегородский государственный лингвистический университет им. Н.А.Добролюбова;;;95;98;83;60;42;41;39
168;Нижегородский государственный педагогический университет имени Козьмы Минина (Мининский университет);;;138;124;91;82;69;74;77
169;Нижегородский государственный технический университет им. Р.Е. Алексеева;;;378;407;358;291;276;280;278
170;Нижегородский государственный университет им. Н.И.Лобачевского;;;752;812;769;692;635;583;571
172;Нижнетагильская государственная социально-педагогическая академия;;;;;;;;;
173;Новгородский государственный университет имени Ярослава Мудрого.;;;220;488;436;325;302;285;276
174;Новосибирская государственная архитектурно-художественная академия;;;30;29;29;23;33;28;39
175;Новосибирский государственный архитектурно-строительный университет (Сибстрин);;;61;53;45;45;48;49;61
176;Новосибирский государственный педагогический университет;;;145;143;145;118;116;122;138
177;Новосибирский государственный технический университет;;;385;413;382;444;423;392;409
178;Новосибирский национальный исследовательский государственный университет;;;275;327;355;380;407;403;453
179;Новосибирский государственный университет экономики и управления НИНХ;;;122;108;118;127;116;139;135
180;Норильский индустриальный институт;;;39;47;45;42;28;26;34
181;Омский государственный институт сервиса;;;38;;;;;;
182;Омский государственный педагогичесий университет;;;128;116;102;81;70;67;69
183;Омский государственный технический университет;;;298;267;292;243;240;228;227
184;Омский государственный университет им. Ф.М. Достоевского;;;204;215;200;188;164;154;173
185;Оренбургский государственный институт менеджмента;;;;;;;;;
186;Оренбургский государственный педагогический университет;;;81;73;48;43;28;32;41
187;Оренбургский государственный университет;;;217;193;156;167;162;140;143
189;Орловский государственный институт экономики и торговли;;;61;48;26;22;12;2;5
190;Государственный университет-учебно-научно-производственный комплекс;;;196;;;;;;
191;Орловский государственный университет;;;274;430;527;406;411;388;438
192;Пензенский государственный технологический университет;;;85;75;49;44;40;42;43
194;Пензенский государственный университет;;;469;569;549;482;453;511;593
195;Пензенский государственный университет архитектуры и строительства;;;80;72;69;68;70;58;69
196;Пермский государственный гуманитарно-педагогический университет;;;119;100;86;83;112;96;102
197;Пермский национальный исследовательский политехнический университет;;;583;589;498;448;486;500;495
198;Пермский государственный национальный исследовательский университет;;;239;235;205;191;216;240;263
199;Петрозаводский государственный университет;;;144;347;327;168;184;151;136
201;Поволжская государственная социально-гуманитарная академия;;;190;155;114;97;78;78;84
202;Поволжский государственный университет сервиса;;;66;50;27;20;9;7;15
206;Пущинский государственый естественно-научный институт;;;31;26;24;15;9;4;13
207;Пятигорский государственный лингвистический университет;;;202;155;148;117;100;91;70
209;Российский экономический университет имени Г.В. Плеханова;;;470;595;531;467;442;417;444
210;Российский государственный геологоразведочный университет имени Серго Орджоникидзе;;;126;126;102;79;54;51;55
211;Российский государственный гидрометеорологический университет;;;98;135;85;60;38;42;37
212;Российский государственный гуманитарный университет;;;435;311;265;245;207;184;176
213;Российский государственный педагогический университет им. А. И. Герцена;;;741;732;737;712;666;716;838
214;Российский государственный профессионально-педагогический университет;;;50;45;35;31;22;23;33
215;Российский государственный социальный университет;;;310;206;157;172;140;132;161
217;Балтийский федеральный университет имени Иммануила Канта;;;529;555;484;481;520;505;552
219;Российский государственный университет нефти и газа имени И.М. Губкина;;;436;413;385;432;421;406;430
220;Российский государственный университет туризма и сервиса;;;59;31;15;9;11;11;6
222;Российский университет дружбы народов;;;1 779;2 926;2 947;2 801;3 185;3 147;3458
223;Российский химико-технологический университет имени Д.И. Менделеева;;;275;360;335;308;296;295;312
227;Ростовский государственный строительный университет;;;370;;;;;;
228;Ростовский государственный экономический университет(РИНХ);;;252;246;228;203;223;204;240
229;Рыбинский государственный авиационный технический университет имени П.А. Соловьева;;;117;78;48;59;65;62;59
230;Рязанский государственный радиотехнический университет;;;152;131;112;124;108;96;104
231;Рязанский государственный университет имени С.А. Есенина;;;102;122;130;116;122;117;124
232;Санкт-Петербургский государственный лесотехнический университет имини С.М.Кирова;;;124;121;112;101;53;42;38
