1938;Гуманитарный институт телевидения и радиовещания им. М. А. Литовчина;10,52;14,96;;9,96;9,81;7,23;5,68;5,25;3,91
1940;Дальневосточный институт психологии и психоанализа;;23,13;;;;;;;
1941;Дербентский гуманитарный институт;31,95;19,57;21,71;30,68;;;;;
1942;Институт технологии и бизнеса;28,45;40,91;;;;;;;
1943;Московский университет имени С.Ю. Витте;29,86;34,89;;13,4;15,49;17,14;9,27;7,16;3,36
1944; Национальный Институт Дизайна;14,7;;;23,16;21,6;12,09;11,39;9,32;7,36
1945;Санкт-Петербургский институт психологии и акмеологии;10,95;15,3;;;;;;;
1946;Московский институт психоанализа;30,35;24,25;16,63;17,72;11,27;10,29;8,97;9,05;6,81
1947;Нижегородская правовая академия;4,1;11,04;;17,21;7,12;7,44;;;
1948;Южный институт менеджмента;6,37;;5,82;5,58;4,69;4,87;5,06;26,29;
1949;Сибирская академия права, экономики и управления;;13,62;;27,35;;;;;
1950;Столичный институт иностранных языков;13,79;15,21;;;;;;;
1951;Волгоградский институт экономики, социологии и права;12,94;;13,53;;;;;;
1952;Московский финансово-юридический университет МФЮА;12,62;13,53;;14,63;12,71;12,84;18,03;20,85;17,26
1953;Медицинский университет Реавиз;36,17;35,92;31,07;24,51;11,22;13,45;14,18;4,99;5,01
1954;Институт телевидения, бизнеса и дизайна;6,27;;;;;12,51;;;
1955;Московский институт энергобезопасности и энергосбережения;46,63;64,2;65,05;59,24;834,64;;;;
1956;Русский институт управления имени В.П. Чернова;16,88;;;;;;;;
1957;Вологодский институт бизнеса;12,63;18,23;24,99;30,93;;;;;
1958;Омская юридическая академия;8,65;20,4;21,16;21,16;19,12;18,54;18,88;5,08;5,51
1959;Санкт-Петербургский университет технологий управления и экономики;8,58;12,51;;7,53;5,79;4,91;5,04;4,32;4,1
1960;Московский социально-педагогический институт;8,43;13,33;8,05;9,68;5,31;4,21;4,29;3,95;3,24
1961;Национальный Институт имени Екатерины Великой;23,56;;;;6,64;6,33;8,41;;
1962;Сибирский независимый институт;18,34;22,93;23,36;25,25;32,09;39,48;;;
1963;Международный юридический институт;14,72;17,29;;13,36;13,79;8,49;7,75;43,92;39,62
1964;Первый московский юридический институт;34,94;40,34;172,94;22,25;5,3;;;;
1965;Институт менеджмента, маркетинга и права;;170,14;;3000;;;;;
1966;Индустриальный институт;13,34;35,29;;21,94;;;;;
1967;Московская высшая школа социальных и экономических наук;23,26;19,12;16,66;13,08;12,52;6,05;5,95;9,62;6,74
1968;Сибирский институт бизнеса и информационных технологий;10,33;14,58;11,07;11,17;9,39;7,93;6,63;6,18;
1969;Московский институт права;11,17;;;;;;;;
1970;Международный институт ИНФО-Рутения;25,35;;;;;;;;
1971;ЮЖНЫЙ УНИВЕРСИТЕТ (ИУБиП);8,07;7,37;7,26;6,24;12,1;8,79;11,83;13,04;10,82
1972;Новосибирский институт экономики и менеджмента;23,96;;;;;;;;
1973;Московский экономический институт;16,61;22,69;22,38;18,85;6,36;5,39;3,01;3,18;4,16
1974;Миссионерский институт;;;;;;34,27;35,92;39,07;40,16
1975;Тульский институт управления и бизнеса имени Никиты Демидовича Демидова;8,88;17,39;23,73;15,59;34,59;64,2;32,67;34,67;33,02
1976;Международный институт менеджмента ЛИНК;24,23;18,6;18,01;17,77;;30,68;;;
1977;Санкт-Петербургская юридическая академия;9,36;13,03;;13,82;13,21;11,55;10,59;9,68;11,98
1978;Самарский институт бизнеса и управления;6,1;15,48;;;;;;;
1979;Южно-Сахалинский институт экономики, права и информатики;9,04;16,11;14,76;16,31;24,24;31,24;;;
1981;Московский институт мировой экономики и международных отношений;10,99;;;;;;;;
1982;ИНСТИТУТ ТЕАТРАЛЬНОГО ИСКУССТВА им. П.М. ЕРШОВА;;81,49;;20,48;12,98;11,01;7,58;8,34;
1983;Смольный институт Российской академии образования;32,1;;43,72;45,24;46,16;36,85;33,67;;
1984;Московский финансово-правовой интитут;10,79;18;;;;;;;
1985;Российская школа частного права;12,5;13,02;;;;;;;
1986;Сергиево-Посадский гуманитарный институт;22,45;;22,78;36,56;66,08;;;;
1987;Московский институт управления;10,74;13,81;;;;;;;
1988;Владикавказский институт управления;8,95;16;18,12;;;39,2;47,28;46,96;36,34
1990;Межрегиональный институт экономики и права;23,11;25,9;21,65;9,6;9,18;8;5,82;5,23;5,41
1991;Восточно-Сибирский институт экономики и права;13,42;;;33,9;31,21;31,41;26,9;28,33;27,23
1992;Московский институт банковского дела;10,65;13,54;;;;;;;
1994;Институт экономики и управления;18,5;;;48,82;60,51;77,37;110,08;157,68;135,05
1995;Московский Институт Телевидения и Радиовещания Останкино;10,77;5,93;3,64;3,25;2,5;;;;
1996;Международный институт компьютерных технологий;10,87;14,09;14,39;15,74;14,3;13,22;11,4;14,01;11,71
1997;Московский институт физической культуры и спорта;11,69;13,73;;;;;;;
1998;Подольский социально-спортивный институт;68,94;69,54;70,5;73,03;25,37;;;;
1999;Балаковский институт бизнеса и управления;28,51;35,61;;;;;;;
2000;ИНСТИТУТ ДРУЖБЫ НАРОДОВ КАВКАЗА;11,54;;12,56;11,45;11,37;18,2;19,51;25,39;26,98
2001;Московский экономико-финансовый институт;10,58;14,75;;;;;;;
2002;Невский институт языка и культуры;;42,38;;9,38;;;10,69;9,26;8,69
2003;Московский институт юриспруденции;10,9;15,24;;;;;;;
2004;Негосудрственное Алтайский экономико-юридический институт;18,93;20,09;19,71;25,06;25,45;;;;
2005;Прикамский социальный институт;40,65;36,79;24,61;20,15;;12,4;11,69;10,79;10,9
2007;Сибирский институт международных отношений и регионоведения;14,26;;21,67;29,14;25,41;25,38;12,1;;
2008;Волгоградский институт бизнеса;23,61;47,29;46,12;56,82;58,8;57,16;17,81;22,29;16,88
2009;Негосударственное Армавирский лингвистический социальный институт;11,69;30,67;27,8;24,99;32,76;37,85;33,1;22,98;23,1
2010;Институт гостиничного и туристического менеджмента;21,39;;;;;;;;
2011;Московский архитектурно-строительный институт;12,65;34,78;24,48;17,68;;;;;
2012;Международный гуманитарно-лингвистический институт;19,92;13,01;;29,17;6,96;9,58;13,2;9,35;9,12
2015;Пермский институт муниципального управления;0;;;;;;;;
2016;Институт менеджмента и рынка;53,13;;;;;;;;
2017;ТУЛЬСКИЙ УНИВЕРСИТЕТ (ТИЭИ);14;13,51;15,37;10,56;5,91;11,61;25,89;;8,87
2018;Санкт–Петербургский медико-социальный институт;10,55;;;;5,82;7,51;6,85;11,12;4,45
2019;Уральский институт коммерции и права;7,6;14,5;;13,5;;55,66;50,5;49,64;
2022;Владикавказский институт Моды и Дизайна;14,51;18,95;25,27;;;;;;
2023;Высшая школа бизнеса, безопасности и управления;;115,17;;;;;;;
2024;Омский институт международного менеджмента и иностранных языков Ин.яз. - Омск;52,03;27,31;42,24;;;;;;
2025;Сибирский университет потребительской кооперации;14,37;18,44;21,18;24,66;22,51;24,69;23,5;23,65;20,93
2026;Международная Гуманитарно-Техническая Академия (институт);37,51;;;32,9;;;;;
2027;Московская международная академия;9,33;14,11;;20,25;8,38;7,85;8,61;7,28;11,87
2028;Московский институт государственного управления и права;;;8,47;;5,03;17,74;19,5;;
2029;Институт современных технологий и экономики;45,17;29,25;;;;;;;
2030;Евразийский институт экономики, менеджмента, информатики;30,25;38,21;;;;;;;
2032;Ростовский институт иностранных языков;10,8;12,97;;;;;;;
2033;Открытый технологический институт;8,58;;;9,96;;;;37,08;14,88
2034;Институт социально-экономического прогнозирования и моделирования;22,56;24,28;25,05;20,02;22,44;;;;
2035;Сибирский институт бизнеса, управления и психологии;19,7;;16,34;17,32;22,82;23,79;20,03;20,06;11,47
2036;Новый гуманитарный институт;19,81;26,19;35;42,71;44,3;46,9;38,79;;
2039;Столичный институт переводчиков;11,29;;;;;;;;
2040;Казанский институт финансов, экономики и информатики;36,08;14,73;47,22;42,56;29,17;41,17;61,93;;
2041;Челябинский институт экономики и права им. М.В. Ладошина;17,36;18,95;12,86;16,64;53,97;;;;
2042;Институт специальной педагогики и психологии;9,21;13,3;;19,73;;51,34;;;
2043;Балтийский Гуманитарный Институт;;;;33,67;36,3;44,01;61,13;61,63;42,94
2044;Институт бизнеса, информационных технологий и финансов;13,56;;;;;;;;
2045;Московская академия творчества;7,27;17,33;;;;;;;
2046;Московский технологический институт ВТУ;10,38;21,74;17,8;2,19;2,19;1,84;;;
2047;Московский финансово-экономический инcтитут;13,73;18,54;;21,03;12,86;11,82;4,79;;
2048;Институт экономики;24,77;23,86;39,73;3892,14;;;;;
2049;Институт экономики и управления (г. Пятигорск);9,83;16,89;;18,72;;;;;
2050;Рязанский институт открытого образования;16,17;25,61;;;;;;;
2051;Томский экономико-юридический институт;16,87;29,2;;14,35;;;;;
2052;Экономико-правовой институт;18,35;;;;;;;;
2053;Институт международных экономических связей;21,15;15,08;;13,86;12,95;11,52;5,64;6,22;4,17
2054;Санкт-Петербургский институт гуманитарного образования;13,86;;;;;;;;
2055;Московский университет государственного управления;20,05;18,37;21,21;28,42;;;;;
2056;Кисловодский институт экономики и права;21,83;32,33;41,6;;;;;;
2057;Невский институт управления и дизайна;37,59;22,9;20,38;17,45;;;;;
2059;АЛТАЙСКАЯ АКАДЕМИЯ ЭКОНОМИКИ И ПРАВА (ИНСТИТУТ);10,03;17,98;17,27;16,51;;;;;
2060;Межрегиональный открытый социальный институт;9,09;15,79;15,9;12,61;16,22;14,93;38,03;100,69;90,33
2062;Институт Индустрии Моды;18,33;;;;;;;;
2063;Санкт-Петербургский институт экономики и управления;16,82;;;;28,19;32,45;52,38;45,69;39,17
2064;Калининградский институт управления;11,48;;;;38,6;43,03;12,74;11,76;10,84
2065;Сантк-Петербургский Гуманитарный университет профсоюзов;;15,64;;;17,82;18,3;17,56;14,44;13,67
2066;Владимирский институт туризма и гостеприимства;;24,5;26,1;31,46;37,18;;;;
2067;Уральский институт экономики, управления и права;17,28;16,2;13,22;6,43;29,73;2048,57;71,88;112,91;54,11
2068;Московский институт предпринимательства и права;15,57;23,53;;;;;;;
2069;ростовский международный институт экономики и управления;9,38;13,88;7,05;8,86;;;;;
2070;Ростовский институт защиты предпринимателя;;18,5;20,04;;26,51;31,45;43,54;38,39;28,61
2071;Региональный финансово-экономический институт;3,75;6,43;7,33;6,83;17,55;41,1;113,4;185,26;
2072;Среднерусский гуманитарно-технологический институт;60,33;21,58;22,58;17,37;30,13;18,47;22,53;19,69;19,74
2073;Московский гуманитарный институт имени Е.Р.Дашковой;5,58;14,17;17,47;14,64;;;;;
2074;Кавказский светский институт;18,76;;;;;;;;
2075;Западно-Сибирский Институт Финансов и Права;22,7;21,45;;;;;;;
2076;Московский новый юридический институт;12,19;17,66;;;;;;;
2077;Томский заочный финансово-юридический институт;;237,5;;146,15;;;;;
2078;Российская экономическая школа (институт);6,2;8,26;14,45;14,72;12,97;12,01;12,12;12,45;11,5
2079;Санкт-Петербургский институт внешнеэкономических связей, экономики и права;17,83;20,84;;32,41;34,92;41,3;182,75;;
2080;Институт бизнеса и права;14,98;;;;;;;;
2081;Сочинский институт моды, бизнеса и права ;;38,88;44,19;41,68;37,57;29,74;;;
2082;Институт управления;19,28;;;27,7;31,4;39,29;32,95;32,57;6,97
2083;Гуманитарно-экономический и информационно-технологический институт;42,58;34,98;;;;;;;
2084;МЕЖДУНАРОДНЫЙ УНИВЕРСИТЕТ В МОСКВЕ;21,69;30,72;42,38;36,81;22,25;11,83;7,63;5,55;4,23
2085;Московская гуманитарно-техническая академия;8,18;15,58;10,13;12,85;13,18;13,32;13,41;;
2086;Экономико-юридический институт;7,69;;;;;;;;
2087;СИБИРСКАЯ АКАДЕМИЯ УПРАВЛЕНИЯ И МАССОВЫХ КОММУНИКАЦИЙ (ИНСТИТУТ);13,02;;;28,96;;;;;
2089;Международный еврейский институт экономики, финансов и права;29,48;;;135,88;106,16;82,85;58,1;45,59;67,08
2090;Институт международных экономических отношений;35,56;;111,19;;;;;;
2092;Приамурский институт агроэкономики и бизнеса;11,1;14,3;;39,77;;;283,63;1032,4;
2093;Белгородский инженрено-экономический институт;15,2;20,59;24,4;;;;;;
2094;Дагестанская академия образования и культуры;19,4;25,18;;32,42;36,76;50,07;76,34;94,95;
2095;Уральский гуманитарный институт;13,41;16,8;16,53;20,54;;;;;
2096;Институт государственного администрирования;9,34;;;;;9,47;10,86;15,94;11,17
2151;Московский государственный психолого-педагогический университет;7,69;13,21;10,26;10,24;9,91;9,39;9,15;8,79;8,97
2155;Московская государственная академия делового администрирования;5,48;;;;;;;;
2183;Московский городской педагогический университет;9,4;14,76;16,98;22,28;20,85;18,56;19,04;18,46;17,08
2189;Московский институт открытого образования;298,65;;;;;;;;
2197;Институт искусства реставрации;26,5;23,99;21,86;;;69,41;0;;
2198;Ивановский государственный политехнический университет;16,63;20,05;21,22;22;26,81;30,64;37,46;37,54;37,61
5516;Крымский инженерно-педагогический университет;;;;;6,47;6,6;6,77;6,85;6,72
5517;Крымский университет культуры, искусств и туризма;;;;5,78;7,98;8,67;10,27;11,28;
5518;Крымский институт бизнеса;;;;;;;;;
5519;Образовательная организация высшего образования Университет экономики и управления;;;;;;23,83;25,54;29,1;17,01
5542;Керченский государственный морской технологический университет;;;;;;;;;
5572;Профессиональный институт управления;;10,29;;;;;;;
5616;Институт иностранных языков;;11,14;;40,89;68,95;;;;
5618;Санкт-Петербургский институт искусств и реставрации;;17,52;;8,77;;5,99;42,6;5,31;26,81
5625;Северо-Западный открытый технический университет;;10,02;;5,97;;7,5;7,68;;
5631;Московский институт управления;;20,59;;;;;;;
5635;Московский институт государственного и муниципального управления;;9,97;;;;;;;
5636;Московский институт психологии;;10,18;;;;;;;
5637;Московский юридический институт;;17,41;;;;;;;
5664;Институт языков и культур имени Льва Толстого;;244,48;;;105,38;;;;
5675;Сколковский институт науки и технологий;;;;;;;;;
5802;Московский исламский институт;;29,15;30,29;31,7;;;;;
5961;Пензенская духовная семинария Пензенской Епархии Русской Православной Церкви;;;;;;;51,01;49,83;42,55
100256;Санкт-Петербургский государственный экономический университет;5,42;7,19;9,17;10,8;12,05;12,07;11,95;12,24;12,06
100345;Исследовательский центр частного права имени С.С. Алексеева при Президенте Российской Федерации;;;;17,01;13,66;12,99;18,23;18,38;24,14
110134;Мордовский гуманитарный институт;5,68;;;;18,5;23,71;;;
110135;Институт международных связей;18,62;14,75;14,4;11,34;;22,5;25,86;32,13;38,42
110136;Институт права и экономики;13,78;;17,8;36,75;58,78;;;;
110138;Академический Гуманитарный Институт;15,09;;;;;;;;
110139;Академический институт прикладной энергетики;96,35;134,58;192,56;392,21;603,11;968,64;;;
110140;Академический международный институт;9,69;13,62;;19,43;;;;;
110141;Академический правовой институт;;13,37;;11,98;;;;;
110142;Академия гражданской защиты и медицины катастроф;;9,52;;;;;;;
110144;Академия социального образования;6,74;15,88;19,63;30,78;39,2;43,8;65,6;55,75;66,13
110145;Академия социального управления;12,12;15,3;15,51;17,22;16,07;15,61;19,72;23,22;24,81
110147;Академия сферы социальных отношений;35,18;;;;;;;;
110148;Академия труда и социальных отношений;14,34;19,27;;24,12;24,11;24,02;26,37;24,97;23,56
110152;Алтайский институт финансового управления;19,09;18,98;15,06;14,41;;;;;
110153;Альметьевский государственный институт муниципальной службы;26,5;;;;;;;;
110154;Альметьевский государственный нефтяной институт;17,04;19,07;19,71;23,51;10,56;11,45;12,58;13,54;15,58
110155;Астраханский инженерно-строительный институт;15,43;27,01;28,02;34,35;37,78;38,07;37,62;33,48;31,91
110156;Байкальский гуманитарный институт;10,03;;;;11,64;;54,2;131,13;104,87
110157;Байкальский экономико-правовой институт;;;;;;20,99;33,51;;
110158;Балтийский институт иностранных языков и межкультурного сотрудничества;26,99;31,63;;31,21;37,45;45,91;;;
110159;Балтийский институт экологии, политики и права;23,41;30,86;;14,13;26,15;34,93;;;
110160;Башкирская академия государственной службы и управления при Президенте Республики Башкортотстан;13,89;13,18;10,74;8,98;8,29;10,3;17,28;37,34;40,62
110161;Белгородский государственный институт искусств и культуры (БГИИК);18,73;25,59;25,17;25,83;25,47;23,38;23,61;24,2;24,2
110162;Владикавказский   институт   экономики, управления    и  права (г. Владикавказ);11,86;42,97;40,54;78,23;;;;;
110163;Владимирский институт бизнеса (ВИБ);30,7;49,26;;;;;;;
110164;Волгоградский государственный институт искусств и культуры;21,62;;29,56;32,35;25,8;24,79;24,76;18,36;16,74
110165;Волгоградская консерватория (институт) имени П.А.Серебрякова;42,38;;43,32;32,92;35,74;38,01;59,27;54,09;46,07
110166;Волгоградский юридический институт;;25;;;;;;;
110167;Волжский институт экономики, педагогики и права;19,99;;19,45;24,37;23,9;25,13;26,49;26,85;25,66
110168;Воронежский институт инновационных систем;;48,32;;;;;;;
110169;Воронежский институт экономики и социального управления;12,73;32;34,95;12,58;16,8;22,22;22,85;23,45;24,86
110170;Воронежский экономико-правовой институт;20,3;32;34,43;31,72;26,18;22,58;24,82;29,97;28,97
110171;Восточно-Европейский институт;26,39;21,97;18,33;;11,78;46,42;491,3;196,94;
110173;Высшая школа музыки Республики Саха (Якутия) (институт) имени В. А. Босикова;69,93;87,46;73,47;65,6;61,91;55,26;54,08;52,39;51,32
110174;Высшая школа предпринимательства (институт);28,16;26,41;13,11;14,72;33,78;47,57;85,23;64,47;72,11
110176;Высшая школа психологии (Институт);19,62;;;;;;;;
110180;Государственный институт экономики, финансов, права и технологий;30,82;33,73;20,46;34,68;31,89;33,84;34,52;30,98;28,98
110182;Гуманитарно-Прогностический Институт;6,67;;;;;;;;
110183; Гуманитарно-социальный институт;17,97;14,39;12,81;13,17;37,99;40,88;43,06;23,26;17,81
110185;Гуманитарно-Экологический Институт;185,55;;;;;;;;
110186;Открытый Институт - Высшая профессиональная школа;11,34;16,05;;;;9,89;5,75;3,26;5,83
110187;Гуманитарный институт имени П.А.Столыпина;40,33;;;70,13;86,7;112,42;151,22;243,11;59,01
110188;Гуманитарный институт;14,59;;;;;82,33;33,03;41,57;
110189;Дагестанский государственный институт народного хозяйства;9,42;11,08;10,49;14,98;16,39;18,94;16,3;16,93;15,16
110190;Дагестанский медицинский стоматологический институт;163,82;;;;;65,55;65,55;83,12;100,78
