110140;Академический международный институт;;;;0;;;;;
110141;Академический правовой институт;;;;0;;;;;
110142;Академия гражданской защиты и медицины катастроф;;;;;;;;;
110144;Академия социального образования;;;0;0;0;0;0;0;0
110145;Академия социального управления;;;0;0;0;0;0;0;0
110147;Академия сферы социальных отношений;;;;;;;;;
110148;Академия труда и социальных отношений;;;;6;10;10;5;10;15
110152;Алтайский институт финансового управления;;;0;0;;;;;
110153;Альметьевский государственный институт муниципальной службы;;;;;;;;;
110154;Альметьевский государственный нефтяной институт;;;0;0;2;2;2;2;2
110155;Астраханский инженерно-строительный институт;;;0;0;0;0;0;0;0
110156;Байкальский гуманитарный институт;;;;;0;;0;0;0
110157;Байкальский экономико-правовой институт;;;;;;0;0;;
110158;Балтийский институт иностранных языков и межкультурного сотрудничества;;;;0;0;0;;;
110159;Балтийский институт экологии, политики и права;;;;0;0;0;;;
110160;Башкирская академия государственной службы и управления при Президенте Республики Башкортотстан;;;0;0;0;0;0;0;0
110161;Белгородский государственный институт искусств и культуры (БГИИК);;;3;2;1;6;9;15;15
110162;Владикавказский   институт   экономики, управления    и  права (г. Владикавказ);;;0;0;;;;;
110163;Владимирский институт бизнеса (ВИБ);;;;;;;;;
110164;Волгоградский государственный институт искусств и культуры;;;0;0;0;0;0;0;0
110165;Волгоградская консерватория (институт) имени П.А.Серебрякова;;;0;0;0;0;0;0;0
110166;Волгоградский юридический институт;;;;;;;;;
110167;Волжский институт экономики, педагогики и права;;;0;0;0;0;0;0;0
110168;Воронежский институт инновационных систем;;;;;;;;;
110169;Воронежский институт экономики и социального управления;;;0;0;0;0;0;0;0
110170;Воронежский экономико-правовой институт;;;0;0;0;0;0;0;0
110171;Восточно-Европейский институт;;;0;;0;0;0;0;
110173;Высшая школа музыки Республики Саха (Якутия) (институт) имени В. А. Босикова;;;0;0;0;0;0;0;0
110174;Высшая школа предпринимательства (институт);;;0;0;0;0;0;0;0
110176;Высшая школа психологии (Институт);;;;;;;;;
110180;Государственный институт экономики, финансов, права и технологий;;;39;0;0;0;0;0;0
110182;Гуманитарно-Прогностический Институт;;;;;;;;;
110183; Гуманитарно-социальный институт;;;0;0;0;0;0;0;0
110185;Гуманитарно-Экологический Институт;;;;;;;;;
110186;Открытый Институт - Высшая профессиональная школа;;;;;;0;0;0;0
110187;Гуманитарный институт имени П.А.Столыпина;;;;0;0;0;0;0;0
110188;Гуманитарный институт;;;;;;0;0;0;
110189;Дагестанский государственный институт народного хозяйства;;;1;1;0;0;0;0;0
110190;Дагестанский медицинский стоматологический институт;;;;;;0;0;0;0
110192;Дальневосточный институт коммуникаций;;;0;0;0;0;0;0;0
110193;Дальневосточный институт международного бизнеса;;;;;;;;;
110194;Дальневосточный институт международных отношений;;;;0;0;;;;
110196;Донской институт дистанционного образования;;;;;;;;;
110197;Донской юридический институт;;;0;;;;;;
110199;Европейско-Азиатский институт управления и предпринимательства;;;;;;;;;
110200;Екатеринбургская академия современного искусства (институт) ;;;0;0;0;0;0;0;0
110202;Ессентукский институт управления, бизнеса и права;;;;0;0;0;0;0;0
110203;Заокский христианский гуманитарно-экономический институт;;;0;;;0;;;
110204;Западно-Уральский институт экономики и права;;;0;0;0;0;0;0;0
110207;Ижевский институт управления;;;;;;;;;
110209;Институт адвокатуры, нотариата и международных отношений;;;;;;;;;
110212;Институт бизнеса, психологии и управления;;;1;0;;;;;
110214;Институт гуманитарного образования и информационных технологий;;;;0;0;0;0;0;0
110216;Институт деловой карьеры;;;;0;0;0;0;0;0
110218;Институт журналистики и литературного творчества;;;;;;0;0;;0
110219;Институт законоведения и управления ВПА;;;;;;0;0;;
110221;ИНСТИТУТ ИНОСТРАННЫХ ЯЗЫКОВ;;;;0;;0;0;0;0
110222;Институт информационных технологий, экономики и менеджмента;;;;0;0;0;0;0;0
110224;Институт Коммерции и Права;;;0;;;;;;
110227;Институт международного права и экономики имени А.С. Грибоедова;;;1;0;1;0;1;0;5
110229;Институт международной торговли и права;;;0;;0;0;0;;
110230;Институт менеджмента, экономики и инноваций;;;0;0;0;;0;0;0
110231;Институт мировой экономики и финансов;;;0;0;0;0;0;0;
110232;Институт открытого бизнес-образования и дизайна;;;;;0;0;0;0;0
110236;Институт программных систем УГП имени А.К.Айламазяна;;;0;;0;;;;
110237;Московский институт психологии;;;;0;0;;;;
110238;Институт психологии и педагогики;;;;;;;;;
110239;Институт радиоэлектроники, сервиса и диагностики;;;;0;0;0;0;0;0
110240;Институт русского театра;;;;0;;;;;
110241;Институт систем управления экономикой и международного права;;;;;;;;;
110243;Институт современного искусства;;;0;1;0;4;1;1;2
110244;Институт современного права и экономики;;;;;;;;;
110245;Институт современного управления, кино и телевидения;;;;;;;;;
110248;Институт социальных наук;;;;;0;0;0;0;0
110250;Институт технологии туризма;;;0;;;;;;
110251;Институт международных отношений;;;;0;;;;;
110252;Институт Уник;;;;;;;;;
110254;Институт управления и права;;;;;;0;;;
110255;Институт Управления, Бизнеса и Права (г.Пятигорск);;;;;0;0;0;0;
110261;Институт финансов и права;;;0;0;0;0;0;0;0
110263;Институт финансового контроля и аудита;;;;;;;;;
110264;Институт цивилизации;;;0;;;;;;
110265;Институт Экономики Бизнеса;;;0;0;0;;;;
110266;Институт экономики и культуры;;;;;;0;0;0;0
110267;Институт экономики и права (г. Воронеж);;;;0;0;0;0;0;
110269;Институт экономики и предпринимательства;;;;;;;;;
110271;Институт экономики и управления в промышленности;;;0;0;0;0;0;0;0
110273;Институт экономики предпринимательства;;;;;;;;;
110274;Институт экономики, права и гуманитарных специальностей;;;;;;;;;
110275;Кабардино-Балкарский институт бизнеса;;;;0;0;0;0;;
110276;Казанский институт предпринимательства и права;;;;;;0;0;0;0
110278;Камский институт;;;;;;;;;
110279;Камский институт искусств и дизайна;;;;0;0;0;0;0;0
110280;Кировский институт иностранных языков;;;0;0;;;;;
110281;Коми республиканская академия государственной службы и управления;;;0;0;0;0;0;0;0
110282;КРАСНОДАРСКИЙ МУНИЦИПАЛЬНЫЙ МЕДИЦИНСКИЙ ИНСТИТУТ ;;;0;0;0;0;0;0;
110283; Кубанский институт информзащиты;;;;;;0;0;;
110284;Кубанский медицинский институт;;;0;0;0;0;0;0;0
110285;Кузбасский институт экономики и права;;;;;;;;;
110286;Кумертауский институт экономики и права;;;0;0;0;0;0;0;0
110288;Курская академия государственной и муниципальной службы;;;0;0;0;0;0;0;0
110289;Курский автодорожный институт;;;;;;;;;
110291;Ленинградский государственный университет имени А.С. Пушкина;;;0;1;2;2;4;4;4
110292;Липецкий инстиут управления;;;;;;;;;
110293;Магнитогорская государственная консерватория (академия) имени М.И. Глинки;;;1;2;1;3;4;4;4
110294;Махачкалинский инновационный университет;;;;;;;;;
110295;Международная академия бизнеса и управления;;;0;0;0;0;0;0;0
110296;Международная академия оценки и консалтинга;;;;0;0;;;;
110297;Международный инновационный университет;;;0;0;3;5;5;8;4
110298;Международный институт бизнес-образования;;;0;;;;;;
110301;Международный славянский институт;;;1;0;0;0;0;0;0
110302;Международный университет природы, общества и человека Дубна;;;1;3;9;13;16;15;14
110308;Московская Академия Предпринимательства при Правительстве Москвы;;;0;;;;;;
110309;Московская академия рынка труда и информационных технологий;;;0;;;;;;
110310;Московская Высшая Школа Экономики - финансовый институт;;;;;;;;;
110313;Московский городской университет управления Правительства Москвы;;;0;0;1;1;1;0;0
110314;Московский государственный институт индустрии туризма имени Ю.А. Сенкевича;;;2;0;0;0;0;0;0
110315;Московский государственный институт музыки имени А.Г. Шнитке;;;10;0;0;0;5;7;7
110316;Московский государственный областной социально-гуманитарный институт;;;0;1;1;1;1;0;0
110317;Московский государственный областной университет;;;7;24;24;27;21;23;25
110318;Московский гуманитарно-экономический институт;;;0;1;1;4;1;2;1
110319;Московский гуманитарный университет;;;3;1;2;4;2;7;7
110321;Московский институт аналитической психологии и психоанализа;;;;;;;;;
110324;Московский институт современного академического образования;;;;0;0;0;0;0;0
110326;Московский налоговый институт;;;;;;;;;
110327;Московский областной институт управления и права;;;0;0;;;;;
110328;Московский областной социально-гуманитарный институт;;;;;;;;;
110330;Московский психолого-социальный университет;;;;4;2;1;3;2;0
110331;Московский социально-гуманитарный институт;;;;;;;;;
110332;Московский теологический институт Российской Церкви христиан веры евангельской;;;;;;;;;
110333;Московский Транспортный Институт;;;0;;;;;;
110334;Московский художественно-промышленный институт;;;;;;0;0;0;0
110335;Московский экономико-правовой институт;;;;;;;;;
110336;Московский экономический институт Высшая школа Современное образование;;;;;;;;;
110337;Муниципальный институт г. Жуковского;;;0;;;;;;
110338;Мурманская академия экономики и управления;;;0;0;0;0;0;0;0
110339;Набережночелнинский государственный торгово-технологический институт;;;0;0;;0;;;
110341;Национальный институт бизнеса;;;14;0;0;0;0;0;0
110342;Национальный институт недвижимости и инвестиций;;;;;;;;;
110344;Национальный открытый институт г.Санкт-Петербург;;;;0;0;0;0;0;0
110345;Невинномысский государственный гуманитарно-технический институт;;;0;0;0;0;0;0;0
110346;Невинномысский институт экономики, управления и права;;;;0;0;0;0;0;0
110347;Нижегородский государственный инженерно-экономический университет;;;1;0;0;0;0;2;0
110348;Нижегородский институт менеджмента и бизнеса;;;0;;;;;;
110349;Нижнекамский муниципальный институт;;;;;;;;;
110351;Новосибирский государственный театральный институт;;;0;0;0;0;0;0;0
110352;Новосибирский институт экономики, психологии и права;;;;0;;0;0;0;0
110353;Одинцовский гуманитарный институт;;;0;;;;;;
110354;Оренбургский государственный институт искусств им. Леопольда и Мстислава Ростроповичей;;;0;0;0;0;1;1;1
110357;Оренбургский институт экономики и культур;;;;;;;;;
110358;ОСТАНКИНСКИЙ ИНСТИТУТ ТЕЛЕВИДЕНИЯ И РАДИОВЕЩАНИЯ;;;;;;;;;
110360;Открытый юридический институт;;;0;;;;;;
110361;Отрадненский гуманитарный институт;;;0;0;;;;;
110364;Пермский гуманитарно-технологический институт;;;;;;;;;
110365;Петербургский институт иудаики;;;0;;0;0;0;0;0
110368;ИНСТИТУТ УПРАВЛЕНИЯ;;;;0;;;;;
110369;Московский институт государственного и муниципального управления;;;;0;0;;;;
110371;Региональный институт технологии и управления;;;;;;;;;
110372;Российская академия адвокатуры и нотариата;;;1;0;0;1;2;1;0
110373;Русско-Британский Институт Управления;;;0;0;0;0;0;0;0
110374;Русско-немецкий университет;;;;;;;;;
110375;Рязанский институт управления и права;;;;;;;;;
110376;Самарская академия государственного и муниципального управления;;;10;;;;;;
110377;Самарская государственная областная академия (Наяновой);;;0;0;0;0;0;;
110381;Санкт-Петербургский государственный институт психологии и социальной работы;;;0;0;0;0;0;0;0
110382;Санкт-Петербургский институт гостеприимства;;;;0;;0;0;0;0
110384;Санкт-Петербургский институт управления и права;;;;7;;;;;
110386;Санкт - Петербургский Институт Экономики, Культуры и Делового Администрирования;;;0;0;;;;;
110389;Северо-Кавказский социальный институт;;;0;0;0;0;0;0;0
110391;Северо-Осетинский государственный педагогический институт;;;0;0;0;0;0;0;0
110393;Славяно-Греко-Латинская Академия;;;;0;0;0;0;0;0
110394;Славянский деловой институт им.К.В.Нечаева (Митрополита Питирима);;;;;;;;;
110395;Смоленский государственный институт искусств;;;0;0;0;0;0;0;0
110396;Современная гуманитарная академия;;;;0;0;;;;
110400;Сочинский институт экономики и информационных технологий;;;;;;;;;
110402;Ставропольский государственный педагогический институт;;;0;0;1;0;0;0;0
110403;Ставропольский институт бизнеса и технологий Бизнестранс;;;;;;;;;
110404;Ставропольский институт имени В.Д. Чурсина;;;;;;;;;
110406;Столичная финансово-гуманитарная академия;;;0;0;;0;;;
110407;Столичный гуманитарно-экономический институт;;;0;;;;;;
110408;Столичный институт бизнес-технологий и управления;;;;0;;;;;
110409;Сургутский государственный педагогический университет;;;0;0;0;3;3;3;0
110410;Сургутский государственный университет Ханты-Мансийского автономного округа - Югры;;;0;15;11;5;3;7;4
110411;Сургутский институт мировой экономики и бизнеса Планета;;;0;0;0;;;;
110412;Тамбовское областное Тамбовский музыкально-педагогический институт им. С.В. Рахманинова;;;0;0;0;0;2;2;2
110416;Тюменская государственная академия мировой экономики, управления и права;;;0;;;;;;
110418;высшего образования Университет Российского инновационного образования;;;;4;0;3;;;
110419;Уральский институт бизнеса и управления;;;;0;0;0;;;
110420;Уральский институт фондового рынка;;;;0;0;0;0;0;0
110421;Частное образоветельное учреждение высшего образования Академия туризма и международных отношений;;;;0;0;0;;;
110422;Уральский Финансово-Юридический институт;;;;0;;;;;
110425;Финансово-технологическая академия;;;1;2;2;0;0;0;0
110428;Ханты-Мансийская государственная медицинская академия;;;0;0;2;2;3;2;2
110429;Челябинский Многопрофильный Институт;;;0;0;0;0;0;;
110431;Чувашский государственный институт культуры и искусств;;;0;0;0;0;0;0;0
110432;Экономико-энергетический институт;;;0;0;0;0;;;
110433;Южно-Уральский государственный институт искусств имени П.И. Чайковского;;;0;1;0;0;1;0;0
110434;Южно-Уральский профессиональный институт;;;0;;;;;;
110435;Юридический институт;;;0;0;0;;;;
110436;Якутский гуманитарный институт;;;;0;;0;0;0;0
110454;Московский государственный областной гуманитарный институт;;;;0;0;0;0;0;0
110536;Европейский университет в Санкт-Петербурге;;;0;0;1;;0;0;1
110644;Институт дизайна, прикладного искусства и гуманитарного образования;;;;;;;;;
110740;Тольяттинская консерватория (институт);;;0;0;0;0;;;0
110822;Восточно-Сибирский институт экономики и менеджмента;;;0;0;0;0;0;0;0
110895;Уральский гуманитарный институт ;;;;;;;;;
110899;Российская академия предпринимательства;;;;0;0;0;0;0;0
111029;Академия акварели и изящных искусств Сергея Андрияки;;;0;0;0;0;0;0;0
111037;Свято-Филаретовский православно-христианский институт;;;0;0;0;0;0;0;0
111045;Институт бизнеса и дизайна;;;;;;;;;
111086;Институт экономики;;;0;0;0;;;;
111088;Московский институт управления;;;;;;;;;
111126;Институт бизнеса и права;;;;;;;;;
111141;Российский исламский институт;;;;;0;0;0;;0
111185;РОСТОВСКИЙ ИНСТИТУТ УПРАВЛЕНИЯ;;;0;0;;;;;
111186;Казанский институт менеджмента;;;0;0;;;;;
111187;Нижегородский Институт Управления;;;0;0;;;;;
111188;Балтийский институт управления;;;0;0;;;;;
111206;Светский институт народов Кавказа;;;;;;;;;
111209;Царицынский православный университет преподобного Сергия Радонежского;;;;;;;0;0;0
111233;Волгоградский гуманитарный институт;;;0;;0;0;0;0;0
112814;Высшая школа сценических искусств (Театральная школа Константина Райкина);;;;0;0;0;0;0;0
112847;“Юридический институт”;;;;2;;0;;;
113213;Педагогический институт;;;0;0;0;;;;
113221;Керченский государственный морской технологический университет;;;;0;0;0;0;0;1
113232;Всероссийский научно-исследовательский институт авиационных материалов;;;;;0;0;0;;
113293; Академия технологии и управления;;;;0;;;;;
113409;Университет Иннополис;;;;;;0;4;5;21
113416;Крымский федеральный университет им. В. И. Вернадского;;;;56;74;74;82;77;47
113427;Севастопольская морская академия;;;;;;;;;
113437;Севастопольский государственный университет;;;;2;0;1;9;11;8
113493;Сколковский институт науки и технологий;;;;;;48;82;88;
113568;Поволжский православный институт имени Святителя Алексия, митрополита Московского;;;;;;0;0;0;0
113588;Крымский институт бизнеса;;;;;0;0;0;0;0
113589;Национальный институт финансовых рынков и управления;;;;;;;0;;
113593;Технический Университет УГМК;;;;0;0;0;0;0;0
113596;Образовательная организация высшего образования Институт театрального искусства;;;;;;0;0;0;
120111;Московский политехнический университет;;;;;27;29;17;21;25
120119;Московский инновационный университет;;;;;;0;0;0;0
120128;Санкт-Петербургская Духовная Академия Русской Православной Церкви;;;;;;0;0;0;3
