2093;Белгородский инженрено-экономический институт;;;0;;;;;;
2094;Дагестанская академия образования и культуры;;;;0;0;0;0;0;
2095;Уральский гуманитарный институт;;;0;0;;;;;
2096;Институт государственного администрирования;;;;;;114;0;0;0
2151;Московский государственный психолого-педагогический университет;;;181;123;58;0;0;0;0
2155;Московская государственная академия делового администрирования;;;;;;;;;
2183;Московский городской педагогический университет;;;435;4 263;3 587;3 191;3 683;4 040;4413
2189;Московский институт открытого образования;;;;;;;;;
2197;Институт искусства реставрации;;;0;;;0;0;;
2198;Ивановский государственный политехнический университет;;;461;402;381;566;447;471;439
5516;Крымский инженерно-педагогический университет;;;;;348;354;0;0;0
5517;Крымский университет культуры, искусств и туризма;;;;0;42;43;58;62;
5518;Крымский институт бизнеса;;;;;;;;;
5519;Образовательная организация высшего образования Университет экономики и управления;;;;;;0;0;0;0
5542;Керченский государственный морской технологический университет;;;;;;;;;
5572;Профессиональный институт управления;;;;;;;;;
5616;Институт иностранных языков;;;;0;0;;;;
5618;Санкт-Петербургский институт искусств и реставрации;;;;0;;0;0;0;0
5625;Северо-Западный открытый технический университет;;;;0;;0;0;;
5631;Московский институт управления;;;;;;;;;
5635;Московский институт государственного и муниципального управления;;;;;;;;;
5636;Московский институт психологии;;;;;;;;;
5637;Московский юридический институт;;;;;;;;;
5664;Институт языков и культур имени Льва Толстого;;;;;0;;;;
5675;Сколковский институт науки и технологий;;;;;;;;;
5802;Московский исламский институт;;;0;0;;;;;
5961;Пензенская духовная семинария Пензенской Епархии Русской Православной Церкви;;;;;;;0;0;0
100256;Санкт-Петербургский государственный экономический университет;;;1 417;1 265;1 150;975;806;716;694
100345;Исследовательский центр частного права имени С.С. Алексеева при Президенте Российской Федерации;;;;0;0;0;0;0;0
110134;Мордовский гуманитарный институт;;;;;0;0;;;
110135;Институт международных связей;;;30;87;;36;36;32;32
110136;Институт права и экономики;;;607;585;431;;;;
110138;Академический Гуманитарный Институт;;;;;;;;;
110139;Академический институт прикладной энергетики;;;0;0;0;0;;;
110140;Академический международный институт;;;;130;;;;;
110141;Академический правовой институт;;;;0;;;;;
110142;Академия гражданской защиты и медицины катастроф;;;;;;;;;
110144;Академия социального образования;;;216;224;297;282;185;114;110
110145;Академия социального управления;;;0;0;0;0;0;0;0
110147;Академия сферы социальных отношений;;;;;;;;;
110148;Академия труда и социальных отношений;;;;0;340;408;494;585;676
110152;Алтайский институт финансового управления;;;0;0;;;;;
110153;Альметьевский государственный институт муниципальной службы;;;;;;;;;
110154;Альметьевский государственный нефтяной институт;;;0;0;0;0;0;0;0
110155;Астраханский инженерно-строительный институт;;;1 851;1 907;2 082;1 929;1 912;1 951;2020
110156;Байкальский гуманитарный институт;;;;;0;;0;0;0
110157;Байкальский экономико-правовой институт;;;;;;0;0;;
110158;Балтийский институт иностранных языков и межкультурного сотрудничества;;;;0;0;0;;;
110159;Балтийский институт экологии, политики и права;;;;50;38;30;;;
110160;Башкирская академия государственной службы и управления при Президенте Республики Башкортотстан;;;0;0;0;0;0;0;0
110161;Белгородский государственный институт искусств и культуры (БГИИК);;;758;814;878;915;941;974;1013
110162;Владикавказский   институт   экономики, управления    и  права (г. Владикавказ);;;0;0;;;;;
110163;Владимирский институт бизнеса (ВИБ);;;;;;;;;
110164;Волгоградский государственный институт искусств и культуры;;;257;275;301;335;352;357;382
110165;Волгоградская консерватория (институт) имени П.А.Серебрякова;;;296;279;261;255;226;212;213
110166;Волгоградский юридический институт;;;;;;;;;
110167;Волжский институт экономики, педагогики и права;;;660;782;826;871;912;986;1101
110168;Воронежский институт инновационных систем;;;;;;;;;
110169;Воронежский институт экономики и социального управления;;;157;161;142;136;117;124;127
110170;Воронежский экономико-правовой институт;;;624;961;982;844;596;448;384
110171;Восточно-Европейский институт;;;0;;0;0;0;0;
110173;Высшая школа музыки Республики Саха (Якутия) (институт) имени В. А. Босикова;;;35;33;24;107;114;113;118
110174;Высшая школа предпринимательства (институт);;;39;27;0;0;0;0;0
110176;Высшая школа психологии (Институт);;;;;;;;;
110180;Государственный институт экономики, финансов, права и технологий;;;1 562;1 623;1 711;1 745;1 782;1 831;1872
110182;Гуманитарно-Прогностический Институт;;;;;;;;;
110183; Гуманитарно-социальный институт;;;142;203;187;173;202;266;174
110185;Гуманитарно-Экологический Институт;;;;;;;;;
110186;Открытый Институт - Высшая профессиональная школа;;;;;;0;0;0;0
110187;Гуманитарный институт имени П.А.Столыпина;;;;0;0;0;0;0;0
110188;Гуманитарный институт;;;;;;0;0;0;
110189;Дагестанский государственный институт народного хозяйства;;;2 106;2 418;2 730;3 049;2 937;2 840;2932
110190;Дагестанский медицинский стоматологический институт;;;;;;34;35;10;0
110192;Дальневосточный институт коммуникаций;;;100;0;0;0;0;0;0
110193;Дальневосточный институт международного бизнеса;;;;;;;;;
110194;Дальневосточный институт международных отношений;;;;0;0;;;;
110196;Донской институт дистанционного образования;;;;;;;;;
110197;Донской юридический институт;;;0;;;;;;
110199;Европейско-Азиатский институт управления и предпринимательства;;;;;;;;;
110200;Екатеринбургская академия современного искусства (институт) ;;;0;0;0;0;0;0;0
110202;Ессентукский институт управления, бизнеса и права;;;;0;0;0;0;0;0
110203;Заокский христианский гуманитарно-экономический институт;;;0;;;0;;;
110204;Западно-Уральский институт экономики и права;;;0;0;0;0;0;0;0
110207;Ижевский институт управления;;;;;;;;;
110209;Институт адвокатуры, нотариата и международных отношений;;;;;;;;;
110212;Институт бизнеса, психологии и управления;;;0;0;;;;;
110214;Институт гуманитарного образования и информационных технологий;;;;430;203;180;140;0;0
110216;Институт деловой карьеры;;;;0;0;0;0;0;0
110218;Институт журналистики и литературного творчества;;;;;;0;0;;0
110219;Институт законоведения и управления ВПА;;;;;;0;0;;
110221;ИНСТИТУТ ИНОСТРАННЫХ ЯЗЫКОВ;;;;0;;0;0;0;0
110222;Институт информационных технологий, экономики и менеджмента;;;;0;0;0;0;0;0
110224;Институт Коммерции и Права;;;0;;;;;;
110227;Институт международного права и экономики имени А.С. Грибоедова;;;0;0;0;0;0;0;0
110229;Институт международной торговли и права;;;0;;0;0;0;;
110230;Институт менеджмента, экономики и инноваций;;;0;0;0;;0;0;0
110231;Институт мировой экономики и финансов;;;8;0;0;0;16;27;
110232;Институт открытого бизнес-образования и дизайна;;;;;0;0;0;0;0
110236;Институт программных систем УГП имени А.К.Айламазяна;;;0;;0;;;;
110237;Московский институт психологии;;;;0;0;;;;
110238;Институт психологии и педагогики;;;;;;;;;
110239;Институт радиоэлектроники, сервиса и диагностики;;;;0;0;0;0;0;0
110240;Институт русского театра;;;;38;;;;;
110241;Институт систем управления экономикой и международного права;;;;;;;;;
110243;Институт современного искусства;;;0;0;0;0;0;0;0
110244;Институт современного права и экономики;;;;;;;;;
110245;Институт современного управления, кино и телевидения;;;;;;;;;
110248;Институт социальных наук;;;;;0;0;0;0;0
110250;Институт технологии туризма;;;155;;;;;;
110251;Институт международных отношений;;;;0;;;;;
110252;Институт Уник;;;;;;;;;
110254;Институт управления и права;;;;;;0;;;
110255;Институт Управления, Бизнеса и Права (г.Пятигорск);;;;;0;0;0;0;
110261;Институт финансов и права;;;0;0;0;0;0;0;0
110263;Институт финансового контроля и аудита;;;;;;;;;
110264;Институт цивилизации;;;0;;;;;;
110265;Институт Экономики Бизнеса;;;0;0;0;;;;
110266;Институт экономики и культуры;;;;;;0;0;0;0
110267;Институт экономики и права (г. Воронеж);;;;0;0;0;0;0;
110269;Институт экономики и предпринимательства;;;;;;;;;
110271;Институт экономики и управления в промышленности;;;0;0;0;0;0;0;0
110273;Институт экономики предпринимательства;;;;;;;;;
110274;Институт экономики, права и гуманитарных специальностей;;;;;;;;;
110275;Кабардино-Балкарский институт бизнеса;;;;70;0;0;0;;
110276;Казанский институт предпринимательства и права;;;;;;0;0;0;0
110278;Камский институт;;;;;;;;;
110279;Камский институт искусств и дизайна;;;;141;149;135;114;111;122
110280;Кировский институт иностранных языков;;;0;0;;;;;
110281;Коми республиканская академия государственной службы и управления;;;0;0;0;0;0;0;0
110282;КРАСНОДАРСКИЙ МУНИЦИПАЛЬНЫЙ МЕДИЦИНСКИЙ ИНСТИТУТ ;;;956;765;692;807;797;723;
110283; Кубанский институт информзащиты;;;;;;0;0;;
110284;Кубанский медицинский институт;;;0;0;0;0;0;0;0
110285;Кузбасский институт экономики и права;;;;;;;;;
110286;Кумертауский институт экономики и права;;;142;144;151;133;135;87;146
110288;Курская академия государственной и муниципальной службы;;;0;42;68;100;78;0;0
110289;Курский автодорожный институт;;;;;;;;;
110291;Ленинградский государственный университет имени А.С. Пушкина;;;273;444;580;746;254;1 118;1368
110292;Липецкий инстиут управления;;;;;;;;;
110293;Магнитогорская государственная консерватория (академия) имени М.И. Глинки;;;411;445;498;196;433;464;435
110294;Махачкалинский инновационный университет;;;;;;;;;
110295;Международная академия бизнеса и управления;;;347;383;332;0;0;0;0
110296;Международная академия оценки и консалтинга;;;;0;0;;;;
110297;Международный инновационный университет;;;0;0;0;0;0;0;0
110298;Международный институт бизнес-образования;;;0;;;;;;
110301;Международный славянский институт;;;0;0;0;0;0;0;0
110302;Международный университет природы, общества и человека Дубна;;;436;393;336;354;401;450;483
110308;Московская Академия Предпринимательства при Правительстве Москвы;;;89;;;;;;
110309;Московская академия рынка труда и информационных технологий;;;0;;;;;;
110310;Московская Высшая Школа Экономики - финансовый институт;;;;;;;;;
110313;Московский городской университет управления Правительства Москвы;;;0;0;0;0;0;0;0
110314;Московский государственный институт индустрии туризма имени Ю.А. Сенкевича;;;181;266;225;214;217;217;221
110315;Московский государственный институт музыки имени А.Г. Шнитке;;;247;254;262;331;384;428;438
110316;Московский государственный областной социально-гуманитарный институт;;;0;721;733;0;0;0;0
110317;Московский государственный областной университет;;;809;940;955;904;823;801;754
110318;Московский гуманитарно-экономический институт;;;213;284;269;291;233;322;497
110319;Московский гуманитарный университет;;;824;1 020;1 181;1 166;1 164;1 136;1245
110321;Московский институт аналитической психологии и психоанализа;;;;;;;;;
110324;Московский институт современного академического образования;;;;0;0;0;0;0;0
110326;Московский налоговый институт;;;;;;;;;
110327;Московский областной институт управления и права;;;0;0;;;;;
110328;Московский областной социально-гуманитарный институт;;;;;;;;;
110330;Московский психолого-социальный университет;;;;0;0;0;0;0;0
110331;Московский социально-гуманитарный институт;;;;;;;;;
110332;Московский теологический институт Российской Церкви христиан веры евангельской;;;;;;;;;
110333;Московский Транспортный Институт;;;0;;;;;;
110334;Московский художественно-промышленный институт;;;;;;254;295;523;685
110335;Московский экономико-правовой институт;;;;;;;;;
110336;Московский экономический институт Высшая школа Современное образование;;;;;;;;;
110337;Муниципальный институт г. Жуковского;;;0;;;;;;
110338;Мурманская академия экономики и управления;;;88;132;210;276;276;0;0
110339;Набережночелнинский государственный торгово-технологический институт;;;723;900;;1 120;;;
110341;Национальный институт бизнеса;;;0;0;0;0;0;0;0
110342;Национальный институт недвижимости и инвестиций;;;;;;;;;
110344;Национальный открытый институт г.Санкт-Петербург;;;;280;325;169;252;247;363
110345;Невинномысский государственный гуманитарно-технический институт;;;696;723;791;713;749;752;792
110346;Невинномысский институт экономики, управления и права;;;;0;0;0;0;0;0
110347;Нижегородский государственный инженерно-экономический университет;;;522;486;535;517;535;552;591
110348;Нижегородский институт менеджмента и бизнеса;;;0;;;;;;
110349;Нижнекамский муниципальный институт;;;;;;;;;
110351;Новосибирский государственный театральный институт;;;0;0;0;0;0;0;0
110352;Новосибирский институт экономики, психологии и права;;;;0;;0;0;0;0
110353;Одинцовский гуманитарный институт;;;577;;;;;;
110354;Оренбургский государственный институт искусств им. Леопольда и Мстислава Ростроповичей;;;217;212;212;206;212;219;223
110357;Оренбургский институт экономики и культур;;;;;;;;;
110358;ОСТАНКИНСКИЙ ИНСТИТУТ ТЕЛЕВИДЕНИЯ И РАДИОВЕЩАНИЯ;;;;;;;;;
110360;Открытый юридический институт;;;0;;;;;;
110361;Отрадненский гуманитарный институт;;;220;167;;;;;
110364;Пермский гуманитарно-технологический институт;;;;;;;;;
110365;Петербургский институт иудаики;;;0;;0;0;0;0;0
110368;ИНСТИТУТ УПРАВЛЕНИЯ;;;;0;;;;;
110369;Московский институт государственного и муниципального управления;;;;0;0;;;;
110371;Региональный институт технологии и управления;;;;;;;;;
110372;Российская академия адвокатуры и нотариата;;;77;98;104;94;0;0;18
110373;Русско-Британский Институт Управления;;;969;859;774;823;897;1 096;1352
110374;Русско-немецкий университет;;;;;;;;;
110375;Рязанский институт управления и права;;;;;;;;;
110376;Самарская академия государственного и муниципального управления;;;0;;;;;;
110377;Самарская государственная областная академия (Наяновой);;;0;0;0;0;0;;
110381;Санкт-Петербургский государственный институт психологии и социальной работы;;;0;0;0;0;0;0;0
110382;Санкт-Петербургский институт гостеприимства;;;;0;;0;0;0;0
110384;Санкт-Петербургский институт управления и права;;;;0;;;;;
110386;Санкт - Петербургский Институт Экономики, Культуры и Делового Администрирования;;;0;0;;;;;
110389;Северо-Кавказский социальный институт;;;136;134;167;205;238;300;356
110391;Северо-Осетинский государственный педагогический институт;;;81;214;369;493;645;629;559
110393;Славяно-Греко-Латинская Академия;;;;0;0;0;0;0;0
110394;Славянский деловой институт им.К.В.Нечаева (Митрополита Питирима);;;;;;;;;
110395;Смоленский государственный институт искусств;;;88;87;88;95;97;112;125
110396;Современная гуманитарная академия;;;;0;0;;;;
110400;Сочинский институт экономики и информационных технологий;;;;;;;;;
110402;Ставропольский государственный педагогический институт;;;121;0;97;53;24;79;182
110403;Ставропольский институт бизнеса и технологий Бизнестранс;;;;;;;;;
110404;Ставропольский институт имени В.Д. Чурсина;;;;;;;;;
110406;Столичная финансово-гуманитарная академия;;;0;0;;0;;;
110407;Столичный гуманитарно-экономический институт;;;0;;;;;;
110408;Столичный институт бизнес-технологий и управления;;;;0;;;;;
110409;Сургутский государственный педагогический университет;;;0;0;0;0;0;0;0
110410;Сургутский государственный университет Ханты-Мансийского автономного округа - Югры;;;0;0;0;0;0;585;639
110411;Сургутский институт мировой экономики и бизнеса Планета;;;0;0;0;;;;
110412;Тамбовское областное Тамбовский музыкально-педагогический институт им. С.В. Рахманинова;;;208;227;234;238;235;242;238
110416;Тюменская государственная академия мировой экономики, управления и права;;;0;;;;;;
110418;высшего образования Университет Российского инновационного образования;;;;0;0;0;;;
110419;Уральский институт бизнеса и управления;;;;0;0;0;;;
110420;Уральский институт фондового рынка;;;;0;0;0;0;0;0
110421;Частное образоветельное учреждение высшего образования Академия туризма и международных отношений;;;;113;160;128;;;
110422;Уральский Финансово-Юридический институт;;;;0;;;;;
110425;Финансово-технологическая академия;;;1 960;2 188;2 530;2 608;2 818;3 016;3224
110428;Ханты-Мансийская государственная медицинская академия;;;412;439;464;537;524;525;512
110429;Челябинский Многопрофильный Институт;;;0;0;0;0;0;;
110431;Чувашский государственный институт культуры и искусств;;;0;0;0;0;0;0;0
110432;Экономико-энергетический институт;;;30;58;38;38;;;
110433;Южно-Уральский государственный институт искусств имени П.И. Чайковского;;;1 041;1 025;1 098;1 095;1 109;1 122;1161
