miccedu_id;clear_name;ind_2013_value;ind_2014_value;ind_2015_value;ind_2016_value;ind_2017_value;ind_2018_value;ind_2019_value;ind_2020_value;ind_2021_value
1;Адыгейский государственный университет;;;30,08;32,46;30,14;34,49;48,47;53,66;59,79
2;Алтайская государственная педагогическая академия;;;29,11;30,06;31,77;32,81;46,47;51,31;55,08
3;Алтайский государственный технический университет им. И.И. Ползунова;;;28,50;29,12;32,39;38,43;45,71;48,67;52,86
4;Алтайский государственный университет;;;38,29;39,03;42,08;43,03;50,62;55,98;56,61
5;Амурский государственный университет;;;53,48;54,92;55,48;62,98;76,89;82,67;89,69
6;Амурский гуманитарно-педагогический государственный университет;;;48,32;51,11;51,92;59,07;81,46;87,47;90,38
7;Ангарская государственная техническая академия;;;45,29;50,74;47,83;52,87;73,83;85,11;86,63
9;Армавирская государственная педагогическая академия;;;33,09;35,90;42,67;46,89;57,78;63,29;66,87
11;Астраханский государственный университет;;;31,82;34,71;36,47;42,70;56,04;58,67;59,2
12;Байкальский государственный университет экономики и права;;;52,28;50,43;53,44;61,47;76,99;77,78;86,27
13;Балтийский государствнный технический университет ВОЕНМЕХ им. Д.Ф. Устинова;;;51,79;61,19;70,84;90,32;112,35;126,84;127,56
14;Башкирский государственный педагогический университет им. М. Акмуллы;;;40,56;44,37;45,22;48,50;61,82;71,93;68,94
15;Башкирский государственный университет;;;39,97;43,91;45,21;49,89;61,60;68,05;71,04
16;Белгородский государственный технологический университет им. В.Г. Шухова;;;34,14;35,71;39,63;44,67;57,29;62,09;64,6
17;Белгородский государственный национальный исследовательский университет;;;33,63;36,51;42,68;46,76;56,09;61,85;64,9
19;Алтайская государственная академия образования имени В.М. Шукшина;;;25,33;27,86;31,80;41,52;45,31;49,30;57,9
21;Благовещенский государственный педагогический университет;;;42,43;46,90;47,85;57,40;74,25;82,07;88,66
23;Братский государственный университет;;;50,08;43,99;47,07;49,16;66,20;61,22;79,86
24;Брянская государственная инженерно-технологическая академия;;;26,70;28,71;26,61;39,36;50,58;51,68;55,48
25;Брянский государственный технический университет;;;35,61;36,24;37,77;41,30;48,54;52,31;55,02
26;Брянский государственный университет имени академика И.Г. Петровского.;;;27,18;32,55;35,02;45,25;54,42;54,51;56,12
27;Бурятский государственный университет;;;36,55;37,57;39,48;38,87;62,08;67,72;76,31
28;Владивостокский государственный университет экономики и сервиса;;;64,20;64,62;60,67;69,55;80,08;90,69;100,09
30;Владимирский государственный университет имени Александра Григорьевича и Николая Григорьевича Столетовых;;;39,37;40,90;43,13;48,77;56,45;58,68;64,48
33;Волгоградский государственный архитектурно-строительный университет;;;29,82;;;;;;
34;Волгоградский государственный социально-педагогический университет;;;29,41;;26,86;31,58;52,14;55,29;58,44
35;Волгоградский государственный технический университет;;;35,76;36,31;37,55;40,13;55,10;61,23;63,07
36;Волгоградский государственный университет;;;32,14;34,32;36,84;38,62;53,88;58,86;66,4
39;Вологодский государственный университет;;;35,19;41,30;41,36;49,71;64,69;69,83;76,33
40;Воронежский государственный лесотехнический университете имени Г.Ф. Морозова;;;31,06;34,94;37,43;44,85;55,24;61,23;62,13
41;Воронежский государственный университет инженерных технологий;;;32,45;37,27;39,11;47,24;60,14;61,71;64,23
42;Воронежский государственный архитектурно-строительный университет;;;36,92;;;;;;
43;Воронежский государственный педагогический университет;;;30,48;35,82;37,99;47,51;57,04;59,09;63,02
44;Воронежский государственный технический университет;;;31,33;34,89;39,14;51,58;63,22;65,35;67,74
45;Воронежский государственный университет ;;;31,59;33,68;35,96;44,88;56,20;60,17;63,51
46;Восточно-Сибирский государственный университет технологий и управления;;;38,19;40,14;40,14;48,44;61,95;64,81;70,08
48;Высшая школа народных искусств (институт);;;40,20;82,46;83,26;98,59;111,65;110,20;117,63
49;Вятский государственный гуманитарный университет;;;36,86;;;;;;
50;Вятский государственный университет;;;41,57;40,18;41,78;44,01;50,17;55,00;60,31
51;Гжельский государственный художественно-промышленный институт;;;50,17;55,25;66,42;79,70;94,38;104,45;97,58
52;Глазовский государственный педагогический институт имени В.Г. Короленко;;;32,14;34,84;37,55;44,98;56,66;60,92;63,13
53;Горно-Алтайский государственный университет;;;30,70;32,81;32,57;40,24;54,15;57,78;61,31
54;Государственная академия славянской культуры;;;58,42;;;;;;
55;Государственная классическая академия имени Маймонида;;;;;;;;;
56;Государственная полярная академия;;;33,69;;;;;;
57;Государственный академический университет гуманитарных наук;;;95,75;74,00;114,83;116,69;165,27;149,71;173,09
58;Государственный институт русского языка им. А.С. Пушкина;;;72,91;83,00;90,01;114,62;125,61;139,56;145,1
59;Национальный исследовательский технологический университет МИСиС;;;78,21;83,25;98,21;119,70;143,98;155,23;169,88
60;Государтвенный университет управления;;;67,97;86,20;97,30;115,39;139,66;139,66;156,1
61;Грозненский государственный нефтяной технический университет имени академика М.Д. Миллионщикова;;;30,98;32,74;32,98;36,64;46,78;53,24;55,98
62;Дагестанский государственный педагогический университет;;;17,17;17,22;17,26;23,32;41,94;38,83;37,27
63;Дагестанский государственный технический университет;;;31,90;38,66;39,28;34,18;48,46;50,69;49,27
64;Дагестанский государственный университет;;;28,49;27,66;30,98;34,10;42,82;51,40;50,71
66;Приамурский государственный университет имени Шолом-Алейхема;;;38,47;41,68;47,38;63,00;71,90;82,94;86,53
67;Дальневосточный государственный гуманитарный университет;;;;;;;;;
70;Донской государственный технический университет;;;29,64;32,71;38,27;45,06;54,80;60,31;61,78
72;Елецкий государственный университет им. И.А. Бунина;;;30,23;32,48;33,04;39,60;56,51;59,95;63,73
76;Ивановский государственный университет;;;28,04;27,67;29,65;25,52;43,33;43,87;48,25
77;Ивановский государственный химико-технологический университет;;;28,07;29,47;33,96;38,16;48,70;52,97;54,74
78;Ивановский государственный энергетический университет имени В.И. Ленина;;;43,81;43,87;40,18;40,93;47,51;57,80;48,05
79;Ижевский государственный технический университет имени М.Т. Калашникова;;;45,27;44,78;47,88;47,30;58,49;63,25;65,25
80;Ингушский государственный университет;;;28,81;31,38;32,95;31,67;43,53;46,06;46,37
82;Иркутский национальный исследовательский технический университет;;;54,32;58,97;54,17;63,69;77,21;82,70;89,82
83;Иркутский государственный университет;;;48,40;46,70;53,62;62,67;78,29;87,26;97,72
85;Кабардино-Балкарский государственный университет им. Х.М. Бербекова;;;23,97;28,30;31,12;35,59;44,07;48,97;51,16
86;Казанский государственный архитектурно-строительный университет;;;39,35;44,11;51,14;57,36;70,57;72,45;78,92
87;Казанский национальный исследовательский технический университет им. А.Н.Туполева-КАИ;;;42,58;46,32;48,30;62,81;72,97;85,91;89,13
88;Казанский национальный исследовательский технологический университет;;;45,03;45,92;47,87;61,86;83,50;91,46;97,78
91;Казанский государственный энергетический университет;;;38,47;39,74;47,80;58,07;64,39;81,01;88,96
92;Калмыцкий государственный университет;;;24,10;28,98;30,32;32,34;44,71;48,05;50,61
93;Калужский государственный университет им. К.Э. Циолковского;;;34,70;40,65;44,03;54,03;67,12;72,99;79,45
95;Камчатский государственный университет имени Витуса Беринга;;;71,89;72,57;74,33;104,49;128,11;129,44;
96;Северо-Кавказская государственная гуманитарно-технологическая академия;;;25,63;26,50;33,00;35,68;43,28;45,46;47,58
97;Карачаево-Черкесского государственного университета имени У.Д. Алиева;;;25,01;27,34;29,33;33,43;44,36;46,08;47,27
99;Кемеровский государственный университет;;;36,27;39,77;42,39;52,16;65,00;79,06;82,64
100;Кемеровский технологический институт пищевой промышленности;;;37,40;37,85;41,00;51,83;;;
101;Ковровская государственная технологическая академия имени В.А.Дегтярева;;;39,59;34,02;40,50;43,33;55,90;60,94;63,57
103;Комсомольский-на-Амуре государственный технический университет;;;53,91;54,05;56,80;55,39;83,46;89,76;90,16
104;Костромской государственный технологический университет.;;;26,44;28,38;30,82;37,69;45,74;55,33;56,65
105;Костромской государственный университет имени Н.А. Некрасова;;;26,43;;;;;;
106;Красноярский государственный педагогический университетим. В.П. Астафьева;;;44,66;46,79;49,36;55,35;79,71;81,32;87,32
108;Кубанский государственный технологический университет;;;38,50;39,76;41,27;42,45;57,46;62,55;63,48
109;Кубанский государственный университет;;;44,50;49,82;51,24;54,67;64,11;70,65;73,64
111;Кузбасский государственный технический университет имени Т.Ф.Горбачева;;;36,83;40,03;42,51;51,24;62,71;71,81;77,43
112;Курганский государственный университет;;;31,86;37,23;36,97;38,75;50,49;54,09;62,57
113;Юго-Западный государственный университет;;;30,76;32,72;36,21;39,11;53,82;60,20;65,5
114;Курский государственный университет;;;29,44;30,98;31,01;39,23;52,89;57,43;60,14
116;Липецкий государственный педагогический университет;;;25,72;32,13;38,39;44,93;54,74;60,89;66
117;Липецкий государственный технический университет;;;31,83;33,24;37,95;46,10;62,43;66,61;69,9
118;Литературный институт имени А.М. Горького;;;64,38;88,15;80,19;88,28;149,37;92,86;157,25
119;МАТИ - Российский государственный технологический университет имени К.Э. Циолковского;;;;;;;;;
120;Магнитогорский государственный технический университет им. Г.И. Носова;;;37,05;38,65;42,80;46,62;65,40;67,39;69,27
122;Майкопский государственный технологический университет;;;28,56;31,05;33,93;42,06;53,31;60,13;61,01
123;Поволжский государственный технологический университет;;;32,22;32,14;33,62;44,04;49,89;53,49;57,42
124;Марийский государственный университет;;;25,84;30,19;35,73;43,28;50,46;54,34;58,83
126;Мордовский государственный педагогический институт имени М.Е. Евсевьева;;;34,06;34,01;37,11;40,67;51,28;50,64;54,28
127;Мордовский государственный университет им. Н.П. Огарёва;;;30,51;33,47;33,53;35,86;49,43;55,26;56,14
129;Московский государственный университет тонких химических технологий имени М.В. Ломоносова;;;63,29;;;;;;
130;Московский государственный юридический университет имени О.Е. Кутафина;;;90,87;90,70;106,06;119,83;148,33;180,48;192,61
131;Московский авиационный институт (национальный исследовательский университет);;;79,61;85,79;98,67;104,51;140,53;150,65;161,62
132;Московский автомобильно-дорожный государственный технический университет (МАДИ);;;82,62;88,89;89,48;114,74;139,70;148,83;152,27
133;Московский архитектурный институт (государственная академия);;;75,37;86,19;96,26;121,42;150,86;153,34;160,2
134;МИРЭА - Российский технологический университет;;;85,51;92,58;98,36;123,78;142,96;149,46;161,79
136;Московский государственный горный университет;;;;;;;;;
137;Московский государственный гуманитарный университет имени М.А. Шолохова;;;;;;;;;
138;Московский государственный индустриальный университет;;;;;;;;;
140;Национальный исследовательский университет МИЭТ;;;74,90;88,98;100,72;125,41;148,93;155,94;165,65
141;Московский государственный лингвистический университет;;;66,23;87,10;72,69;69,30;123,01;116,92;109,64
143;Московский государственный гуманитарно-экономический университет;;;74,40;85,56;93,24;104,42;137,13;154,10;167,29
144;Московский государственный строительный университет;;;76,11;89,82;100,73;129,10;145,50;156,40;157,05
146;Московский государственный машиностроительный университет (МАМИ);;;75,39;;;;;;
147;Московский государственный технический университет имени Н.Э. Баумана;;;83,58;89,62;93,46;125,36;142,92;140,66;154,74
148;Московский государственный технологический университет СТАНКИН;;;83,28;91,34;114,97;125,14;159,65;180,88;217,49
149;Московский государственный университет экономики, статистики и информатики (МЭСИ);;;;;;;;;
150;Московский государственный университет геодезии и картографии (МИИГАиК);;;64,46;51,37;44,50;77,28;140,83;156,97;163,18
151;Российский государственный университет им. А.Н. Косыгина (Технологии. Дизайн. Искусство);;;73,75;82,93;80,84;116,44;150,05;154,11;163,53
153;Московский государственный университет леса;;;39,20;;;;;;
154;Московский государственный университет печати имени Ивана Федорова;;;77,10;;;;;;
155;Московский государственный университет пищевых производств;;;76,30;;80,10;62,21;137,53;154,71;175,96
156;Московский государственный университет приборостроения и информатики;;;;;;;;;
158;Московский государственный университет технологий и управления имени К.Г.Разумовского;;;78,67;89,00;107,48;119,88;142,53;147,95;157,99
159;Московская государственная художественно-промышленная академия имени С.Г. Строганова;;;78,18;87,78;96,29;91,44;136,10;165,80;173,3
160;Московский педагогический государственный университет;;;63,56;71,26;80,94;103,98;136,93;156,16;161,81
161;Московский физико-технический институт (государственный университет);;;69,31;83,49;120,41;139,48;166,99;189,46;179,95
162;Национальный исследовательский университет МЭИ;;;73,46;91,80;103,83;130,45;161,00;171,06;175,62
163;Мурманский арктический государственный университет;;;57,21;62,16;63,34;70,50;106,63;116,37;120,31
164;Набережночелнинский институт социально-педагогических технологий и ресурсов;;;37,20;38,98;45,82;52,80;64,56;71,11;71,38
165;Национальный исследовательский ядерный университет МИФИ;;;114,11;110,95;106,02;128,29;192,78;192,56;196,57
166;Нижегородский  осударственный архитектурно-строительный университет;;;33,22;34,25;39,33;50,16;62,39;65,50;73,28
167;Нижегородский государственный лингвистический университет им. Н.А.Добролюбова;;;35,84;35,85;38,24;50,13;60,10;65,23;72,48
168;Нижегородский государственный педагогический университет имени Козьмы Минина (Мининский университет);;;33,19;37,72;42,21;50,53;64,16;80,50;84,7
169;Нижегородский государственный технический университет им. Р.Е. Алексеева;;;45,28;44,69;43,69;58,94;78,64;84,27;86,83
170;Нижегородский государственный университет им. Н.И.Лобачевского;;;46,17;44,65;46,74;49,70;62,23;73,30;81,22
172;Нижнетагильская государственная социально-педагогическая академия;;;;;;;;;
173;Новгородский государственный университет имени Ярослава Мудрого.;;;34,29;36,95;45,29;47,33;60,26;62,00;64,99
174;Новосибирская государственная архитектурно-художественная академия;;;32,49;43,34;51,61;66,08;75,03;76,42;82,1
175;Новосибирский государственный архитектурно-строительный университет (Сибстрин);;;33,63;39,09;39,75;49,90;64,99;69,05;73,58
176;Новосибирский государственный педагогический университет;;;42,98;41,95;45,28;50,10;65,21;71,19;76
177;Новосибирский государственный технический университет;;;38,24;40,02;44,96;63,03;73,21;79,34;80,22
178;Новосибирский национальный исследовательский государственный университет;;;59,63;61,91;57,00;62,22;72,73;82,98;111,43
179;Новосибирский государственный университет экономики и управления НИНХ;;;41,20;46,96;50,37;50,30;61,10;67,57;71,05
180;Норильский индустриальный институт;;;51,96;58,36;67,20;66,26;78,90;89,01;99,42
181;Омский государственный институт сервиса;;;35,63;;;;;;
182;Омский государственный педагогичесий университет;;;38,10;38,20;38,98;49,22;58,44;60,42;61,75
183;Омский государственный технический университет;;;47,34;51,74;55,88;55,69;69,05;76,07;79,34
184;Омский государственный университет им. Ф.М. Достоевского;;;41,24;40,39;42,64;49,33;60,72;65,57;64,37
185;Оренбургский государственный институт менеджмента;;;;;;;;;
186;Оренбургский государственный педагогический университет;;;32,84;32,79;31,17;36,75;54,88;60,22;64,39
187;Оренбургский государственный университет;;;32,47;35,24;43,02;47,43;56,98;62,04;64,34
189;Орловский государственный институт экономики и торговли;;;25,57;32,88;34,66;39,30;47,89;55,91;56,87
190;Государственный университет-учебно-научно-производственный комплекс;;;24,66;;;;;;
191;Орловский государственный университет;;;27,17;30,54;31,79;40,50;48,51;53,53;54,96
192;Пензенский государственный технологический университет;;;31,57;37,52;35,75;40,23;54,42;60,68;65,76
194;Пензенский государственный университет;;;38,20;38,17;37,84;44,82;56,34;56,67;60,37
195;Пензенский государственный университет архитектуры и строительства;;;38,43;38,87;42,85;47,66;59,93;70,84;71,42
196;Пермский государственный гуманитарно-педагогический университет;;;29,76;36,29;42,15;42,64;58,64;48,31;68,4
197;Пермский национальный исследовательский политехнический университет;;;69,65;82,09;75,88;75,82;96,94;116,35;129,65
198;Пермский государственный национальный исследовательский университет;;;40,22;40,53;40,44;55,37;66,19;67,53;73,2
199;Петрозаводский государственный университет;;;38,15;41,28;43,97;52,43;68,43;77,34;83,71
201;Поволжская государственная социально-гуманитарная академия;;;33,01;37,08;39,83;47,93;61,58;66,36;69,32
202;Поволжский государственный университет сервиса;;;47,15;46,40;46,30;47,47;60,55;63,45;64,69
206;Пущинский государственый естественно-научный институт;;;44,05;46,37;33,30;105,11;105,68;66,67;105,81
207;Пятигорский государственный лингвистический университет;;;29,55;33,79;33,62;37,19;54,10;57,59;62,28
209;Российский экономический университет имени Г.В. Плеханова;;;81,37;86,57;99,21;116,35;140,10;151,45;156,92
