1994;Институт экономики и управления;;;;97,91;98,79;100;100;100;100
1995;Московский Институт Телевидения и Радиовещания Останкино;;;100;100;100;;;;
1996;Международный институт компьютерных технологий;;;68,42;77,19;54,61;53,39;45,81;47;43,22
1997;Московский институт физической культуры и спорта;;;;;;;;;
1998;Подольский социально-спортивный институт;;;100;100;100;;;;
1999;Балаковский институт бизнеса и управления;;;;;;;;;
2000;ИНСТИТУТ ДРУЖБЫ НАРОДОВ КАВКАЗА;;;99,57;99,86;100;98,21;98,72;99,69;99,07
2001;Московский экономико-финансовый институт;;;;;;;;;
2002;Невский институт языка и культуры;;;;100;;;100;100;100
2003;Московский институт юриспруденции;;;;;;;;;
2004;Негосудрственное Алтайский экономико-юридический институт;;;100;100;100;;;;
2005;Прикамский социальный институт;;;100;99,88;;100;100;100;85,61
2007;Сибирский институт международных отношений и регионоведения;;;100;99,83;99,79;100;100;;
2008;Волгоградский институт бизнеса;;;97,8;97,84;98,48;99,71;100;100;99,43
2009;Негосударственное Армавирский лингвистический социальный институт;;;100;100;100;100;100;100;100
2010;Институт гостиничного и туристического менеджмента;;;;;;;;;
2011;Московский архитектурно-строительный институт;;;100;100;;;;;
2012;Международный гуманитарно-лингвистический институт;;;;100;96,83;99,58;100;100;97,85
2015;Пермский институт муниципального управления;;;;;;;;;
2016;Институт менеджмента и рынка;;;;;;;;;
2017;ТУЛЬСКИЙ УНИВЕРСИТЕТ (ТИЭИ);;;96,84;98,48;99,65;97,23;95,57;;99,99
2018;Санкт–Петербургский медико-социальный институт;;;;;100;100;100;100;99,21
2019;Уральский институт коммерции и права;;;;100;;100;100;100;
2022;Владикавказский институт Моды и Дизайна;;;0;;;;;;
2023;Высшая школа бизнеса, безопасности и управления;;;;;;;;;
2024;Омский институт международного менеджмента и иностранных языков Ин.яз. - Омск;;;100;;;;;;
2025;Сибирский университет потребительской кооперации;;;94,26;94,99;94,05;96,71;97,93;97,84;98,04
2026;Международная Гуманитарно-Техническая Академия (институт);;;;100;;;;;
2027;Московская международная академия;;;;96,02;97,99;100;100;99,05;99,52
2028;Московский институт государственного управления и права;;;100;;100;100;100;;
2029;Институт современных технологий и экономики;;;;;;;;;
2030;Евразийский институт экономики, менеджмента, информатики;;;;;;;;;
2032;Ростовский институт иностранных языков;;;;;;;;;
2033;Открытый технологический институт;;;;100;;;;100;97,13
2034;Институт социально-экономического прогнозирования и моделирования;;;0;100;100;;;;
2035;Сибирский институт бизнеса, управления и психологии;;;89,58;90,49;93,61;98,45;95,39;92,76;85,47
2036;Новый гуманитарный институт;;;100;100;100;100;100;;
2039;Столичный институт переводчиков;;;;;;;;;
2040;Казанский институт финансов, экономики и информатики;;;80,67;92,57;99,65;100;100;;
2041;Челябинский институт экономики и права им. М.В. Ладошина;;;100;100;100;;;;
2042;Институт специальной педагогики и психологии;;;;100;;95,99;;;
2043;Балтийский Гуманитарный Институт;;;;98,05;100;100;100;100;100
2044;Институт бизнеса, информационных технологий и финансов;;;;;;;;;
2045;Московская академия творчества;;;;;;;;;
2046;Московский технологический институт ВТУ;;;100;100;99,94;100;;;
2047;Московский финансово-экономический инcтитут;;;;99,98;97,7;100;100;;
2048;Институт экономики;;;100;100;;;;;
2049;Институт экономики и управления (г. Пятигорск);;;;100;;;;;
2050;Рязанский институт открытого образования;;;;;;;;;
2051;Томский экономико-юридический институт;;;;99,45;;;;;
2052;Экономико-правовой институт;;;;;;;;;
2053;Институт международных экономических связей;;;;100;100;100;100;100;99,43
2054;Санкт-Петербургский институт гуманитарного образования;;;;;;;;;
2055;Московский университет государственного управления;;;93,06;94,7;;;;;
2056;Кисловодский институт экономики и права;;;100;;;;;;
2057;Невский институт управления и дизайна;;;100;100;;;;;
2059;АЛТАЙСКАЯ АКАДЕМИЯ ЭКОНОМИКИ И ПРАВА (ИНСТИТУТ);;;92,89;91,23;;;;;
2060;Межрегиональный открытый социальный институт;;;99,08;93,37;92,14;88,01;88,87;83,41;82,88
2062;Институт Индустрии Моды;;;;;;;;;
2063;Санкт-Петербургский институт экономики и управления;;;;;100;100;100;100;100
2064;Калининградский институт управления;;;;;95,56;98,94;99,29;99,5;100
2065;Сантк-Петербургский Гуманитарный университет профсоюзов;;;;;57,93;69,47;59,42;69,8;59,17
2066;Владимирский институт туризма и гостеприимства;;;97,24;100;100;;;;
2067;Уральский институт экономики, управления и права;;;100;100;100;100;100;100;100
2068;Московский институт предпринимательства и права;;;;;;;;;
2069;ростовский международный институт экономики и управления;;;100;96,67;;;;;
2070;Ростовский институт защиты предпринимателя;;;100;;100;100;100;100;100
2071;Региональный финансово-экономический институт;;;100;100;100;100;100;100;
2072;Среднерусский гуманитарно-технологический институт;;;98,99;99,65;99,27;99,48;99,14;98,94;98,97
2073;Московский гуманитарный институт имени Е.Р.Дашковой;;;100;100;;;;;
2074;Кавказский светский институт;;;;;;;;;
2075;Западно-Сибирский Институт Финансов и Права;;;;;;;;;
2076;Московский новый юридический институт;;;;;;;;;
2077;Томский заочный финансово-юридический институт;;;;100;;;;;
2078;Российская экономическая школа (институт);;;85,56;93,75;93,03;98,51;96,66;96,93;97,65
2079;Санкт-Петербургский институт внешнеэкономических связей, экономики и права;;;;100;100;100;100;;
2080;Институт бизнеса и права;;;;;;;;;
2081;Сочинский институт моды, бизнеса и права ;;;100;100;100;100;;;
2082;Институт управления;;;;99,92;100;100;100;100;100
2083;Гуманитарно-экономический и информационно-технологический институт;;;;;;;;;
2084;МЕЖДУНАРОДНЫЙ УНИВЕРСИТЕТ В МОСКВЕ;;;81,14;79,86;77,24;85,85;86,73;87,6;98,74
2085;Московская гуманитарно-техническая академия;;;100;100;100;100;100;;
2086;Экономико-юридический институт;;;;;;;;;
2087;СИБИРСКАЯ АКАДЕМИЯ УПРАВЛЕНИЯ И МАССОВЫХ КОММУНИКАЦИЙ (ИНСТИТУТ);;;;100;;;;;
2089;Международный еврейский институт экономики, финансов и права;;;;100;100;100;100;100;100
2090;Институт международных экономических отношений;;;100;;;;;;
2092;Приамурский институт агроэкономики и бизнеса;;;;100;;;100;100;
2093;Белгородский инженрено-экономический институт;;;100;;;;;;
2094;Дагестанская академия образования и культуры;;;;100;100;100;100;100;
2095;Уральский гуманитарный институт;;;100;100;;;;;
2096;Институт государственного администрирования;;;;;;100;100;100;100
2151;Московский государственный психолого-педагогический университет;;;33;25,99;16,62;9,26;9,83;13,9;11,73
2155;Московская государственная академия делового администрирования;;;;;;;;;
2183;Московский городской педагогический университет;;;18,97;21,08;23,11;29,78;21,31;27,51;25,24
2189;Московский институт открытого образования;;;;;;;;;
2197;Институт искусства реставрации;;;66,46;;;100;100;;
2198;Ивановский государственный политехнический университет;;;20,7;25,17;26,38;25,65;26,29;23,27;20,52
5516;Крымский инженерно-педагогический университет;;;;;19,94;19,67;14,54;10,53;8,7
5517;Крымский университет культуры, искусств и туризма;;;;19,09;13,94;13,04;14,42;11,68;
5518;Крымский институт бизнеса;;;;;;;;;
5519;Образовательная организация высшего образования Университет экономики и управления;;;;;;100;100;100;79,6
5542;Керченский государственный морской технологический университет;;;;;;;;;
5572;Профессиональный институт управления;;;;;;;;;
5616;Институт иностранных языков;;;;98,15;97,94;;;;
5618;Санкт-Петербургский институт искусств и реставрации;;;;100;;100;100;100;100
5625;Северо-Западный открытый технический университет;;;;100;;100;100;;
5631;Московский институт управления;;;;;;;;;
5635;Московский институт государственного и муниципального управления;;;;;;;;;
5636;Московский институт психологии;;;;;;;;;
5637;Московский юридический институт;;;;;;;;;
5664;Институт языков и культур имени Льва Толстого;;;;;100;;;;
5675;Сколковский институт науки и технологий;;;;;;;;;
5802;Московский исламский институт;;;100;100;;;;;
5961;Пензенская духовная семинария Пензенской Епархии Русской Православной Церкви;;;;;;;100;97,71;85,51
100256;Санкт-Петербургский государственный экономический университет;;;62,43;69,08;71,51;66,4;62,99;65,79;62,43
100345;Исследовательский центр частного права имени С.С. Алексеева при Президенте Российской Федерации;;;;13,84;31,27;20,72;22,28;13,01;6,86
110134;Мордовский гуманитарный институт;;;;;99,36;99,99;;;
110135;Институт международных связей;;;100;100;;100;99,91;100;93,15
110136;Институт права и экономики;;;100;100;100;;;;
110138;Академический Гуманитарный Институт;;;;;;;;;
110139;Академический институт прикладной энергетики;;;100;100;100;100;;;
110140;Академический международный институт;;;;100;;;;;
110141;Академический правовой институт;;;;100;;;;;
110142;Академия гражданской защиты и медицины катастроф;;;;;;;;;
110144;Академия социального образования;;;100;100;100;100;91,14;100;100
110145;Академия социального управления;;;6,89;4,24;6,45;3,11;2,02;2,56;4
110147;Академия сферы социальных отношений;;;;;;;;;
110148;Академия труда и социальных отношений;;;;78,21;84,91;87,6;80,63;88,05;86,48
110152;Алтайский институт финансового управления;;;100;100;;;;;
110153;Альметьевский государственный институт муниципальной службы;;;;;;;;;
110154;Альметьевский государственный нефтяной институт;;;62,33;57,51;52,43;62,95;43,97;53,58;42,69
110155;Астраханский инженерно-строительный институт;;;14,98;17,43;23,31;21,99;18,02;18,59;17,33
110156;Байкальский гуманитарный институт;;;;;100;;100;100;100
110157;Байкальский экономико-правовой институт;;;;;;100;100;;
110158;Балтийский институт иностранных языков и межкультурного сотрудничества;;;;100;100;100;;;
110159;Балтийский институт экологии, политики и права;;;;100;100;100;;;
110160;Башкирская академия государственной службы и управления при Президенте Республики Башкортотстан;;;89,97;87,01;91,63;89,67;90,91;96,13;80,3
110161;Белгородский государственный институт искусств и культуры (БГИИК);;;39,85;14,9;15,02;17,55;18,86;18,87;17,85
110162;Владикавказский   институт   экономики, управления    и  права (г. Владикавказ);;;100;100;;;;;
110163;Владимирский институт бизнеса (ВИБ);;;;;;;;;
110164;Волгоградский государственный институт искусств и культуры;;;0;5,68;7,04;7,81;6,53;6,68;5,29
110165;Волгоградская консерватория (институт) имени П.А.Серебрякова;;;0,25;7,14;5,6;8,17;9,15;12,15;12,47
110166;Волгоградский юридический институт;;;;;;;;;
110167;Волжский институт экономики, педагогики и права;;;62,54;68,57;65,04;70,87;68,26;67,05;66,97
110168;Воронежский институт инновационных систем;;;;;;;;;
110169;Воронежский институт экономики и социального управления;;;92,86;97,47;97,32;97,42;91,81;95,73;97,34
110170;Воронежский экономико-правовой институт;;;100;100;100;100;100;100;100
110171;Восточно-Европейский институт;;;99,89;;99,98;100;100;100;
110173;Высшая школа музыки Республики Саха (Якутия) (институт) имени В. А. Босикова;;;0;1,95;4,03;6,04;3,78;3,11;0,63
110174;Высшая школа предпринимательства (институт);;;95,19;91,05;100;100;100;100;100
110176;Высшая школа психологии (Институт);;;;;;;;;
110180;Государственный институт экономики, финансов, права и технологий;;;39,09;38,04;33,56;26,62;24,33;22,02;17,63
110182;Гуманитарно-Прогностический Институт;;;;;;;;;
110183; Гуманитарно-социальный институт;;;100;100;100;100;100;100;100
110185;Гуманитарно-Экологический Институт;;;;;;;;;
110186;Открытый Институт - Высшая профессиональная школа;;;;;;100;100;100;99,96
110187;Гуманитарный институт имени П.А.Столыпина;;;;100;100;100;100;100;100
110188;Гуманитарный институт;;;;;;100;100;100;
110189;Дагестанский государственный институт народного хозяйства;;;40,1;25,14;22,19;18,64;22,15;14,38;11,23
110190;Дагестанский медицинский стоматологический институт;;;;;;100;100;100;100
110192;Дальневосточный институт коммуникаций;;;100;100;100;100;100;100;100
110193;Дальневосточный институт международного бизнеса;;;;;;;;;
110194;Дальневосточный институт международных отношений;;;;100;100;;;;
110196;Донской институт дистанционного образования;;;;;;;;;
110197;Донской юридический институт;;;100;;;;;;
110199;Европейско-Азиатский институт управления и предпринимательства;;;;;;;;;
110200;Екатеринбургская академия современного искусства (институт) ;;;0;10,59;12,54;14,07;10,8;10,12;7,29
110202;Ессентукский институт управления, бизнеса и права;;;;100;100;100;100;100;100
110203;Заокский христианский гуманитарно-экономический институт;;;98,88;;;100;;;
110204;Западно-Уральский институт экономики и права;;;100;99,43;100;100;100;100;98,77
110207;Ижевский институт управления;;;;;;;;;
110209;Институт адвокатуры, нотариата и международных отношений;;;;;;;;;
110212;Институт бизнеса, психологии и управления;;;100;100;;;;;
110214;Институт гуманитарного образования и информационных технологий;;;;100;100;100;100;96,89;85,89
110216;Институт деловой карьеры;;;;100;100;100;100;98,56;100
110218;Институт журналистики и литературного творчества;;;;;;100;100;;100
110219;Институт законоведения и управления ВПА;;;;;;100;99,25;;
110221;ИНСТИТУТ ИНОСТРАННЫХ ЯЗЫКОВ;;;;97,8;;98,46;100;100;97,82
110222;Институт информационных технологий, экономики и менеджмента;;;;100;100;100;100;100;100
110224;Институт Коммерции и Права;;;100;;;;;;
110227;Институт международного права и экономики имени А.С. Грибоедова;;;99,93;100;100;100;100;100;91,3
110229;Институт международной торговли и права;;;93,69;;92,07;91,15;92,11;;
110230;Институт менеджмента, экономики и инноваций;;;100;100;100;;100;100;100
110231;Институт мировой экономики и финансов;;;100;100;100;100;100;100;
110232;Институт открытого бизнес-образования и дизайна;;;;;100;100;100;100;100
110236;Институт программных систем УГП имени А.К.Айламазяна;;;94,44;;55,32;;;;
110237;Московский институт психологии;;;;100;100;;;;
110238;Институт психологии и педагогики;;;;;;;;;
110239;Институт радиоэлектроники, сервиса и диагностики;;;;100;100;100;100;100;100
110240;Институт русского театра;;;;100;;;;;
110241;Институт систем управления экономикой и международного права;;;;;;;;;
110243;Институт современного искусства;;;99,71;99,59;99,72;98,65;99,17;99,83;95,57
110244;Институт современного права и экономики;;;;;;;;;
110245;Институт современного управления, кино и телевидения;;;;;;;;;
110248;Институт социальных наук;;;;;100;100;100;100;99,77
110250;Институт технологии туризма;;;100;;;;;;
110251;Институт международных отношений;;;;100;;;;;
110252;Институт Уник;;;;;;;;;
110254;Институт управления и права;;;;;;100;;;
110255;Институт Управления, Бизнеса и Права (г.Пятигорск);;;;;100;100;100;100;
110261;Институт финансов и права;;;100;100;100;100;100;100;100
110263;Институт финансового контроля и аудита;;;;;;;;;
110264;Институт цивилизации;;;100;;;;;;
110265;Институт Экономики Бизнеса;;;96,08;100;100;;;;
110266;Институт экономики и культуры;;;;;;100;100;100;100
110267;Институт экономики и права (г. Воронеж);;;;100;100;100;100;100;
110269;Институт экономики и предпринимательства;;;;;;;;;
110271;Институт экономики и управления в промышленности;;;100;100;100;100;100;100;100
110273;Институт экономики предпринимательства;;;;;;;;;
110274;Институт экономики, права и гуманитарных специальностей;;;;;;;;;
110275;Кабардино-Балкарский институт бизнеса;;;;100;100;100;100;;
110276;Казанский институт предпринимательства и права;;;;;;100;100;100;100
110278;Камский институт;;;;;;;;;
110279;Камский институт искусств и дизайна;;;;98,65;98,54;100;100;98,17;95,78
110280;Кировский институт иностранных языков;;;100;100;;;;;
110281;Коми республиканская академия государственной службы и управления;;;78,41;72,71;69,01;71,68;56,87;31,95;34,95
110282;КРАСНОДАРСКИЙ МУНИЦИПАЛЬНЫЙ МЕДИЦИНСКИЙ ИНСТИТУТ ;;;52,23;48,53;55,13;79,18;89,58;100;
110283; Кубанский институт информзащиты;;;;;;100;100;;
110284;Кубанский медицинский институт;;;100;100;100;100;100;100;100
110285;Кузбасский институт экономики и права;;;;;;;;;
110286;Кумертауский институт экономики и права;;;100;100;100;100;100;100;100
110288;Курская академия государственной и муниципальной службы;;;49,3;57,76;45,7;31,69;26,82;31,72;25,58
110289;Курский автодорожный институт;;;;;;;;;
110291;Ленинградский государственный университет имени А.С. Пушкина;;;45,67;45,18;46,51;41,86;43,06;43,19;44,73
110292;Липецкий инстиут управления;;;;;;;;;
110293;Магнитогорская государственная консерватория (академия) имени М.И. Глинки;;;5,35;6,88;6,58;5,95;5,85;5,64;3,75
110294;Махачкалинский инновационный университет;;;;;;;;;
110295;Международная академия бизнеса и управления;;;100;100;100;100;100;100;100
110296;Международная академия оценки и консалтинга;;;;100;100;;;;
110297;Международный инновационный университет;;;100;100;100;100;100;100;99,38
110298;Международный институт бизнес-образования;;;100;;;;;;
110301;Международный славянский институт;;;98,04;99,39;100;100;100;100;100
