1975;Тульский институт управления и бизнеса имени Никиты Демидовича Демидова;;;35,91;57,88;50,59;56,11;70,52;80,61;86,13
1976;Международный институт менеджмента ЛИНК;;;59,60;50,64;;39,99;;;
1977;Санкт-Петербургская юридическая академия;;;;61,42;67,59;73,00;73,00;90,83;114,17
1978;Самарский институт бизнеса и управления;;;;;;;;;
1979;Южно-Сахалинский институт экономики, права и информатики;;;70,48;87,44;86,05;46,21;;;
1981;Московский институт мировой экономики и международных отношений;;;;;;;;;
1982;ИНСТИТУТ ТЕАТРАЛЬНОГО ИСКУССТВА им. П.М. ЕРШОВА;;;;80,83;105,00;130,88;462,85;52,50;
1983;Смольный институт Российской академии образования;;;30,68;43,38;35,69;89,37;66,30;;
1984;Московский финансово-правовой интитут;;;;;;;;;
1985;Российская школа частного права;;;;;;;;;
1986;Сергиево-Посадский гуманитарный институт;;;46,20;52,27;60,96;;;;
1987;Московский институт управления;;;;;;;;;
1988;Владикавказский институт управления;;;21,42;;;46,79;35,14;35,36;31,12
1990;Межрегиональный институт экономики и права;;;53,89;56,00;75,18;110,01;115,93;119,47;122,18
1991;Восточно-Сибирский институт экономики и права;;;;57,00;57,20;62,00;67,88;69,00;75
1992;Московский институт банковского дела;;;;;;;;;
1994;Институт экономики и управления;;;;49,48;59,08;54,67;28,56;6,43;6,71
1995;Московский Институт Телевидения и Радиовещания Останкино;;;25,84;17,94;78,36;;;;
1996;Международный институт компьютерных технологий;;;34,92;34,00;46,91;56,26;62,82;62,82;63,72
1997;Московский институт физической культуры и спорта;;;;;;;;;
1998;Подольский социально-спортивный институт;;;49,22;51,60;61,83;;;;
1999;Балаковский институт бизнеса и управления;;;;;;;;;
2000;ИНСТИТУТ ДРУЖБЫ НАРОДОВ КАВКАЗА;;;30,00;32,00;46,94;54,03;58,98;61,00;61,19
2001;Московский экономико-финансовый институт;;;;;;;;;
2002;Невский институт языка и культуры;;;;15,40;;;4,43;8,88;5,29
2003;Московский институт юриспруденции;;;;;;;;;
2004;Негосудрственное Алтайский экономико-юридический институт;;;37,63;42,17;48,19;;;;
2005;Прикамский социальный институт;;;45,00;45,35;;53,71;50,52;34,18;54,61
2007;Сибирский институт международных отношений и регионоведения;;;44,96;42,97;48,52;58,15;67,42;;
2008;Волгоградский институт бизнеса;;;35,07;34,21;38,85;39,73;43 747,98;45,76;47,34
2009;Негосударственное Армавирский лингвистический социальный институт;;;3,94;30,39;40,54;85,81;62,74;75,49;78,96
2010;Институт гостиничного и туристического менеджмента;;;;;;;;;
2011;Московский архитектурно-строительный институт;;;80,92;89,40;;;;;
2012;Международный гуманитарно-лингвистический институт;;;;90,21;98,51;121,78;142,07;162,86;163,67
2015;Пермский институт муниципального управления;;;;;;;;;
2016;Институт менеджмента и рынка;;;;;;;;;
2017;ТУЛЬСКИЙ УНИВЕРСИТЕТ (ТИЭИ);;;32,40;31,66;46,30;49,72;49,84;;52,56
2018;Санкт–Петербургский медико-социальный институт;;;;;23,88;83,99;104,22;110,27;117
2019;Уральский институт коммерции и права;;;;34,83;;150 294,16;260,54;91,45;
2022;Владикавказский институт Моды и Дизайна;;;4,68;;;;;;
2023;Высшая школа бизнеса, безопасности и управления;;;;;;;;;
2024;Омский институт международного менеджмента и иностранных языков Ин.яз. - Омск;;;24,77;;;;;;
2025;Сибирский университет потребительской кооперации;;;40,01;41,03;50,94;77,34;91,72;71,54;75
2026;Международная Гуманитарно-Техническая Академия (институт);;;;13,99;;;;;
2027;Московская международная академия;;;;107,66;121,74;141,68;193,42;261,04;224,14
2028;Московский институт государственного управления и права;;;49,38;;33,28;44,91;41,64;;
2029;Институт современных технологий и экономики;;;;;;;;;
2030;Евразийский институт экономики, менеджмента, информатики;;;;;;;;;
2032;Ростовский институт иностранных языков;;;;;;;;;
2033;Открытый технологический институт;;;;59,93;;;;68,81;97,56
2034;Институт социально-экономического прогнозирования и моделирования;;;40,13;56,77;75,91;;;;
2035;Сибирский институт бизнеса, управления и психологии;;;54,82;47,35;57,81;73,56;84,61;76,81;86,25
2036;Новый гуманитарный институт;;;18,77;28,07;28,46;18,73;18,73;;
2039;Столичный институт переводчиков;;;;;;;;;
2040;Казанский институт финансов, экономики и информатики;;;42,69;62,48;60,39;78,50;78,50;;
2041;Челябинский институт экономики и права им. М.В. Ладошина;;;36,22;39,64;46,47;;;;
2042;Институт специальной педагогики и психологии;;;;51,60;;41,41;;;
2043;Балтийский Гуманитарный Институт;;;;61,86;86,85;121,27;127,55;162,33;137,07
2044;Институт бизнеса, информационных технологий и финансов;;;;;;;;;
2045;Московская академия творчества;;;;;;;;;
2046;Московский технологический институт ВТУ;;;90,22;120,38;123,52;117,58;;;
2047;Московский финансово-экономический инcтитут;;;;103,05;114,36;141,13;137,53;;
2048;Институт экономики;;;21,96;0,00;;;;;
2049;Институт экономики и управления (г. Пятигорск);;;;15,85;;;;;
2050;Рязанский институт открытого образования;;;;;;;;;
2051;Томский экономико-юридический институт;;;;42,69;;;;;
2052;Экономико-правовой институт;;;;;;;;;
2053;Институт международных экономических связей;;;;90,00;92,31;129,90;144,31;147,47;157,32
2054;Санкт-Петербургский институт гуманитарного образования;;;;;;;;;
2055;Московский университет государственного управления;;;79,15;86,09;;;;;
2056;Кисловодский институт экономики и права;;;36,00;;;;;;
2057;Невский институт управления и дизайна;;;46,00;44,00;;;;;
2059;АЛТАЙСКАЯ АКАДЕМИЯ ЭКОНОМИКИ И ПРАВА (ИНСТИТУТ);;;36,60;35,86;;;;;
2060;Межрегиональный открытый социальный институт;;;27,35;32,52;40,67;47,89;50,45;52,60;52,8
2062;Институт Индустрии Моды;;;;;;;;;
2063;Санкт-Петербургский институт экономики и управления;;;;;82,72;93,78;84,10;65,84;69,44
2064;Калининградский институт управления;;;;;43,86;63,08;59,54;59,56;60,5
2065;Сантк-Петербургский Гуманитарный университет профсоюзов;;;;;52,32;39,24;46,80;63,61;79,38
2066;Владимирский институт туризма и гостеприимства;;;41,60;40,37;35,36;;;;
2067;Уральский институт экономики, управления и права;;;64,53;84,33;53,50;18,59;21,47;21,47;6,7
2068;Московский институт предпринимательства и права;;;;;;;;;
2069;ростовский международный институт экономики и управления;;;28,49;30,43;;;;;
2070;Ростовский институт защиты предпринимателя;;;26,26;;41,16;48,82;51,08;51,53;55,34
2071;Региональный финансово-экономический институт;;;43,50;33,16;41,65;48,01;35,62;22,15;
2072;Среднерусский гуманитарно-технологический институт;;;44,26;27,12;47,00;66,00;70,00;70,00;82
2073;Московский гуманитарный институт имени Е.Р.Дашковой;;;78,66;83,06;;;;;
2074;Кавказский светский институт;;;;;;;;;
2075;Западно-Сибирский Институт Финансов и Права;;;;;;;;;
2076;Московский новый юридический институт;;;;;;;;;
2077;Томский заочный финансово-юридический институт;;;;2,95;;;;;
2078;Российская экономическая школа (институт);;;272,31;465,20;485,45;427,59;452,99;425,87;499,98
2079;Санкт-Петербургский институт внешнеэкономических связей, экономики и права;;;;54,09;71,69;99,04;36,64;;
2080;Институт бизнеса и права;;;;;;;;;
2081;Сочинский институт моды, бизнеса и права ;;;35,58;39,37;42,11;35,67;;;
2082;Институт управления;;;;43,10;53,71;55,96;86,46;79,60;64,83
2083;Гуманитарно-экономический и информационно-технологический институт;;;;;;;;;
2084;МЕЖДУНАРОДНЫЙ УНИВЕРСИТЕТ В МОСКВЕ;;;82,34;106,05;102,40;132,58;123,04;85,79;90,79
2085;Московская гуманитарно-техническая академия;;;22,98;32,11;40,76;109,21;137,32;;
2086;Экономико-юридический институт;;;;;;;;;
2087;СИБИРСКАЯ АКАДЕМИЯ УПРАВЛЕНИЯ И МАССОВЫХ КОММУНИКАЦИЙ (ИНСТИТУТ);;;;42,78;;;;;
2089;Международный еврейский институт экономики, финансов и права;;;;35,20;109,87;127,76;166,53;130,20;130,2
2090;Институт международных экономических отношений;;;18,45;;;;;;
2092;Приамурский институт агроэкономики и бизнеса;;;;28,18;;;24,17;18,32;
2093;Белгородский инженрено-экономический институт;;;25,69;;;;;;
2094;Дагестанская академия образования и культуры;;;;29,47;31,00;31,00;23,43;23,46;
2095;Уральский гуманитарный институт;;;47,12;48,59;;;;;
2096;Институт государственного администрирования;;;;;;110,01;111,91;112,27;110,56
2151;Московский государственный психолого-педагогический университет;;;85,00;81,32;85,00;91,94;138,10;155,88;164,3
2155;Московская государственная академия делового администрирования;;;;;;;;;
2183;Московский городской педагогический университет;;;83,62;88,26;97,05;116,93;146,68;162,93;175,03
2189;Московский институт открытого образования;;;;;;;;;
2197;Институт искусства реставрации;;;41,05;;;27,00;0,00;;
2198;Ивановский государственный политехнический университет;;;24,27;30,18;31,15;36,93;43,97;46,32;47,65
5516;Крымский инженерно-педагогический университет;;;;;35,12;40,44;49,99;53,40;59,76
5517;Крымский университет культуры, искусств и туризма;;;;25,42;35,58;40,12;48,21;54,22;
5518;Крымский институт бизнеса;;;;;;;;;
5519;Образовательная организация высшего образования Университет экономики и управления;;;;;;20,22;23,00;18,70;13,75
5542;Керченский государственный морской технологический университет;;;;;;;;;
5572;Профессиональный институт управления;;;;;;;;;
5616;Институт иностранных языков;;;;99,06;137,75;;;;
5618;Санкт-Петербургский институт искусств и реставрации;;;;1,57;;21,08;26,82;21,08;12,05
5625;Северо-Западный открытый технический университет;;;;34,94;;18,12;18,12;;
5631;Московский институт управления;;;;;;;;;
5635;Московский институт государственного и муниципального управления;;;;;;;;;
5636;Московский институт психологии;;;;;;;;;
5637;Московский юридический институт;;;;;;;;;
5664;Институт языков и культур имени Льва Толстого;;;;;8,64;;;;
5675;Сколковский институт науки и технологий;;;;;;;;;
5802;Московский исламский институт;;;12,41;18,69;;;;;
5961;Пензенская духовная семинария Пензенской Епархии Русской Православной Церкви;;;;;;;19,51;26,60;40,33
100256;Санкт-Петербургский государственный экономический университет;;;51,87;54,84;73,62;90,34;106,84;122,07;136,65
100345;Исследовательский центр частного права имени С.С. Алексеева при Президенте Российской Федерации;;;;17,64;38,79;138,62;94,46;203,77;199,49
110134;Мордовский гуманитарный институт;;;;;35,75;39,38;;;
110135;Институт международных связей;;;34,40;31,95;;59,58;61,22;58,87;82,05
110136;Институт права и экономики;;;27,81;34,62;47,89;;;;
110138;Академический Гуманитарный Институт;;;;;;;;;
110139;Академический институт прикладной энергетики;;;80,00;96,69;59,81;68,54;;;
110140;Академический международный институт;;;;91,22;;;;;
110141;Академический правовой институт;;;;16,76;;;;;
110142;Академия гражданской защиты и медицины катастроф;;;;;;;;;
110144;Академия социального образования;;;29,99;45,42;48,06;67,00;68,00;34,08;46
110145;Академия социального управления;;;79,72;73,76;104,34;136,71;143,70;143,70;105,99
110147;Академия сферы социальных отношений;;;;;;;;;
110148;Академия труда и социальных отношений;;;;35,20;35,50;36,60;36,60;42,77;46,9
110152;Алтайский институт финансового управления;;;28,32;29,14;;;;;
110153;Альметьевский государственный институт муниципальной службы;;;;;;;;;
110154;Альметьевский государственный нефтяной институт;;;33,11;43,10;40,45;40,26;61,23;88,32;78,33
110155;Астраханский инженерно-строительный институт;;;21,95;27,56;29,81;36,84;54,77;58,78;60,42
110156;Байкальский гуманитарный институт;;;;;44,08;;93,17;34,74;55,48
110157;Байкальский экономико-правовой институт;;;;;;26,28;8,50;;
110158;Балтийский институт иностранных языков и межкультурного сотрудничества;;;;57,05;27,53;30,06;;;
110159;Балтийский институт экологии, политики и права;;;;58,43;68,04;22,81;;;
110160;Башкирская академия государственной службы и управления при Президенте Республики Башкортотстан;;;45,23;40,27;39,97;51,93;60,26;66,81;72,42
110161;Белгородский государственный институт искусств и культуры (БГИИК);;;29,73;34,75;38,51;47,70;57,79;60,97;64,05
110162;Владикавказский   институт   экономики, управления    и  права (г. Владикавказ);;;9,77;21,60;;;;;
110163;Владимирский институт бизнеса (ВИБ);;;;;;;;;
110164;Волгоградский государственный институт искусств и культуры;;;29,73;30,42;36,19;42,42;52,11;55,20;52,95
110165;Волгоградская консерватория (институт) имени П.А.Серебрякова;;;34,03;26,23;29,42;35,05;50,05;46,94;49,43
110166;Волгоградский юридический институт;;;;;;;;;
110167;Волжский институт экономики, педагогики и права;;;33,19;30,22;35,95;47,96;60,90;64,59;68,2
110168;Воронежский институт инновационных систем;;;;;;;;;
110169;Воронежский институт экономики и социального управления;;;35,16;44,35;44,49;46,77;33,13;35,10;42,46
110170;Воронежский экономико-правовой институт;;;18,34;36,18;43,08;62,89;66,21;67,65;82,98
110171;Восточно-Европейский институт;;;34,32;;38,32;53,95;46,10;38,12;
110173;Высшая школа музыки Республики Саха (Якутия) (институт) имени В. А. Босикова;;;63,63;68,75;97,94;102,87;120,19;127,87;129,47
110174;Высшая школа предпринимательства (институт);;;55,37;39,52;60,00;76,67;56,36;39,30;40,3
110176;Высшая школа психологии (Институт);;;;;;;;;
110180;Государственный институт экономики, финансов, права и технологий;;;37,23;46,04;51,56;65,47;81,07;84,19;85,55
110182;Гуманитарно-Прогностический Институт;;;;;;;;;
110183; Гуманитарно-социальный институт;;;29,34;29,10;24,38;32,27;20,75;17,00;18,07
110185;Гуманитарно-Экологический Институт;;;;;;;;;
110186;Открытый Институт - Высшая профессиональная школа;;;;;;103,98;102,00;105,27;162,46
110187;Гуманитарный институт имени П.А.Столыпина;;;;20,55;9,95;12,73;7,63;6,84;8,26
110188;Гуманитарный институт;;;;;;29,51;34,49;38,81;
110189;Дагестанский государственный институт народного хозяйства;;;26,46;29,23;30,43;33,87;48,95;48,50;56,79
110190;Дагестанский медицинский стоматологический институт;;;;;;14,18;16,56;21,72;20,96
110192;Дальневосточный институт коммуникаций;;;20,63;38,36;44,61;66,21;74,13;74,44;86,14
110193;Дальневосточный институт международного бизнеса;;;;;;;;;
110194;Дальневосточный институт международных отношений;;;;45,04;37,48;;;;
110196;Донской институт дистанционного образования;;;;;;;;;
110197;Донской юридический институт;;;39,90;;;;;;
110199;Европейско-Азиатский институт управления и предпринимательства;;;;;;;;;
110200;Екатеринбургская академия современного искусства (институт) ;;;41,61;39,79;42,86;55,32;68,93;74,11;77,15
110202;Ессентукский институт управления, бизнеса и права;;;;34,76;34,60;35,02;35,54;41,96;42,87
110203;Заокский христианский гуманитарно-экономический институт;;;28,36;;;28,34;;;
110204;Западно-Уральский институт экономики и права;;;52,81;42,65;41,73;42,73;44,07;48,20;51,59
110207;Ижевский институт управления;;;;;;;;;
110209;Институт адвокатуры, нотариата и международных отношений;;;;;;;;;
110212;Институт бизнеса, психологии и управления;;;18,88;22,69;;;;;
110214;Институт гуманитарного образования и информационных технологий;;;;87,73;89,18;80,60;89,19;112,46;115,83
110216;Институт деловой карьеры;;;;88,04;173,66;132,65;140,58;153,80;157,93
110218;Институт журналистики и литературного творчества;;;;;;13,32;13,32;;18,06
110219;Институт законоведения и управления ВПА;;;;;;54,54;45,12;;
110221;ИНСТИТУТ ИНОСТРАННЫХ ЯЗЫКОВ;;;;27,00;;37,68;34,23;26,11;35,26
110222;Институт информационных технологий, экономики и менеджмента;;;;57,03;57,13;51,43;51,43;47,09;44,89
110224;Институт Коммерции и Права;;;35,05;;;;;;
110227;Институт международного права и экономики имени А.С. Грибоедова;;;81,61;85,92;46,72;196,27;192,51;150,00;204,44
110229;Институт международной торговли и права;;;48,48;;96,48;74,75;568,62;;
110230;Институт менеджмента, экономики и инноваций;;;74,90;100,17;104,95;;140,90;103,05;111,58
110231;Институт мировой экономики и финансов;;;37,26;47,38;57,49;52,89;56,10;56,19;
110232;Институт открытого бизнес-образования и дизайна;;;;;102,02;128,45;138,00;142,23;142,19
110236;Институт программных систем УГП имени А.К.Айламазяна;;;16,17;;52,64;;;;
110237;Московский институт психологии;;;;87,00;88,20;;;;
110238;Институт психологии и педагогики;;;;;;;;;
110239;Институт радиоэлектроники, сервиса и диагностики;;;;41,80;57,50;53,35;57,52;70,39;66,07
110240;Институт русского театра;;;;2,25;;;;;
110241;Институт систем управления экономикой и международного права;;;;;;;;;
110243;Институт современного искусства;;;98,33;102,18;82,83;151,00;151,16;140,42;140,32
110244;Институт современного права и экономики;;;;;;;;;
110245;Институт современного управления, кино и телевидения;;;;;;;;;
110248;Институт социальных наук;;;;;87,52;113,78;116,01;295,82;295,82
110250;Институт технологии туризма;;;36,98;;;;;;
110251;Институт международных отношений;;;;87,00;;;;;
110252;Институт Уник;;;;;;;;;
110254;Институт управления и права;;;;;;16,20;;;
110255;Институт Управления, Бизнеса и Права (г.Пятигорск);;;;;9,38;0,08;30,79;29,17;
110261;Институт финансов и права;;;29,12;29,30;28,96;55,76;52,29;52,29;38,22
110263;Институт финансового контроля и аудита;;;;;;;;;
110264;Институт цивилизации;;;17,10;;;;;;
110265;Институт Экономики Бизнеса;;;93,24;92,18;91,03;;;;
110266;Институт экономики и культуры;;;;;;37,93;41,04;41,04;41,04
110267;Институт экономики и права (г. Воронеж);;;;35,66;37,19;51,21;52,62;57,57;
110269;Институт экономики и предпринимательства;;;;;;;;;
