miccedu_id;clear_name;ind_2013_value;ind_2014_value;ind_2015_value;ind_2016_value;ind_2017_value;ind_2018_value;ind_2019_value;ind_2020_value;ind_2021_value
1;Адыгейский государственный университет;;;1;1;2;3;3;4;7
2;Алтайская государственная педагогическая академия;;;19;24;26;16;14;10;10
3;Алтайский государственный технический университет им. И.И. Ползунова;;;5;12;24;26;30;28;30
4;Алтайский государственный университет;;;14;19;32;54;56;62;60
5;Амурский государственный университет;;;4;6;7;7;12;12;22
6;Амурский гуманитарно-педагогический государственный университет;;;0;0;0;0;0;0;0
7;Ангарская государственная техническая академия;;;0;0;0;0;0;0;0
9;Армавирская государственная педагогическая академия;;;1;1;3;7;6;4;1
11;Астраханский государственный университет;;;14;10;9;12;16;19;27
12;Байкальский государственный университет экономики и права;;;15;10;7;5;6;7;6
13;Балтийский государствнный технический университет ВОЕНМЕХ им. Д.Ф. Устинова;;;4;4;3;3;3;4;14
14;Башкирский государственный педагогический университет им. М. Акмуллы;;;14;28;31;27;21;23;30
15;Башкирский государственный университет;;;5;24;22;19;17;19;24
16;Белгородский государственный технологический университет им. В.Г. Шухова;;;14;12;19;24;38;51;52
17;Белгородский государственный национальный исследовательский университет;;;35;98;144;129;174;256;367
19;Алтайская государственная академия образования имени В.М. Шукшина;;;12;13;12;8;5;0;0
21;Благовещенский государственный педагогический университет;;;11;4;4;5;5;8;7
23;Братский государственный университет;;;0;0;1;0;0;0;0
24;Брянская государственная инженерно-технологическая академия;;;1;0;0;2;6;4;5
25;Брянский государственный технический университет;;;0;8;8;7;13;3;3
26;Брянский государственный университет имени академика И.Г. Петровского.;;;3;2;5;3;4;5;2
27;Бурятский государственный университет;;;14;22;21;21;20;17;16
28;Владивостокский государственный университет экономики и сервиса;;;1;1;1;5;11;7;7
30;Владимирский государственный университет имени Александра Григорьевича и Николая Григорьевича Столетовых;;;25;22;16;13;11;12;17
33;Волгоградский государственный архитектурно-строительный университет;;;2;;;;;;
34;Волгоградский государственный социально-педагогический университет;;;5;;3;3;7;8;11
35;Волгоградский государственный технический университет;;;21;15;19;29;33;35;28
36;Волгоградский государственный университет;;;7;9;11;12;13;22;37
39;Вологодский государственный университет;;;0;0;0;0;0;0;0
40;Воронежский государственный лесотехнический университете имени Г.Ф. Морозова;;;5;4;3;3;5;1;2
41;Воронежский государственный университет инженерных технологий;;;6;10;6;8;6;5;7
42;Воронежский государственный архитектурно-строительный университет;;;44;;;;;;
43;Воронежский государственный педагогический университет;;;8;8;7;11;9;10;10
44;Воронежский государственный технический университет;;;9;7;40;36;31;39;38
45;Воронежский государственный университет ;;;65;72;72;68;66;65;70
46;Восточно-Сибирский государственный университет технологий и управления;;;7;5;3;4;3;5;5
48;Высшая школа народных искусств (институт);;;0;0;0;0;0;0;0
49;Вятский государственный гуманитарный университет;;;8;;;;;;
50;Вятский государственный университет;;;1;7;6;5;7;6;3
51;Гжельский государственный художественно-промышленный институт;;;0;0;0;2;4;3;1
52;Глазовский государственный педагогический институт имени В.Г. Короленко;;;0;0;0;0;0;0;0
53;Горно-Алтайский государственный университет;;;5;6;6;2;1;0;1
54;Государственная академия славянской культуры;;;0;;;;;;
55;Государственная классическая академия имени Маймонида;;;;;;;;;
56;Государственная полярная академия;;;0;;;;;;
57;Государственный академический университет гуманитарных наук;;;0;0;1;1;1;1;0
58;Государственный институт русского языка им. А.С. Пушкина;;;58;63;68;55;61;70;77
59;Национальный исследовательский технологический университет МИСиС;;;48;45;67;58;96;117;118
60;Государтвенный университет управления;;;27;33;24;20;31;41;54
61;Грозненский государственный нефтяной технический университет имени академика М.Д. Миллионщикова;;;0;0;0;0;0;0;1
62;Дагестанский государственный педагогический университет;;;0;0;1;0;0;0;0
63;Дагестанский государственный технический университет;;;0;0;0;2;2;2;2
64;Дагестанский государственный университет;;;9;15;13;9;4;1;3
66;Приамурский государственный университет имени Шолом-Алейхема;;;0;0;2;2;3;2;4
67;Дальневосточный государственный гуманитарный университет;;;;;;;;;
70;Донской государственный технический университет;;;32;27;37;31;32;39;60
72;Елецкий государственный университет им. И.А. Бунина;;;0;3;4;3;1;0;2
76;Ивановский государственный университет;;;14;12;9;4;7;7;8
77;Ивановский государственный химико-технологический университет;;;8;6;5;3;3;1;0
78;Ивановский государственный энергетический университет имени В.И. Ленина;;;4;4;2;2;1;0;0
79;Ижевский государственный технический университет имени М.Т. Калашникова;;;2;5;5;5;3;4;3
80;Ингушский государственный университет;;;0;0;0;0;0;0;1
82;Иркутский национальный исследовательский технический университет;;;43;26;47;43;49;42;41
83;Иркутский государственный университет;;;5;4;7;15;15;18;14
85;Кабардино-Балкарский государственный университет им. Х.М. Бербекова;;;21;38;26;30;48;47;46
86;Казанский государственный архитектурно-строительный университет;;;3;3;8;11;7;14;13
87;Казанский национальный исследовательский технический университет им. А.Н.Туполева-КАИ;;;15;19;26;28;26;24;20
88;Казанский национальный исследовательский технологический университет;;;0;44;49;56;50;48;42
91;Казанский государственный энергетический университет;;;13;11;14;22;24;22;19
92;Калмыцкий государственный университет;;;23;28;21;15;14;12;17
93;Калужский государственный университет им. К.Э. Циолковского;;;2;2;1;1;2;1;1
95;Камчатский государственный университет имени Витуса Беринга;;;0;0;0;0;0;0;
96;Северо-Кавказская государственная гуманитарно-технологическая академия;;;0;1;1;1;1;0;0
97;Карачаево-Черкесского государственного университета имени У.Д. Алиева;;;3;2;3;1;0;0;0
99;Кемеровский государственный университет;;;3;4;6;5;4;2;2
100;Кемеровский технологический институт пищевой промышленности;;;2;4;5;3;;;
101;Ковровская государственная технологическая академия имени В.А.Дегтярева;;;0;0;0;0;0;0;0
103;Комсомольский-на-Амуре государственный технический университет;;;0;13;19;20;23;14;7
104;Костромской государственный технологический университет.;;;0;0;1;2;3;3;3
105;Костромской государственный университет имени Н.А. Некрасова;;;5;;;;;;
106;Красноярский государственный педагогический университетим. В.П. Астафьева;;;2;0;6;6;6;5;6
108;Кубанский государственный технологический университет;;;12;12;8;8;11;13;15
109;Кубанский государственный университет;;;27;16;20;18;20;17;27
111;Кузбасский государственный технический университет имени Т.Ф.Горбачева;;;0;0;0;0;1;1;1
112;Курганский государственный университет;;;0;0;1;2;2;0;0
113;Юго-Западный государственный университет;;;11;11;15;22;24;40;37
114;Курский государственный университет;;;17;13;8;8;9;7;6
116;Липецкий государственный педагогический университет;;;1;3;1;1;1;1;1
117;Липецкий государственный технический университет;;;7;9;6;4;6;1;1
118;Литературный институт имени А.М. Горького;;;1;3;4;6;6;7;5
119;МАТИ - Российский государственный технологический университет имени К.Э. Циолковского;;;;;;;;;
120;Магнитогорский государственный технический университет им. Г.И. Носова;;;2;3;4;3;3;5;4
122;Майкопский государственный технологический университет;;;2;2;1;7;12;18;13
123;Поволжский государственный технологический университет;;;0;1;4;6;8;7;5
124;Марийский государственный университет;;;0;1;3;6;5;9;6
126;Мордовский государственный педагогический институт имени М.Е. Евсевьева;;;0;0;0;1;2;2;1
127;Мордовский государственный университет им. Н.П. Огарёва;;;11;43;49;55;57;67;90
129;Московский государственный университет тонких химических технологий имени М.В. Ломоносова;;;11;;;;;;
130;Московский государственный юридический университет имени О.Е. Кутафина;;;19;32;30;23;18;21;20
131;Московский авиационный институт (национальный исследовательский университет);;;36;41;52;63;58;52;45
132;Московский автомобильно-дорожный государственный технический университет (МАДИ);;;58;54;48;50;41;48;56
133;Московский архитектурный институт (государственная академия);;;1;1;2;2;2;2;3
134;МИРЭА - Российский технологический университет;;;10;6;18;26;34;37;46
136;Московский государственный горный университет;;;;;;;;;
137;Московский государственный гуманитарный университет имени М.А. Шолохова;;;;;;;;;
138;Московский государственный индустриальный университет;;;;;;;;;
140;Национальный исследовательский университет МИЭТ;;;31;32;34;35;34;30;27
141;Московский государственный лингвистический университет;;;26;19;30;28;26;16;16
143;Московский государственный гуманитарно-экономический университет;;;5;3;3;5;3;3;3
144;Московский государственный строительный университет;;;50;51;43;56;79;97;120
146;Московский государственный машиностроительный университет (МАМИ);;;10;;;;;;
147;Московский государственный технический университет имени Н.Э. Баумана;;;86;94;79;84;91;88;113
148;Московский государственный технологический университет СТАНКИН;;;14;18;51;59;57;44;52
149;Московский государственный университет экономики, статистики и информатики (МЭСИ);;;;;;;;;
150;Московский государственный университет геодезии и картографии (МИИГАиК);;;22;21;21;15;12;19;26
151;Российский государственный университет им. А.Н. Косыгина (Технологии. Дизайн. Искусство);;;4;4;9;9;12;18;26
153;Московский государственный университет леса;;;2;;;;;;
154;Московский государственный университет печати имени Ивана Федорова;;;15;;;;;;
155;Московский государственный университет пищевых производств;;;20;;8;5;7;22;41
156;Московский государственный университет приборостроения и информатики;;;;;;;;;
158;Московский государственный университет технологий и управления имени К.Г.Разумовского;;;0;0;2;2;1;1;1
159;Московская государственная художественно-промышленная академия имени С.Г. Строганова;;;0;1;10;15;17;23;42
160;Московский педагогический государственный университет;;;104;98;146;165;101;96;148
161;Московский физико-технический институт (государственный университет);;;75;102;139;168;173;168;163
162;Национальный исследовательский университет МЭИ;;;78;77;90;84;72;71;72
163;Мурманский арктический государственный университет;;;0;0;0;0;0;1;1
164;Набережночелнинский институт социально-педагогических технологий и ресурсов;;;2;1;0;4;3;3;1
165;Национальный исследовательский ядерный университет МИФИ;;;23;35;58;81;91;91;75
166;Нижегородский  осударственный архитектурно-строительный университет;;;3;1;3;2;4;2;0
167;Нижегородский государственный лингвистический университет им. Н.А.Добролюбова;;;3;4;3;3;2;2;5
168;Нижегородский государственный педагогический университет имени Козьмы Минина (Мининский университет);;;4;6;5;4;1;2;2
169;Нижегородский государственный технический университет им. Р.Е. Алексеева;;;6;3;7;6;6;7;15
170;Нижегородский государственный университет им. Н.И.Лобачевского;;;28;42;41;42;37;38;38
172;Нижнетагильская государственная социально-педагогическая академия;;;;;;;;;
173;Новгородский государственный университет имени Ярослава Мудрого.;;;7;46;34;38;26;16;10
174;Новосибирская государственная архитектурно-художественная академия;;;0;0;0;0;1;0;0
175;Новосибирский государственный архитектурно-строительный университет (Сибстрин);;;9;11;8;4;3;0;2
176;Новосибирский государственный педагогический университет;;;8;11;10;10;10;9;8
177;Новосибирский государственный технический университет;;;16;36;34;30;27;27;29
178;Новосибирский национальный исследовательский государственный университет;;;34;49;51;67;69;61;79
179;Новосибирский государственный университет экономики и управления НИНХ;;;5;5;5;5;7;8;6
180;Норильский индустриальный институт;;;0;0;0;0;0;0;0
181;Омский государственный институт сервиса;;;0;;;;;;
182;Омский государственный педагогичесий университет;;;6;29;25;25;22;19;21
183;Омский государственный технический университет;;;1;2;9;4;5;5;6
184;Омский государственный университет им. Ф.М. Достоевского;;;19;25;23;27;25;20;19
185;Оренбургский государственный институт менеджмента;;;;;;;;;
186;Оренбургский государственный педагогический университет;;;2;4;7;7;2;4;4
187;Оренбургский государственный университет;;;7;17;18;23;21;16;19
189;Орловский государственный институт экономики и торговли;;;0;0;0;0;0;0;0
190;Государственный университет-учебно-научно-производственный комплекс;;;4;;;;;;
191;Орловский государственный университет;;;2;6;16;25;25;25;19
192;Пензенский государственный технологический университет;;;0;1;0;1;3;2;2
194;Пензенский государственный университет;;;5;18;20;14;12;21;34
195;Пензенский государственный университет архитектуры и строительства;;;0;0;1;3;1;1;0
196;Пермский государственный гуманитарно-педагогический университет;;;1;0;0;0;0;0;0
197;Пермский национальный исследовательский политехнический университет;;;0;5;3;3;4;3;2
198;Пермский государственный национальный исследовательский университет;;;5;6;11;10;9;13;14
199;Петрозаводский государственный университет;;;1;2;3;1;0;0;0
201;Поволжская государственная социально-гуманитарная академия;;;2;3;4;2;4;5;4
202;Поволжский государственный университет сервиса;;;0;0;0;0;0;0;0
206;Пущинский государственый естественно-научный институт;;;1;0;0;0;1;1;5
207;Пятигорский государственный лингвистический университет;;;4;2;2;1;1;1;1
209;Российский экономический университет имени Г.В. Плеханова;;;24;54;54;66;78;83;93
210;Российский государственный геологоразведочный университет имени Серго Орджоникидзе;;;27;22;27;27;19;21;21
211;Российский государственный гидрометеорологический университет;;;39;44;27;22;14;18;15
212;Российский государственный гуманитарный университет;;;18;12;18;17;16;17;19
213;Российский государственный педагогический университет им. А. И. Герцена;;;63;91;120;142;181;245;341
214;Российский государственный профессионально-педагогический университет;;;2;1;1;1;0;1;4
215;Российский государственный социальный университет;;;5;5;6;14;18;15;22
217;Балтийский федеральный университет имени Иммануила Канта;;;19;19;16;25;34;36;39
219;Российский государственный университет нефти и газа имени И.М. Губкина;;;57;64;77;82;68;58;70
220;Российский государственный университет туризма и сервиса;;;6;4;0;1;5;7;5
222;Российский университет дружбы народов;;;566;951;999;982;1 207;1 409;1636
223;Российский химико-технологический университет имени Д.И. Менделеева;;;19;32;37;59;46;34;35
227;Ростовский государственный строительный университет;;;9;;;;;;
228;Ростовский государственный экономический университет(РИНХ);;;11;10;11;18;16;18;15
229;Рыбинский государственный авиационный технический университет имени П.А. Соловьева;;;0;0;0;0;0;0;0
230;Рязанский государственный радиотехнический университет;;;9;12;9;9;11;9;12
231;Рязанский государственный университет имени С.А. Есенина;;;4;5;4;6;6;4;6
232;Санкт-Петербургский государственный лесотехнический университет имини С.М.Кирова;;;19;22;37;42;33;22;15
233;Санкт-Петербургская государственная художественно-промышленная академия имени А.Л. Штиглица;;;4;4;7;14;8;9;7
234;Национальный исследовательский университет ИТМО;;;42;74;122;146;170;176;172
236;Санкт-Петербургский государственный архитектурно-строительный университет;;;15;5;11;16;16;16;19
237;Санкт-Петербургский горный университет;;;32;42;40;53;51;51;54
239;Санкт-Петербургский государственный морской технический университет;;;0;21;30;30;29;28;27
240;Санкт-Петербургский политехнический университет Петра Великого;;;56;76;94;129;128;128;127
241;Санкт-Петербургский государственный технологический университет растительных полимеров;;;;;;;;;
242;Санкт-Петербургский государственный технологический институт (технический университет);;;10;14;13;12;14;15;16
