miccedu_id;clear_name;ind_2013_value;ind_2014_value;ind_2015_value;ind_2016_value;ind_2017_value;ind_2018_value;ind_2019_value;ind_2020_value;ind_2021_value
1;Адыгейский государственный университет;;0,39;2,98;1,44;1,3;1,37;2,01;1,63;0,85
2;Алтайская государственная педагогическая академия;;0;0;0;0;0;0,13;0;0
3;Алтайский государственный технический университет им. И.И. Ползунова;;1,4;1;1,11;0,25;0,73;0,92;1,31;1,1
4;Алтайский государственный университет;;1,18;0,38;0,5;0,98;0,59;1,83;1,61;2,02
5;Амурский государственный университет;;0,73;0,71;0,53;1,38;1,58;1,78;2,93;2,54
6;Амурский гуманитарно-педагогический государственный университет;;4,63;1,81;0,98;0,97;0;0;1,79;2,54
7;Ангарская государственная техническая академия;;0;0;0;0;0;0;0;0
9;Армавирская государственная педагогическая академия;;0;0;0;0,18;0;0;0,27;0
11;Астраханский государственный университет;;0,57;0,51;0,67;0,36;0,47;0,78;0,56;1,24
12;Байкальский государственный университет экономики и права;;1,43;3,63;1,69;1,64;2,02;2,14;3,7;3,53
13;Балтийский государствнный технический университет ВОЕНМЕХ им. Д.Ф. Устинова;;0,62;0,21;1,95;7,58;4,52;6,3;6,5;5
14;Башкирский государственный педагогический университет им. М. Акмуллы;;0,08;0,33;0,82;0,71;0,19;0,01;0,1;0,1
15;Башкирский государственный университет;;1,07;1,7;0,37;0,49;0,71;0,61;1,13;1,06
16;Белгородский государственный технологический университет им. В.Г. Шухова;;1,76;3,19;5,01;6,62;6,48;5,61;6,16;6,96
17;Белгородский государственный национальный исследовательский университет;;3,07;2,72;3,22;3,94;5,09;5,13;8,71;11,33
19;Алтайская государственная академия образования имени В.М. Шукшина;;0,02;0;0;0;0;0;0;0
21;Благовещенский государственный педагогический университет;;7,76;18,43;5,2;11,24;9,96;6,06;12,8;26,24
23;Братский государственный университет;;0,69;0,33;0,11;0;0;0;0;0
24;Брянская государственная инженерно-технологическая академия;;0;0;0,12;0;0;0;0,31;0
25;Брянский государственный технический университет;;0;0;0;0;0,11;0;0,27;0,39
26;Брянский государственный университет имени академика И.Г. Петровского.;;0;0,07;0;0;0,11;0,11;0,11;0
27;Бурятский государственный университет;;1,19;1,07;1,42;1,85;4,63;2,01;2,25;3,18
28;Владивостокский государственный университет экономики и сервиса;;4,92;6,05;9,8;9,62;6,3;11,34;9,03;12,18
30;Владимирский государственный университет имени Александра Григорьевича и Николая Григорьевича Столетовых;;1,28;1,1;1,12;0,9;1,04;1,26;1,59;1,86
33;Волгоградский государственный архитектурно-строительный университет;;2,08;1,56;;;;;;
34;Волгоградский государственный социально-педагогический университет;;1,85;3,08;;5,39;4,11;7,54;5,24;4,26
35;Волгоградский государственный технический университет;;2,99;2,92;4,01;3,08;4,62;3,27;4,81;3,68
36;Волгоградский государственный университет;;0,07;0,07;0,36;0,47;1,12;0,71;1,45;2,06
39;Вологодский государственный университет;;0;0,08;0;0,09;0;0;0,1;0,1
40;Воронежский государственный лесотехнический университете имени Г.Ф. Морозова;;0,57;0,8;1,27;1,77;0,54;1,07;3,94;0,75
41;Воронежский государственный университет инженерных технологий;;2,37;2,68;3,44;3,39;3,55;3,02;4,35;6,17
42;Воронежский государственный архитектурно-строительный университет;;2,03;2,35;;;;;;
43;Воронежский государственный педагогический университет;;1,19;1,08;0,97;0,45;0,34;0,27;0,33;0,16
44;Воронежский государственный технический университет;;0;0,7;0,22;2,18;2,29;2,07;1,96;2,59
45;Воронежский государственный университет ;;3,58;1,86;3,25;7,25;3,75;2,36;2,26;2,12
46;Восточно-Сибирский государственный университет технологий и управления;;6,94;6,34;4,2;3,42;4,17;4,52;3,25;3,72
48;Высшая школа народных искусств (институт);;0;0;0;0;0;0;3,57;2,63
49;Вятский государственный гуманитарный университет;;0,77;0,73;;;;;;
50;Вятский государственный университет;;0;0,17;0,53;1,11;1,07;1,06;1,44;0,88
51;Гжельский государственный художественно-промышленный институт;;0;0;0;0;0;0,07;0;2,88
52;Глазовский государственный педагогический институт имени В.Г. Короленко;;0;0;0;0;0;0;0;0
53;Горно-Алтайский государственный университет;;0;0;0;0;0;0;0;0
54;Государственная академия славянской культуры;;0;0;;;;;;
55;Государственная классическая академия имени Маймонида;;0;;;;;;;
56;Государственная полярная академия;;;0;;;;;;
57;Государственный академический университет гуманитарных наук;;0;0,42;0,44;0;0;0,37;0;0,36
58;Государственный институт русского языка им. А.С. Пушкина;;21,49;19,4;11,36;36,73;29,17;34,93;30,73;32,99
59;Национальный исследовательский технологический университет МИСиС;;0,46;0,89;0,5;2,07;3,23;2,75;2,91;5,81
60;Государтвенный университет управления;;1,2;1,16;2,61;1,51;2,64;1,28;3,13;2,88
61;Грозненский государственный нефтяной технический университет имени академика М.Д. Миллионщикова;;0;0;0;0;0;0;0;0
62;Дагестанский государственный педагогический университет;;0,24;0;0;0;0;0,01;0,56;0,72
63;Дагестанский государственный технический университет;;0,14;0,44;0,2;0,16;0;0,35;0,89;1,12
64;Дагестанский государственный университет;;0,32;0,96;0,33;0,17;0;0,4;0,21;0,34
66;Приамурский государственный университет имени Шолом-Алейхема;;0,91;0,92;0,22;0,97;4,08;9,89;5,16;4,37
67;Дальневосточный государственный гуманитарный университет;;;;;;;;;
70;Донской государственный технический университет;;1,13;1,8;1,65;3,16;2,37;1,45;3,1;4,44
72;Елецкий государственный университет им. И.А. Бунина;;0;0,11;0;0;0,14;0,37;0,2;0,2
76;Ивановский государственный университет;;3,57;4,1;3,37;4,82;3,47;4,56;4,6;4,58
77;Ивановский государственный химико-технологический университет;;0,72;1,96;1,61;2,11;1,35;3,59;3,56;5,34
78;Ивановский государственный энергетический университет имени В.И. Ленина;;0,8;0,69;0,7;0,38;1,09;1,71;1,07;0,96
79;Ижевский государственный технический университет имени М.Т. Калашникова;;0,17;0,4;0,52;1,88;3,04;1,97;2,63;2,99
80;Ингушский государственный университет;;0;1,14;0;0,13;0,23;0;0;0,12
82;Иркутский национальный исследовательский технический университет;;4,1;4,6;3,88;4,22;7,54;3,7;2,93;2,72
83;Иркутский государственный университет;;1,93;2,13;1,68;2,4;3,44;4,05;3;3,37
85;Кабардино-Балкарский государственный университет им. Х.М. Бербекова;;3,12;2,36;1,93;2,71;2,71;3,3;2,96;4,07
86;Казанский государственный архитектурно-строительный университет;;0,25;1,24;0,92;0,78;0,42;1,03;1,08;0,49
87;Казанский национальный исследовательский технический университет им. А.Н.Туполева-КАИ;;0,78;1,81;1,21;2,49;3,17;2,35;1,34;1,98
88;Казанский национальный исследовательский технологический университет;;1,49;0,79;1,18;1,58;1,82;1,32;1;1,75
91;Казанский государственный энергетический университет;;1,7;1,58;0,99;1,22;1,38;0,54;1,13;1,69
92;Калмыцкий государственный университет;;0,13;2,52;1,57;2,38;1,35;1,76;1,78;0,7
93;Калужский государственный университет им. К.Э. Циолковского;;0;0,19;0;0;0;0,13;0,67;0,14
95;Камчатский государственный университет имени Витуса Беринга;;0;0;0;0;0;0;0;
96;Северо-Кавказская государственная гуманитарно-технологическая академия;;0;0;0;0;0;0;0,2;0
97;Карачаево-Черкесского государственного университета имени У.Д. Алиева;;0,37;0;0;0;0;0;0;0
99;Кемеровский государственный университет;;0,09;0,08;0;0,01;0,08;0;0;0,1
100;Кемеровский технологический институт пищевой промышленности;;0;0;0;0;0,2;;;
101;Ковровская государственная технологическая академия имени В.А.Дегтярева;;0,37;0,65;0;0,42;0;0;0;0
103;Комсомольский-на-Амуре государственный технический университет;;1,64;1,63;0,24;0,19;0,38;2,95;1,55;0,71
104;Костромской государственный технологический университет.;;9,29;5,54;2,74;2,83;1,24;0,4;1,36;0,41
105;Костромской государственный университет имени Н.А. Некрасова;;0;0;;;;;;
106;Красноярский государственный педагогический университетим. В.П. Астафьева;;0,09;0;0,36;0,48;0,75;2,86;3,51;7,07
108;Кубанский государственный технологический университет;;1,05;1,86;2,83;3,41;3,62;2,37;2,86;3,19
109;Кубанский государственный университет;;1,3;0,85;1;1,02;0,59;0,63;0,72;0,62
111;Кузбасский государственный технический университет имени Т.Ф.Горбачева;;0,08;0;0;0;0;0,03;0,21;0
112;Курганский государственный университет;;0;0;0;0;0,01;0;0;0
113;Юго-Западный государственный университет;;1,22;1,93;1,52;3,82;1,28;2,77;3,28;4,27
114;Курский государственный университет;;2,59;2,03;1,01;2,34;0,77;0,5;2,08;2
116;Липецкий государственный педагогический университет;;2,05;1,09;1,52;2,45;1,99;1,85;0,24;0,26
117;Липецкий государственный технический университет;;0,12;0;0,14;0,2;0,2;0,1;0,52;0,48
118;Литературный институт имени А.М. Горького;;0;0;4,58;0;0;1,28;0;0
119;МАТИ - Российский государственный технологический университет имени К.Э. Циолковского;;3,76;;;;;;;
120;Магнитогорский государственный технический университет им. Г.И. Носова;;0,13;0;0;0,13;0,06;0;0;0,07
122;Майкопский государственный технологический университет;;3,19;2,59;3,23;1,95;3,71;4,13;3,79;5,28
123;Поволжский государственный технологический университет;;0;0;0;0;0;0,16;0,15;0,77
124;Марийский государственный университет;;0;0;0;0;0;0;0,31;0,48
126;Мордовский государственный педагогический институт имени М.Е. Евсевьева;;0;0;0;0;0;0;0;0
127;Мордовский государственный университет им. Н.П. Огарёва;;0,88;0,75;0,81;0,69;1,59;1,27;0,97;3,56
129;Московский государственный университет тонких химических технологий имени М.В. Ломоносова;;3,31;3,64;;;;;;
130;Московский государственный юридический университет имени О.Е. Кутафина;;0,67;1,56;1,16;0,15;0,71;1,22;1,61;1,13
131;Московский авиационный институт (национальный исследовательский университет);;3,45;4,44;2,43;3,46;3,46;2,57;4,43;4,58
132;Московский автомобильно-дорожный государственный технический университет (МАДИ);;0;2,91;3,31;6,86;5,71;5,64;5,29;5,43
133;Московский архитектурный институт (государственная академия);;1,14;0;0,41;1,46;0,64;0,86;0,44;0,89
134;МИРЭА - Российский технологический университет;;0,6;0;0,03;0,56;0,65;0,62;0,4;0,97
136;Московский государственный горный университет;;;;;;;;;
137;Московский государственный гуманитарный университет имени М.А. Шолохова;;0,11;;;;;;;
138;Московский государственный индустриальный университет;;0,09;;;;;;;
140;Национальный исследовательский университет МИЭТ;;5,3;3,33;5,24;1,97;2,64;0,32;3,31;2,24
141;Московский государственный лингвистический университет;;1,13;5,69;3,82;4,57;1,53;1,76;3,52;1,9
143;Московский государственный гуманитарно-экономический университет;;0;0;0;0;0,06;0;0;1,68
144;Московский государственный строительный университет;;0,39;0,68;1,33;1,4;2,21;1,98;2,5;4,93
146;Московский государственный машиностроительный университет (МАМИ);;1,19;0,93;;;;;;
147;Московский государственный технический университет имени Н.Э. Баумана;;3,15;3,63;2,34;0,15;3,27;3,87;4,88;3,64
148;Московский государственный технологический университет СТАНКИН;;4,55;6,84;4,49;7,88;5,4;7,14;4,83;5,38
149;Московский государственный университет экономики, статистики и информатики (МЭСИ);;2,3;;;;;;;
150;Московский государственный университет геодезии и картографии (МИИГАиК);;0,32;1,17;1,07;0,58;2,08;1,2;4,55;3,05
151;Российский государственный университет им. А.Н. Косыгина (Технологии. Дизайн. Искусство);;0,17;0,4;0,06;0,36;0,47;0,63;0,77;0,33
153;Московский государственный университет леса;;1,79;0,33;;;;;;
154;Московский государственный университет печати имени Ивана Федорова;;0,57;0,65;;;;;;
155;Московский государственный университет пищевых производств;;0,35;3,63;;2,3;2,29;0;0;0,9
156;Московский государственный университет приборостроения и информатики;;0,1;;;;;;;
158;Московский государственный университет технологий и управления имени К.Г.Разумовского;;0;0;0,02;0,01;0;0,11;0,09;0,17
159;Московская государственная художественно-промышленная академия имени С.Г. Строганова;;1,42;0,5;0,27;0,53;0,73;1,51;1,52;2,26
160;Московский педагогический государственный университет;;5,48;6,16;4,32;3,38;4,5;3,77;5,99;3,68
161;Московский физико-технический институт (государственный университет);;3,5;2,65;4,06;2,14;2,72;2,38;1,06;2,48
162;Национальный исследовательский университет МЭИ;;0,46;2,8;2,56;0,94;1,94;3,08;2,08;2,52
163;Мурманский арктический государственный университет;;0;0;0;0;0;0;0,22;0
164;Набережночелнинский институт социально-педагогических технологий и ресурсов;;0;0;0;0;0;0;0;0
165;Национальный исследовательский ядерный университет МИФИ;;0;0,59;0;0,12;2,49;7,79;15,66;17,15
166;Нижегородский  осударственный архитектурно-строительный университет;;1,46;1,85;1,56;1,8;1,61;2,09;1,39;2,67
167;Нижегородский государственный лингвистический университет им. Н.А.Добролюбова;;0;0,05;0,15;0,49;0,25;0,37;0,44;0,92
168;Нижегородский государственный педагогический университет имени Козьмы Минина (Мининский университет);;0,57;0,17;0,83;0,78;0,76;0,41;1,65;1,13
169;Нижегородский государственный технический университет им. Р.Е. Алексеева;;0,25;0,27;0,6;0;0,6;0,19;0,8;0,44
170;Нижегородский государственный университет им. Н.И.Лобачевского;;0,48;0,71;0,91;1,36;2,99;3,35;5,37;6,2
172;Нижнетагильская государственная социально-педагогическая академия;;;;;;;;;
173;Новгородский государственный университет имени Ярослава Мудрого.;;3,62;2,2;3,03;5,05;4,48;4,48;2,89;4,79
174;Новосибирская государственная архитектурно-художественная академия;;0;0;0;0;0;0;0;0
175;Новосибирский государственный архитектурно-строительный университет (Сибстрин);;0,87;0,2;1,62;0,89;1,41;0,42;2,9;1,24
176;Новосибирский государственный педагогический университет;;0,68;0,22;1,49;0,67;0;0,43;0,35;0,41
177;Новосибирский государственный технический университет;;0,54;0,31;0,44;0,35;0,41;0,28;0,28;0,14
178;Новосибирский национальный исследовательский государственный университет;;0;0;1,54;1,38;4,1;3,69;5,23;1,9
179;Новосибирский государственный университет экономики и управления НИНХ;;0,21;0,92;0,58;0,33;0,81;1,78;2,37;1,06
180;Норильский индустриальный институт;;0;0;0;0;0;0;0;0
181;Омский государственный институт сервиса;;0;0;;;;;;
182;Омский государственный педагогичесий университет;;0,5;0,39;0,08;0;0;0,13;0,97;0,01
183;Омский государственный технический университет;;0,01;0,06;0,11;0;0,05;0;0,09;0
184;Омский государственный университет им. Ф.М. Достоевского;;0,09;0;0;0,26;1,44;0;0;0,09
185;Оренбургский государственный институт менеджмента;;0,03;;;;;;;
186;Оренбургский государственный педагогический университет;;0;0;0;0;0;0;0;0
187;Оренбургский государственный университет;;0;0,05;0,03;0,4;0,28;0,14;0,04;0,09
189;Орловский государственный институт экономики и торговли;;0;0;0,7;0,84;0,3;2,16;0,75;0,89
190;Государственный университет-учебно-научно-производственный комплекс;;0,35;3,33;;;;;;
191;Орловский государственный университет;;1,35;2,38;3,31;2,1;0,89;1,8;2,06;3,86
192;Пензенский государственный технологический университет;;0;0,16;0,39;0,38;0,58;0,44;1,4;1,27
194;Пензенский государственный университет;;1,01;1,54;1,47;1,17;1,06;0,79;3,89;5,53
195;Пензенский государственный университет архитектуры и строительства;;0,01;0,24;0,01;0,11;0,13;0,25;0,12;0,13
196;Пермский государственный гуманитарно-педагогический университет;;0;0;0;0;0;0,04;0;0
197;Пермский национальный исследовательский политехнический университет;;0,05;0;0,22;0,99;0,05;0,15;0,79;1,46
198;Пермский государственный национальный исследовательский университет;;0,06;0,23;0,59;0,4;1,33;1,36;1,45;1,2
199;Петрозаводский государственный университет;;0,16;0,07;0,06;0,15;0,08;0,48;1,55;2,69
201;Поволжская государственная социально-гуманитарная академия;;0;0;0,42;0,15;0,39;0,34;0;0,17
202;Поволжский государственный университет сервиса;;0;0,13;0,37;0,25;0;0;0,48;0,56
206;Пущинский государственый естественно-научный институт;;0;0;0;0;0;0;0;2
207;Пятигорский государственный лингвистический университет;;0,95;0,76;0,24;1,26;1,47;1,46;0,66;1,61
209;Российский экономический университет имени Г.В. Плеханова;;1,3;1;1,38;2,14;1,83;2,57;4,45;3,19
210;Российский государственный геологоразведочный университет имени Серго Орджоникидзе;;2,62;4,64;4,02;6,22;5,49;4,55;5,45;8,11
211;Российский государственный гидрометеорологический университет;;3,36;7,74;2,95;3,69;2,96;2,2;5,84;1,7
212;Российский государственный гуманитарный университет;;1;1,29;1,28;0,93;2,74;2,69;1,98;2,52
213;Российский государственный педагогический университет им. А. И. Герцена;;10,47;10,3;8,37;8,75;9,16;7,4;10,91;13,6
214;Российский государственный профессионально-педагогический университет;;0;0;0;0;0;0,06;0;0,17
215;Российский государственный социальный университет;;0,64;0,12;0,64;0,62;1,22;0,34;0,99;2,67
217;Балтийский федеральный университет имени Иммануила Канта;;1,48;2,92;3,24;2,01;3,76;1,89;1,72;1,68
219;Российский государственный университет нефти и газа имени И.М. Губкина;;5,63;7,86;4,5;7,48;5,75;7,91;7,2;6,61
220;Российский государственный университет туризма и сервиса;;0,26;0,68;0,36;0,57;1,81;1,67;2,17;2,19
222;Российский университет дружбы народов;;16,71;17,72;15,87;15,52;16,74;14,09;16,5;15,35
