2089;Международный еврейский институт экономики, финансов и права;;;;0;0;0;0;0;0
2090;Институт международных экономических отношений;;;0;;;;;;
2092;Приамурский институт агроэкономики и бизнеса;;;;0;;;0;0;
2093;Белгородский инженрено-экономический институт;;;0;;;;;;
2094;Дагестанская академия образования и культуры;;;;17;16;15;1;1;
2095;Уральский гуманитарный институт;;;0;0;;;;;
2096;Институт государственного администрирования;;;;;;0;0;0;0
2151;Московский государственный психолого-педагогический университет;;;170;148;124;86;78;74;67
2155;Московская государственная академия делового администрирования;;;;;;;;;
2183;Московский городской педагогический университет;;;450;522;520;572;596;584;579
2189;Московский институт открытого образования;;;;;;;;;
2197;Институт искусства реставрации;;;0;;;0;0;;
2198;Ивановский государственный политехнический университет;;;161;117;68;62;35;16;20
5516;Крымский инженерно-педагогический университет;;;;;51;60;59;64;71
5517;Крымский университет культуры, искусств и туризма;;;;11;15;12;14;13;
5518;Крымский институт бизнеса;;;;;;;;;
5519;Образовательная организация высшего образования Университет экономики и управления;;;;;;0;0;0;0
5542;Керченский государственный морской технологический университет;;;;;;;;;
5572;Профессиональный институт управления;;;;;;;;;
5616;Институт иностранных языков;;;;15;12;;;;
5618;Санкт-Петербургский институт искусств и реставрации;;;;0;;0;0;0;0
5625;Северо-Западный открытый технический университет;;;;0;;0;0;;
5631;Московский институт управления;;;;;;;;;
5635;Московский институт государственного и муниципального управления;;;;;;;;;
5636;Московский институт психологии;;;;;;;;;
5637;Московский юридический институт;;;;;;;;;
5664;Институт языков и культур имени Льва Толстого;;;;;0;;;;
5675;Сколковский институт науки и технологий;;;;;;;;;
5802;Московский исламский институт;;;0;0;;;;;
5961;Пензенская духовная семинария Пензенской Епархии Русской Православной Церкви;;;;;;;0;0;0
100256;Санкт-Петербургский государственный экономический университет;;;950;677;472;365;322;268;330
100345;Исследовательский центр частного права имени С.С. Алексеева при Президенте Российской Федерации;;;;0;0;0;0;0;0
110134;Мордовский гуманитарный институт;;;;;0;0;;;
110135;Институт международных связей;;;9;0;;0;0;0;0
110136;Институт права и экономики;;;0;0;0;;;;
110138;Академический Гуманитарный Институт;;;;;;;;;
110139;Академический институт прикладной энергетики;;;0;0;0;0;;;
110140;Академический международный институт;;;;0;;;;;
110141;Академический правовой институт;;;;0;;;;;
110142;Академия гражданской защиты и медицины катастроф;;;;;;;;;
110144;Академия социального образования;;;10;6;0;0;0;0;0
110145;Академия социального управления;;;95;87;82;85;66;46;31
110147;Академия сферы социальных отношений;;;;;;;;;
110148;Академия труда и социальных отношений;;;;114;160;178;217;293;318
110152;Алтайский институт финансового управления;;;0;0;;;;;
110153;Альметьевский государственный институт муниципальной службы;;;;;;;;;
110154;Альметьевский государственный нефтяной институт;;;35;0;13;21;32;44;54
110155;Астраханский инженерно-строительный институт;;;28;32;17;10;11;10;13
110156;Байкальский гуманитарный институт;;;;;0;;0;0;0
110157;Байкальский экономико-правовой институт;;;;;;0;0;;
110158;Балтийский институт иностранных языков и межкультурного сотрудничества;;;;0;0;0;;;
110159;Балтийский институт экологии, политики и права;;;;0;0;0;;;
110160;Башкирская академия государственной службы и управления при Президенте Республики Башкортотстан;;;78;90;79;17;5;0;0
110161;Белгородский государственный институт искусств и культуры (БГИИК);;;73;77;73;76;78;75;72
110162;Владикавказский   институт   экономики, управления    и  права (г. Владикавказ);;;0;0;;;;;
110163;Владимирский институт бизнеса (ВИБ);;;;;;;;;
110164;Волгоградский государственный институт искусств и культуры;;;0;0;0;0;0;0;0
110165;Волгоградская консерватория (институт) имени П.А.Серебрякова;;;0;0;0;0;0;0;0
110166;Волгоградский юридический институт;;;;;;;;;
110167;Волжский институт экономики, педагогики и права;;;0;0;0;0;0;0;0
110168;Воронежский институт инновационных систем;;;;;;;;;
110169;Воронежский институт экономики и социального управления;;;9;12;10;10;5;7;8
110170;Воронежский экономико-правовой институт;;;41;0;0;0;0;0;0
110171;Восточно-Европейский институт;;;0;;0;0;0;0;
110173;Высшая школа музыки Республики Саха (Якутия) (институт) имени В. А. Босикова;;;0;0;0;0;0;0;0
110174;Высшая школа предпринимательства (институт);;;0;0;0;0;0;0;0
110176;Высшая школа психологии (Институт);;;;;;;;;
110180;Государственный институт экономики, финансов, права и технологий;;;39;31;24;16;20;21;21
110182;Гуманитарно-Прогностический Институт;;;;;;;;;
110183; Гуманитарно-социальный институт;;;16;13;2;0;0;0;0
110185;Гуманитарно-Экологический Институт;;;;;;;;;
110186;Открытый Институт - Высшая профессиональная школа;;;;;;0;0;0;0
110187;Гуманитарный институт имени П.А.Столыпина;;;;0;0;0;0;0;0
110188;Гуманитарный институт;;;;;;0;0;0;
110189;Дагестанский государственный институт народного хозяйства;;;24;18;8;4;0;0;0
110190;Дагестанский медицинский стоматологический институт;;;;;;1;0;0;0
110192;Дальневосточный институт коммуникаций;;;0;0;0;0;0;0;0
110193;Дальневосточный институт международного бизнеса;;;;;;;;;
110194;Дальневосточный институт международных отношений;;;;0;0;;;;
110196;Донской институт дистанционного образования;;;;;;;;;
110197;Донской юридический институт;;;0;;;;;;
110199;Европейско-Азиатский институт управления и предпринимательства;;;;;;;;;
110200;Екатеринбургская академия современного искусства (институт) ;;;0;0;0;0;0;0;0
110202;Ессентукский институт управления, бизнеса и права;;;;11;11;7;0;2;2
110203;Заокский христианский гуманитарно-экономический институт;;;0;;;0;;;
110204;Западно-Уральский институт экономики и права;;;0;0;0;0;0;0;0
110207;Ижевский институт управления;;;;;;;;;
110209;Институт адвокатуры, нотариата и международных отношений;;;;;;;;;
110212;Институт бизнеса, психологии и управления;;;15;0;;;;;
110214;Институт гуманитарного образования и информационных технологий;;;;0;0;0;0;0;0
110216;Институт деловой карьеры;;;;0;0;0;0;0;0
110218;Институт журналистики и литературного творчества;;;;;;0;0;;0
110219;Институт законоведения и управления ВПА;;;;;;0;0;;
110221;ИНСТИТУТ ИНОСТРАННЫХ ЯЗЫКОВ;;;;0;;0;0;0;0
110222;Институт информационных технологий, экономики и менеджмента;;;;18;17;17;10;0;1
110224;Институт Коммерции и Права;;;0;;;;;;
110227;Институт международного права и экономики имени А.С. Грибоедова;;;63;47;42;30;23;36;63
110229;Институт международной торговли и права;;;0;;0;0;0;;
110230;Институт менеджмента, экономики и инноваций;;;0;0;0;;0;0;0
110231;Институт мировой экономики и финансов;;;0;0;0;0;0;0;
110232;Институт открытого бизнес-образования и дизайна;;;;;0;0;0;0;0
110236;Институт программных систем УГП имени А.К.Айламазяна;;;0;;0;;;;
110237;Московский институт психологии;;;;0;0;;;;
110238;Институт психологии и педагогики;;;;;;;;;
110239;Институт радиоэлектроники, сервиса и диагностики;;;;0;0;0;0;0;0
110240;Институт русского театра;;;;0;;;;;
110241;Институт систем управления экономикой и международного права;;;;;;;;;
110243;Институт современного искусства;;;17;19;11;33;31;22;28
110244;Институт современного права и экономики;;;;;;;;;
110245;Институт современного управления, кино и телевидения;;;;;;;;;
110248;Институт социальных наук;;;;;0;0;0;0;0
110250;Институт технологии туризма;;;0;;;;;;
110251;Институт международных отношений;;;;0;;;;;
110252;Институт Уник;;;;;;;;;
110254;Институт управления и права;;;;;;0;;;
110255;Институт Управления, Бизнеса и Права (г.Пятигорск);;;;;0;0;0;0;
110261;Институт финансов и права;;;0;0;14;11;0;0;0
110263;Институт финансового контроля и аудита;;;;;;;;;
110264;Институт цивилизации;;;0;;;;;;
110265;Институт Экономики Бизнеса;;;24;24;24;;;;
110266;Институт экономики и культуры;;;;;;0;0;0;0
110267;Институт экономики и права (г. Воронеж);;;;0;0;0;0;0;
110269;Институт экономики и предпринимательства;;;;;;;;;
110271;Институт экономики и управления в промышленности;;;0;0;0;0;0;0;0
110273;Институт экономики предпринимательства;;;;;;;;;
110274;Институт экономики, права и гуманитарных специальностей;;;;;;;;;
110275;Кабардино-Балкарский институт бизнеса;;;;0;0;0;0;;
110276;Казанский институт предпринимательства и права;;;;;;0;0;0;0
110278;Камский институт;;;;;;;;;
110279;Камский институт искусств и дизайна;;;;0;0;0;0;0;0
110280;Кировский институт иностранных языков;;;0;0;;;;;
110281;Коми республиканская академия государственной службы и управления;;;4;3;0;0;0;0;0
110282;КРАСНОДАРСКИЙ МУНИЦИПАЛЬНЫЙ МЕДИЦИНСКИЙ ИНСТИТУТ ;;;0;0;17;0;0;0;
110283; Кубанский институт информзащиты;;;;;;0;0;;
110284;Кубанский медицинский институт;;;0;0;0;0;0;0;0
110285;Кузбасский институт экономики и права;;;;;;;;;
110286;Кумертауский институт экономики и права;;;0;0;0;0;0;0;0
110288;Курская академия государственной и муниципальной службы;;;35;29;17;4;0;0;0
110289;Курский автодорожный институт;;;;;;;;;
110291;Ленинградский государственный университет имени А.С. Пушкина;;;216;195;185;181;185;211;210
110292;Липецкий инстиут управления;;;;;;;;;
110293;Магнитогорская государственная консерватория (академия) имени М.И. Глинки;;;8;30;28;37;40;43;40
110294;Махачкалинский инновационный университет;;;;;;;;;
110295;Международная академия бизнеса и управления;;;19;0;0;0;0;0;0
110296;Международная академия оценки и консалтинга;;;;52;0;;;;
110297;Международный инновационный университет;;;57;60;97;114;97;99;113
110298;Международный институт бизнес-образования;;;0;;;;;;
110301;Международный славянский институт;;;18;14;0;0;0;0;0
110302;Международный университет природы, общества и человека Дубна;;;177;155;180;190;186;179;153
110308;Московская Академия Предпринимательства при Правительстве Москвы;;;23;;;;;;
110309;Московская академия рынка труда и информационных технологий;;;3;;;;;;
110310;Московская Высшая Школа Экономики - финансовый институт;;;;;;;;;
110313;Московский городской университет управления Правительства Москвы;;;68;46;38;32;32;31;29
110314;Московский государственный институт индустрии туризма имени Ю.А. Сенкевича;;;32;14;0;0;0;0;0
110315;Московский государственный институт музыки имени А.Г. Шнитке;;;10;20;17;29;49;65;55
110316;Московский государственный областной социально-гуманитарный институт;;;96;101;88;72;45;34;32
110317;Московский государственный областной университет;;;370;459;488;479;464;441;443
110318;Московский гуманитарно-экономический институт;;;67;67;53;54;22;64;35
110319;Московский гуманитарный университет;;;154;147;134;118;108;99;119
110321;Московский институт аналитической психологии и психоанализа;;;;;;;;;
110324;Московский институт современного академического образования;;;;0;1;2;0;0;0
110326;Московский налоговый институт;;;;;;;;;
110327;Московский областной институт управления и права;;;0;0;;;;;
110328;Московский областной социально-гуманитарный институт;;;;;;;;;
110330;Московский психолого-социальный университет;;;;25;23;7;13;17;16
110331;Московский социально-гуманитарный институт;;;;;;;;;
110332;Московский теологический институт Российской Церкви христиан веры евангельской;;;;;;;;;
110333;Московский Транспортный Институт;;;0;;;;;;
110334;Московский художественно-промышленный институт;;;;;;0;0;0;0
110335;Московский экономико-правовой институт;;;;;;;;;
110336;Московский экономический институт Высшая школа Современное образование;;;;;;;;;
110337;Муниципальный институт г. Жуковского;;;0;;;;;;
110338;Мурманская академия экономики и управления;;;0;0;0;0;0;0;0
110339;Набережночелнинский государственный торгово-технологический институт;;;0;0;;0;;;
110341;Национальный институт бизнеса;;;109;62;8;0;0;0;0
110342;Национальный институт недвижимости и инвестиций;;;;;;;;;
110344;Национальный открытый институт г.Санкт-Петербург;;;;7;0;0;0;0;0
110345;Невинномысский государственный гуманитарно-технический институт;;;57;54;38;37;40;28;18
110346;Невинномысский институт экономики, управления и права;;;;0;0;0;0;0;0
110347;Нижегородский государственный инженерно-экономический университет;;;50;58;62;55;55;56;52
110348;Нижегородский институт менеджмента и бизнеса;;;11;;;;;;
110349;Нижнекамский муниципальный институт;;;;;;;;;
110351;Новосибирский государственный театральный институт;;;0;0;0;0;0;0;0
110352;Новосибирский институт экономики, психологии и права;;;;0;;0;0;0;0
110353;Одинцовский гуманитарный институт;;;8;;;;;;
110354;Оренбургский государственный институт искусств им. Леопольда и Мстислава Ростроповичей;;;15;13;13;13;13;14;13
110357;Оренбургский институт экономики и культур;;;;;;;;;
110358;ОСТАНКИНСКИЙ ИНСТИТУТ ТЕЛЕВИДЕНИЯ И РАДИОВЕЩАНИЯ;;;;;;;;;
110360;Открытый юридический институт;;;0;;;;;;
110361;Отрадненский гуманитарный институт;;;0;0;;;;;
110364;Пермский гуманитарно-технологический институт;;;;;;;;;
110365;Петербургский институт иудаики;;;0;;0;0;0;0;0
110368;ИНСТИТУТ УПРАВЛЕНИЯ;;;;0;;;;;
110369;Московский институт государственного и муниципального управления;;;;0;0;;;;
110371;Региональный институт технологии и управления;;;;;;;;;
110372;Российская академия адвокатуры и нотариата;;;42;27;21;26;25;25;21
110373;Русско-Британский Институт Управления;;;9;7;6;1;5;5;4
110374;Русско-немецкий университет;;;;;;;;;
110375;Рязанский институт управления и права;;;;;;;;;
110376;Самарская академия государственного и муниципального управления;;;35;;;;;;
110377;Самарская государственная областная академия (Наяновой);;;48;44;35;25;17;;
110381;Санкт-Петербургский государственный институт психологии и социальной работы;;;5;4;4;4;0;0;0
110382;Санкт-Петербургский институт гостеприимства;;;;0;;0;0;0;0
110384;Санкт-Петербургский институт управления и права;;;;19;;;;;
110386;Санкт - Петербургский Институт Экономики, Культуры и Делового Администрирования;;;0;0;;;;;
110389;Северо-Кавказский социальный институт;;;38;39;18;36;38;44;41
110391;Северо-Осетинский государственный педагогический институт;;;42;41;42;34;26;11;8
110393;Славяно-Греко-Латинская Академия;;;;0;0;0;0;0;0
110394;Славянский деловой институт им.К.В.Нечаева (Митрополита Питирима);;;;;;;;;
110395;Смоленский государственный институт искусств;;;9;3;3;0;0;0;0
110396;Современная гуманитарная академия;;;;62;16;;;;
110400;Сочинский институт экономики и информационных технологий;;;;;;;;;
110402;Ставропольский государственный педагогический институт;;;57;65;58;48;37;51;53
110403;Ставропольский институт бизнеса и технологий Бизнестранс;;;;;;;;;
110404;Ставропольский институт имени В.Д. Чурсина;;;;;;;;;
110406;Столичная финансово-гуманитарная академия;;;26;13;;0;;;
110407;Столичный гуманитарно-экономический институт;;;0;;;;;;
110408;Столичный институт бизнес-технологий и управления;;;;0;;;;;
110409;Сургутский государственный педагогический университет;;;81;75;85;92;85;80;81
110410;Сургутский государственный университет Ханты-Мансийского автономного округа - Югры;;;420;730;704;714;738;602;547
110411;Сургутский институт мировой экономики и бизнеса Планета;;;0;0;0;;;;
110412;Тамбовское областное Тамбовский музыкально-педагогический институт им. С.В. Рахманинова;;;11;11;8;10;13;14;16
110416;Тюменская государственная академия мировой экономики, управления и права;;;23;;;;;;
110418;высшего образования Университет Российского инновационного образования;;;;52;37;37;;;
110419;Уральский институт бизнеса и управления;;;;6;0;0;;;
110420;Уральский институт фондового рынка;;;;0;0;0;0;0;0
110421;Частное образоветельное учреждение высшего образования Академия туризма и международных отношений;;;;0;0;0;;;
110422;Уральский Финансово-Юридический институт;;;;36;;;;;
110425;Финансово-технологическая академия;;;112;114;113;119;127;126;138
110428;Ханты-Мансийская государственная медицинская академия;;;41;115;112;116;165;169;161
110429;Челябинский Многопрофильный Институт;;;0;0;0;0;0;;
110431;Чувашский государственный институт культуры и искусств;;;0;0;0;0;0;0;0
110432;Экономико-энергетический институт;;;0;0;0;0;;;
110433;Южно-Уральский государственный институт искусств имени П.И. Чайковского;;;14;33;27;24;25;29;27
