10006886;Ярославский филиал ФГБОУ ВПО "Московский государственный университет путей сообщения";;;;1 547;;;;;
10006887;Шуйский филиал ФГБОУ ВПО "Ивановский государственный университет";;;;0;0;0;0;0;0
10006891;Биробиджанский филиал ФГБОУ ВПО "Хабаровская государственная академия экономики и права";;;;;;;;;
10006892;Благовещенский филиал ФГБОУ ВПО "Хабаровская государственная академия экономики и права";;;;;;;;;
10006893;Сахалинский филиал ФГБОУ ВПО "Хабаровская государственная академия экономики и права";;;;;;;;;
10006895;Брянский филиал Национального государственного Университета физической культуры, спорта и здоровья им. П.Ф. Лесгафта, Санкт-Петербург;;;;0;0;0;;;
10006902;Прокопьевский филиал ФГБОУ ВПО "Сибирский государственный индустриальный университет";;;;;;;;;
10006903;Филиал ФГБОУ ВПО "Дагестанский государственный технический университет" в г. Дербенте;;;;0;0;214;168;120;62
10006904;Филиал ФГБОУ ВПО "Дагестанский государственный технический университет" в г. Кизляре;;;;0;0;0;0;0;0
10006905;Филиал ФГБОУ ВПО "Дагестанский государственный технический университет" в г. Каспийске;;;;0;0;0;0;0;0
10006913;Воронежский филиал НОУ ВПО "Российский новый университет";;;;0;;;;;
10006914;Елецкий филиал НОУ ВПО "Российский новый университет";;;;119;98;89;80;75;69
10006916;Тамбовский филиал НОУ ВПО "Российский новый университет";;;;0;0;0;0;0;0
10006917;Домодедовский филиал НОУ ВПО "Российский новый университет";;;;151;174;160;250;304;313
10006918;Набережночелнинский филиал ЧОУ ВПО "Институт экономики, управления и права (г.Казань)";;;;0;0;898;1 034;1 386;1322
10006919;Нижнекамский филиал ЧОУ ВПО "Институт экономики, управления и прав (г.Казань)";;;;521;474;475;525;536;524
10006920;Альметьевский филиал ЧОУ ВПО "Институт экономики, управления и права (г.Казань)";;;;493;;;;;
10006921;Пензенский филиал ОЧУ ВО "Академия МНЭПУ";;;;0;0;;;;
10006922;Западно-Уральский филиал НОУ "Московская международная высшая школа бизнеса "МИРБИС" (Институт);;;;;;;;;
10006923;Филиал ЧОУ ВО "Самарская гуманитарная академия" в г.Тольятти;;;;183;102;250;225;;
10006924;Краснознаменский филиал НОУ ВПО "Московский финансово-промышленный университет "Синергия";;;;0;;;;;
10006925;Омский филиал НОЧУ ВО "Московский финансово-промышленный университет "Синергия";;;;10;0;0;0;0;15
10006926;Курганский филиал ОУ профсоюзов ВО "Академия труда и социальных отношений";;;;0;0;0;0;0;0
10006927;Башкирский институт социальных технологий (филиал) ОУ профсоюзов ВО "Академия труда и социальных отношений";;;;163;;239;202;167;149
10006928;Азовский филиал АНО ВПО "Евразийский открытый институт";;;;;;;;;
10006929;Донской филиал АНО ВПО "Евразийский открытый институт";;;;;;;;;
10006931;Электростальский филиал АНО ВПО "Евразийский открытый институт";;;;;;;;;
10006932;Северо-Кавказский филиал ФГОБУ ВПО Московского технического университета связи и информатики;;;;0;0;0;0;0;0
10006933;Филиал ФГБОУ ВПО "Уральский государственный университет путей сообщения" в г. Тюмени;;;;0;0;;0;0;0
10006934;Филиал ФГБОУ ВПО "Уральский государственный университет путей сообщения" в. г. Нижнем Тагиле;;;;130;125;;0;0;0
10006935;Улан-Удэнский институт железнодорожного транспорта - филиал ФГБОУ ВПО "Иркутский государственный университет путей сообщения";;;;2 329;1 970;1 910;;;
10006936;Забайкальский институт железнодорожного транспорта - филиал ФГБОУ ВПО "Иркутский государственный университет путей сообщения";;;;2 531;2 653;2 622;2 605;2 566;2663
10006937;Красноярский институт железнодорожного транспорта - филиал ФГБОУ ВПО "Иркутский государственный университет путей сообщения";;;;1 882;1 980;2 035;2 119;2 085;2099
10006938;Хакасский филиал ФГБОУ ВПО "Красноярский государственный аграрный университет";;;;;;;;;
10006939;Ачинский филиал ФГБОУ ВПО "Красноярский государственный аграрный университет";;;;0;25;19;18;18;0
10006940;Калужский филиал ФГБОУ ВО "Российский государственный аграрный университет - МСХА имени К.А. Тимирязева";;;;0;0;0;0;0;0
10006943;Филиал ФГБОУ ВПО "Российский государственный университет физической культуры, спорта, молодежи и туризма (ГЦОЛИФК)" в г. Иркутске;;;;0;0;0;0;0;0
10006944;Северо-Кавказский филиал ФГБОУ ВО "Российский государственный университет правосудия"(г.Краснодар);;;;547;607;617;632;732;861
10006945;Восточно-Сибирский филиал ФГБОУ ВО "Российский государственный университет правосудия"(г. Иркутск);;;;304;381;365;343;362;428
10006946;Дальневосточный филиал ФГБОУ ВО "Российский государственный университет правосудия" (г. Хабаровск);;;;202;225;206;135;153;278
10006947;Западно-Сибирский филиал Федерального государственного образовательного учреждения высшего образования "Российский государственный университет правосудия" (г. Томск);;;;211;269;254;253;250;304
10006948;Казанский филиал ФГБОУ ВО "Российский государственный университет правосудия"(г. Казань);;;;1 003;1 013;897;835;865;1037
10006949;Приволжский филиал ФГБОУ ВО "Российский государственный университет правосудия" (г. Нижний Новгород);;;;545;605;619;605;662;784
10006950;Ростовский филиал ФГБОУ ВПО "Российская академия правосудия" (г. Ростов-на-Дону);;;;415;458;493;521;529;486
10006951;Северо-Западный филиал ФГБОУ ВО "Российский государственный университет правосудия" (г. Санкт-Петербург);;;;360;386;380;372;415;428
10006952;Уральский филиал ФГБОУ ВО "Российский государственный университет правосудия" (г. Челябинск);;;;211;260;195;172;151;159
10006953;Центральный филиал ФГБОУ ВО "Российский государственный университет правосудия" (г. Воронеж);;;;0;233;231;216;244;339
10006954;Барнаульский филиал ФГОБУ ВО "Финансовый университет при Правительстве Российской Федерации" (Барнаульский филиал Финуниверситета);;;;0;0;0;0;0;0
10006955;Брянский филиал ФГОБУ ВО "Финансовый университет при Правительстве Российской Федерации";;;;0;0;;;;
10006956;Владимирский филиал ФГОБУ ВО "Финансовый университет при Правительстве Российской Федерации";;;;476;488;452;430;366;397
10006959;Краснодарский филиал ФГОБУ ВПО "Финансовый университет при Правительстве Российской Федерации";;;;0;0;0;0;0;0
10006960;Курский филиал ФГОБУ ВО "Финансовый университет при Правительстве Российской Федерации";;;;0;0;0;0;0;0
10006961;Липецкий филиал ФГОБУ ВО "Финансовый университет при Правительстве Российской Федерации";;;;0;0;0;0;0;0
10006962;Новороссийский филиал ФГОБУ ВО "Финансовый университет при Правительстве Российской Федерации";;;;0;0;0;0;0;0
10006963;Орловский филиал ФГОБУ ВО "Финансовый университет при Правительстве Российской Федерации";;;;0;0;0;0;0;0
10006964;Пензенский филиал ФГОБУ ВО "Финансовый университет при Правительстве Российской Федерации";;;;0;0;0;0;0;0
10006965;Смоленский филиал ФГОБУ ВО "Финансовый университет при Правительстве Российской Федерации";;;;0;0;0;0;0;0
10006966;Тульский филиал ФГОБУ ВО "Финансовый университет при Правительстве Российской Федерации";;;;0;0;0;0;0;0
10006967;Уфимский филиал ФГОБУ ВО "Финансовый университет при Правительстве Российской Федерации";;;;1 328;1 359;1 393;1 268;1 363;1470
10006968;Челябинский филиал ФГОБУ ВО "Финансовый университет при Правительстве Российской Федерации";;;;0;0;0;0;0;0
10006969;Ярославский филиал ФГОБУ ВО "Финансовый университет при Правительстве Российской Федерации";;;;0;0;0;0;0;0
10006970;Владикавказский филиал ФГОБУ ВО "Финансовый университет при Правительстве Российской Федерации";;;;490;466;417;429;489;564
10006971;Калужский филиал ФГОБУ ВО "Финансовый университет при Правительстве Российской Федерации";;;;0;0;0;0;0;0
10006972;Омский филиал ФГОБУ ВО "Финансовый университет при Правительстве Российской Федерации";;;;0;0;0;0;0;0
10006973;Санкт-Петербургский филиал ФГОБУ ВО "Финансовый университет при Правительстве Российской Федерации";;;;132;138;144;118;115;105
10006975;Филиал Международного института экономики и права в городе Астрахани;;;;0;;;;;
10006976;Филиал Международного института экономики и права в городе Белорецке;;;;0;;;;;
10006977;Филиал Международного института экономики и права в городе Владивостоке;;;;0;;;;;
10006978;Филиал Международного института экономики и права в городе Волгограде;;;;0;;;;;
10006979;Филиал Международного института экономики и права в городе Екатеринбурге;;;;0;;;;;
10006980;Филиал Международного института экономики и права в городе Киселевске;;;;0;;;;;
10006981;Филиал Международного института экономики и права в городе Магнитогорске;;;;0;;;;;
10006982;Филиал Международного института экономики и права в городе Мурманске;;;;;;;;;
10006983;Филиал Международного института экономики и права в городе Омске;;;;0;;;;;
10006984;Филиал Международного института экономики и права в городе Челябинске;;;;0;;;;;
10006985;Филиал Международного института экономики и права в городе Ярославле;;;;0;;;;;
10006986;Сибирский филиал Международного института экономики и права;;;;0;;;;;
10006987;Вологодский филиал ОО ВПО (частное учреждение) "Международная академия бизнеса и новых технологий (МУБиНТ)";;;;0;;;;;
10006988;Московский филиал РМАТ;;;;107;118;121;142;131;126
10006993;Филиал ФГБОУ ВО "Ивановский государственный политехнический университет" в г. Краснодаре;;;;;;;;;
10006994;Филиал ФГБОУ ВО "Ивановский государственный политехнический университет" в г. Нижнем Новгороде;;;;;;;;;
10006995;Филиал ФГБОУ ВПО "Ивановский государственный политехнический университет" в г. Рязани;;;;;;;;;
10006997;Институт сервиса и технологий (филиал) ФГБОУ ВПО "Донской государственнывй технический университет" в г. Пятигорске Ставропольского края;;;;336;241;95;;;
10006998;Технологический институт сервиса (филиал)ФГБОУ ВО "Донской государственный технический университет" в г. Ставрополе Ставропольского края;;;;0;0;0;0;0;0
10006999;Институт сферы обслуживания и предпринимательства (филиал) ФГОУ ВО "Донской государтсвенный технический университет" в г. Шахты Ростовской области;;;;521;479;435;426;417;487
10007017;Филиал ФГБОУ ВПО "Уральский государственный педагогический университет" в г. Красноуфимске;;;;;;;;;
10007018;Филиал ФГБОУ ВПО "Уральский государственный педагогический университет" в г. Серове;;;;;;;;;
10007029;Тольяттинский филиал Самарского национального исследовательского университета имени академика С.П. Королева;;;;;;;;;
10007043;филиал ФГБОУ ВО "Санкт-Петербургский государственный экономический университет" в г. Великие Луки Псковской области;;;;;;;;;
10007044;филиал ФГБОУ ВО "Санкт-Петербургский государственный экономический университет" в г. Калининграде;;;;;;;;;
10007045;Калужский филиал ФГБОУ ВО "Санкт-Петербургский государственный экономический университет";;;;0;;;;;
10007046;Кировский филиал ФГБОУ ВО "Санкт-Петербургский государственный экономический университет";;;;;;;;;
10007047;филиал ФГБОУ ВО "Санкт-Петербургский государственный экономический университет" в г. Сосновый Бор Ленинградской области;;;;;;;;;
10007048;филиал ФГБОУ ВО "Санкт-Петербургский государственный экономический университет" в г. Старая Русса Новгородской области;;;;;;;;;
10007049;филиал ФГБОУ ВО "Санкт-Петербургский государственный экономический университет" в г. Сыктывкар Республики Коми;;;;;;;;;
10007050;филиал ФГБОУ ВО "Санкт-Петербургский государственный экономический университет" в г. Тихвине Ленинградской области;;;;;;;;;
10110172;Филиал АНОО ВПО "Воронежский экономико-правовой институт" в г.Орел;;;;0;0;0;0;0;0
10110270;Орехово-Зуевский филиал НОУ ВПО "Институт экономики и предпринимательства";;;;;;;;;
10110303;Вышневолоцкий филиал ОАНО ВО "Международный славянский институт";;;;;;;;;
10110306;Калининградский филиал АНОО ВПО "Международный славянский институт";;;;;;;;;
10110307;Волгоградский филиал АНО ВО "Международный славянский институт";;;;0;;;;;
10110311;Ростовский-на-Дону филиал НОЧУ ВО МОСКОВСКАЯ АКАДЕМИЯ ПРЕДПРИНИМАТЕЛЬСТВА при Правительстве Москвы;;;;;;;;;
10110312;Пермский филиал НОЧУ ВО МОСКОВСКАЯ АКАДЕМИЯ ПРЕДПРИНИМАТЕЛЬСТВА при Правительстве Москвы;;;;;;;;;
10110322;Кировский филиал Московского гуманитарно-экономического института;;;;0;0;0;0;0;0
10110343;Филиал ОАНО ВО "Московский психолого-социальный университет" в станице Брюховецкая Краснодарского края;;;;;;;;;
10110356;Филиал ОАНО ВО "Московский психолого-социальный университет" в г.Одинцово Московской области;;;;;;;;;
10110385;Псковский филиал НОЧУ ВОП "Санкт-Петербургский институт управления и права";;;;;;;;;
10110397;Абаканский филиал НАЧОУ ВПО Современной гуманитарной академии;;;;;;;;;
10110405;Брянский филиал ЧОУ ВО Современной гуманитарной академии;;;;0;0;;;;
10110440;Самарский филиал ЧОУ ВО Современной гуманитарной академии;;;;;;;;;
10110442;Саранский филиал НАЧОУ ВПО Современной гуманитарной академии;;;;;;;;;
10110443;Саратовский филиал ЧОУ ВО Современной гуманитарной академии;;;;0;0;;;;
10110445;Северодвинский филиал ЧОУ ВО Современной гуманитарной академии;;;;;;;;;
10110446;Смоленский филиал ЧОУ ВО Современной гуманитарной академии;;;;0;;;;;
10110448;Сочинский филиал ЧОУ ВО Современной гуманитарной академии;;;;;;;;;
10110449;Старооскольский филиал НАЧОУ ВПО Современной гуманитарной академии;;;;;;;;;
10110450;Стерлитамакский филиал НАЧОУ ВПО Современной гуманитарной академии;;;;;;;;;
10110451;Сыктывкарский филиал НАЧОУ ВПО Современной гуманитарной академии;;;;;;;;;
10110452;Тамбовский филиал ЧОУ ВО Современной гуманитарной академии;;;;0;0;;;;
10110455;Улан-Удэнский филиал ЧОУ ВО Современной гуманитарной академии;;;;0;;;;;
10110457;Уфимский филиал ЧОУ ВО Современной гуманитарной академии;;;;0;0;;;;
10110458;Ухтинский филиал НАЧОУ ВПО Современной гуманитарной академии;;;;;;;;;
10110459;Хабаровский филиал ЧОУ ВО Современной гуманитарной академии;;;;;;;;;
10110460;Хасавюртовский филиал НАЧОУ ВПО Современной гуманитарной академии;;;;0;;;;;
10110462;Черкесский филиал НАЧОУ ВПО Современной гуманитарной академии;;;;0;;;;;
10110902;Магаданский филиал АНО ВПО "Российская академия предпринимательства";;;;0;;0;0;;
10110903;Новосибирский филиал АНО ВПО Российская академия предпринимательства;;;;;;;;;
10110906;Челябинский филиал АНО ВПО "Российская академия предпринимательства";;;;;;0;0;0;0
12000444;Коломенский институт (филиал) ФГБОУ ВПО "Московский государственный машиностроительный университет (МАМИ)" в г. Коломне Московской области;;;;0;;;;;
12000448;Рязанский институт (филиал) ФГБОУ ВПО "Московский государственный машиностроительный университет (МАМИ)";;;;0;;;;;
12000450;Губкинский институт (филиал) ФГБОУ ВПО "Московский государственный машиностроительный университет (МАМИ)" в г.Губкине Белгородской области;;;;;;;;;
12000452;Филиал ФГБОУ ВПО "Московский государственный машиностроительный университет (МАМИ)" в г.Воскресенске Московской области;;;;0;;;;;
12000459;филиал ФГБОУ ВПО "Московский государственный машиностроительный университет (МАМИ)" в г. Сафоново Смоленской области;;;;0;;;;;
12000463;Филиал ФГБОУ ВПО "Московский государственный машиностроительный университет (МАМИ)" в г. Прокопьевске Кемеровской области;;;;;;;;;
12000464;Филиал ФГБОУ ВПО "Московский государственный машиностроительный университет (МАМИ)" в г. Махачкале Республики Дагестан;;;;;;;;;
12000465;филиал ФГБОУ ВПО "Московский государственный машиностроительный университет (МАМИ)" в г. Смоленске;;;;;;;;;
12003257;Чебоксарский политехнический институт (филиал) ФГБОУ ВПО "Московский государственный машиностроительный университет (МАМИ)" в г.Чебоксары Чувашской Республики;;;;0;;;;;
12006915;Таганрогский филиал НОУ ВПО "Российский новый университет";;;;0;0;0;0;0;0
12006918;Александровский филиал НОУ ВПО "Российский новый университет";;;;0;;;;;
12006919;Волоколамский филиал НОУ ВПО "Российский новый университет";;;;;;;;;
