10006853;Арктический морской институт имени В.И. Воронина – филиал ФГБОУ ВО "Государственный университет морского и речного флота имени адмирала С.О. Макарова";;;917,89;;;;;;
10006861;Брянский филиал ФГБОУ ВПО "Московский государственный университет путей сообщения";;;337,72;365,86;;;;;
10006862;Волгоградский филиал ФГБОУ ВПО "Московский государственный университет путей сообщения";;;36,81;33,51;;;;;
10006863;Воронежский филиал ФГБОУ ВПО "Московский государственный университет путей сообщения" ;;;329,64;237,46;;;;;
10006864;Елецкий филиал ФГБОУ ВПО "Московский государственный университет путей сообщения";;;;;;;;;
10006865;Ижевский филиал ФГБОУ ВПО "Московский государственный университет путей сообщения";;;;;;;;;
10006866;Казанский филиал ФГБОУ ВПО "Московский государственный университет путей сообщения" ;;;26,09;21,63;;;;;
10006867;Калининградский филиал ФГБОУ ВПО "Московский государственный университет путей сообщения";;;28,88;29,81;;;;;
10006868;Калужский филиал ФГБОУ ВПО "Московский государственный университет путей сообщения";;;269,9;319,32;;;;;
10006872;Муромский филиал ФГБОУ ВПО "Московский государственный университет путей сообщения";;;25,84;23,35;;;;;
10006873;Нижегородский филиал ФГБОУ ВПО "Московский государственный университет путей сообщения";;;321,49;191,65;;;;;
10006875;Орловский филиал ФГБОУ ВПО "Московский государственный университет путей сообщения" ;;;551,18;567,68;;;;;
10006876;Поволжский филиал ФГБОУ ВПО "Московский государственный университет путей сообщения";;;46,53;38,74;;;;;
10006879;Рязанский филиал ФГБОУ ВПО "Московский государственный университет путей сообщения" ;;;233;257,37;;;;;
10006880;Смоленский филиал ФГБОУ ВПО "Московский государственный университет путей сообщения";;;31,27;30,23;;;;;
10006884;Ухтинский филиал ФГБОУ ВПО "Московский государственный университет путей сообщения";;;;;;;;;
10006886;Ярославский филиал ФГБОУ ВПО "Московский государственный университет путей сообщения";;;98,41;77,09;;;;;
10006887;Шуйский филиал ФГБОУ ВПО "Ивановский государственный университет";;;17,61;20,32;19,57;20,13;20,34;20,81;19,03
10006891;Биробиджанский филиал ФГБОУ ВПО "Хабаровская государственная академия экономики и права";;;;;;;;;
10006892;Благовещенский филиал ФГБОУ ВПО "Хабаровская государственная академия экономики и права";;;;;;;;;
10006893;Сахалинский филиал ФГБОУ ВПО "Хабаровская государственная академия экономики и права";;;;;;;;;
10006895;Брянский филиал Национального государственного Университета физической культуры, спорта и здоровья им. П.Ф. Лесгафта, Санкт-Петербург;;;23,36;37,67;55,47;86,21;;;
10006902;Прокопьевский филиал ФГБОУ ВПО "Сибирский государственный индустриальный университет";;;;;;;;;
10006903;Филиал ФГБОУ ВПО "Дагестанский государственный технический университет" в г. Дербенте;;;52,29;90,37;109,25;104,43;150,9;66,11;62,54
10006904;Филиал ФГБОУ ВПО "Дагестанский государственный технический университет" в г. Кизляре;;;58,92;67,03;75,29;96,05;193,59;99,89;54,07
10006905;Филиал ФГБОУ ВПО "Дагестанский государственный технический университет" в г. Каспийске;;;22,82;28,09;33,16;32;44,58;48,47;51,9
10006913;Воронежский филиал НОУ ВПО "Российский новый университет";;;;29,04;;;;;
10006914;Елецкий филиал НОУ ВПО "Российский новый университет";;;22,08;34,64;39,81;43,18;45,88;47,32;60,52
10006916;Тамбовский филиал НОУ ВПО "Российский новый университет";;;16,29;17,03;15,83;16,02;18,9;18,63;18,88
10006917;Домодедовский филиал НОУ ВПО "Российский новый университет";;;;80,54;89,23;98,13;62,74;80,1;94,27
10006918;Набережночелнинский филиал ЧОУ ВПО "Институт экономики, управления и права (г.Казань)";;;34,76;12,22;12,55;15,22;16,79;17,38;19,54
10006919;Нижнекамский филиал ЧОУ ВПО "Институт экономики, управления и прав (г.Казань)";;;18,6;17,04;17,82;16,79;18,21;20,12;23,29
10006920;Альметьевский филиал ЧОУ ВПО "Институт экономики, управления и права (г.Казань)";;;30,78;28,79;;;;;
10006921;Пензенский филиал ОЧУ ВО "Академия МНЭПУ";;;;10,71;11,38;;;;
10006922;Западно-Уральский филиал НОУ "Московская международная высшая школа бизнеса "МИРБИС" (Институт);;;;;;;;;
10006923;Филиал ЧОУ ВО "Самарская гуманитарная академия" в г.Тольятти;;;30,74;18,09;37,5;71,45;76,58;;
10006924;Краснознаменский филиал НОУ ВПО "Московский финансово-промышленный университет "Синергия";;;9,09;0;;;;;
10006925;Омский филиал НОЧУ ВО "Московский финансово-промышленный университет "Синергия";;;10,28;10,23;10,14;9,89;9,55;8,65;9,32
10006926;Курганский филиал ОУ профсоюзов ВО "Академия труда и социальных отношений";;;;14,82;19,81;28,6;21,42;36,39;35,15
10006927;Башкирский институт социальных технологий (филиал) ОУ профсоюзов ВО "Академия труда и социальных отношений";;;59,39;69,57;;113,84;109,6;124,77;121,1
10006928;Азовский филиал АНО ВПО "Евразийский открытый институт";;;;;;;;;
10006929;Донской филиал АНО ВПО "Евразийский открытый институт";;;;;;;;;
10006931;Электростальский филиал АНО ВПО "Евразийский открытый институт";;;;;;;;;
10006932;Северо-Кавказский филиал ФГОБУ ВПО Московского технического университета связи и информатики;;;13,79;15,5;8,94;11,07;10,19;9;9,81
10006933;Филиал ФГБОУ ВПО "Уральский государственный университет путей сообщения" в г. Тюмени;;;14;14,68;11,06;;98,81;92;87,19
10006934;Филиал ФГБОУ ВПО "Уральский государственный университет путей сообщения" в. г. Нижнем Тагиле;;;20,57;22,76;18,59;;633;173,42;125,35
10006935;Улан-Удэнский институт железнодорожного транспорта - филиал ФГБОУ ВПО "Иркутский государственный университет путей сообщения";;;62,34;53,69;69,13;236,66;;;
10006936;Забайкальский институт железнодорожного транспорта - филиал ФГБОУ ВПО "Иркутский государственный университет путей сообщения";;;21,58;24,7;27,65;31,02;33,7;33,22;34,43
10006937;Красноярский институт железнодорожного транспорта - филиал ФГБОУ ВПО "Иркутский государственный университет путей сообщения";;;15,82;16,55;15,78;16,3;16,4;17,61;17,63
10006938;Хакасский филиал ФГБОУ ВПО "Красноярский государственный аграрный университет";;;;;;;;;
10006939;Ачинский филиал ФГБОУ ВПО "Красноярский государственный аграрный университет";;;22,88;31,66;43,93;48,61;53,47;56,45;64,09
10006940;Калужский филиал ФГБОУ ВО "Российский государственный аграрный университет - МСХА имени К.А. Тимирязева";;;24,67;26,6;25,79;25,47;26,08;26,06;27,17
10006943;Филиал ФГБОУ ВПО "Российский государственный университет физической культуры, спорта, молодежи и туризма (ГЦОЛИФК)" в г. Иркутске;;;64,5;75,37;46,43;38,44;37,08;42,22;40,75
10006944;Северо-Кавказский филиал ФГБОУ ВО "Российский государственный университет правосудия"(г.Краснодар);;;12,7;14,23;12,4;12,09;5,02;4,74;4,36
10006945;Восточно-Сибирский филиал ФГБОУ ВО "Российский государственный университет правосудия"(г. Иркутск);;;22,42;27,53;18,63;18,07;17,61;18,85;22,15
10006946;Дальневосточный филиал ФГБОУ ВО "Российский государственный университет правосудия" (г. Хабаровск);;;15,01;18,35;17,05;19,34;18,37;12,02;12,23
10006947;Западно-Сибирский филиал Федерального государственного образовательного учреждения высшего образования "Российский государственный университет правосудия" (г. Томск);;;28,97;29,22;24,57;22,01;16,48;16,03;9,73
10006948;Казанский филиал ФГБОУ ВО "Российский государственный университет правосудия"(г. Казань);;;21,57;24,63;10,22;8,31;29,66;26,36;26,13
10006949;Приволжский филиал ФГБОУ ВО "Российский государственный университет правосудия" (г. Нижний Новгород);;;15,92;17,59;13,25;11,57;8,06;9,52;12,06
10006950;Ростовский филиал ФГБОУ ВПО "Российская академия правосудия" (г. Ростов-на-Дону);;;14,67;16,49;9,49;9,46;7,29;6,8;6,48
10006951;Северо-Западный филиал ФГБОУ ВО "Российский государственный университет правосудия" (г. Санкт-Петербург);;;9,04;9,05;8,13;7,38;7,01;6,16;5,31
10006952;Уральский филиал ФГБОУ ВО "Российский государственный университет правосудия" (г. Челябинск);;;16,05;14,07;13,34;12,98;13,35;27,84;29,51
10006953;Центральный филиал ФГБОУ ВО "Российский государственный университет правосудия" (г. Воронеж);;;14,67;16,85;16,28;15,8;3,25;5,77;5,45
10006954;Барнаульский филиал ФГОБУ ВО "Финансовый университет при Правительстве Российской Федерации" (Барнаульский филиал Финуниверситета);;;14,52;15,57;13,92;10,89;12,35;13,03;16,16
10006955;Брянский филиал ФГОБУ ВО "Финансовый университет при Правительстве Российской Федерации";;;31,43;30,93;36,74;;;;
10006956;Владимирский филиал ФГОБУ ВО "Финансовый университет при Правительстве Российской Федерации";;;35,32;61,29;51,32;46,71;48,24;53,86;59,31
10006959;Краснодарский филиал ФГОБУ ВПО "Финансовый университет при Правительстве Российской Федерации";;;20,33;17,28;13,98;11,22;9,83;10,24;10,48
10006960;Курский филиал ФГОБУ ВО "Финансовый университет при Правительстве Российской Федерации";;;36,31;39,27;38,25;36,66;34,47;38,81;34,06
10006961;Липецкий филиал ФГОБУ ВО "Финансовый университет при Правительстве Российской Федерации";;;15,39;13,57;12,28;10,57;10,02;10,39;9,98
10006962;Новороссийский филиал ФГОБУ ВО "Финансовый университет при Правительстве Российской Федерации";;;15,55;19,99;16,55;15,39;14,29;14,1;13,26
10006963;Орловский филиал ФГОБУ ВО "Финансовый университет при Правительстве Российской Федерации";;;35,12;36,17;32,69;28,59;22,82;23,62;22,25
10006964;Пензенский филиал ФГОБУ ВО "Финансовый университет при Правительстве Российской Федерации";;;28,58;36,41;29,73;24,56;25,79;23,12;24,42
10006965;Смоленский филиал ФГОБУ ВО "Финансовый университет при Правительстве Российской Федерации";;;26,46;26,37;22,27;15,07;13,18;11,73;11,34
10006966;Тульский филиал ФГОБУ ВО "Финансовый университет при Правительстве Российской Федерации";;;17,01;18,07;14,05;11,49;10,76;11,09;11,06
10006967;Уфимский филиал ФГОБУ ВО "Финансовый университет при Правительстве Российской Федерации";;;53,83;42,95;33,79;31,6;32,88;35,51;38,22
10006968;Челябинский филиал ФГОБУ ВО "Финансовый университет при Правительстве Российской Федерации";;;34,53;30,04;23,71;18,98;18,89;17,09;19,3
10006969;Ярославский филиал ФГОБУ ВО "Финансовый университет при Правительстве Российской Федерации";;;18,79;15,56;17,68;17,51;14,42;11,89;11,74
10006970;Владикавказский филиал ФГОБУ ВО "Финансовый университет при Правительстве Российской Федерации";;;24,68;21,91;21,51;22,27;20,53;20,73;21,05
10006971;Калужский филиал ФГОБУ ВО "Финансовый университет при Правительстве Российской Федерации";;;13,51;15,96;16,83;19,88;21,46;16,73;17,23
10006972;Омский филиал ФГОБУ ВО "Финансовый университет при Правительстве Российской Федерации";;;12,51;13,62;14,11;16,04;15,39;17,21;19,86
10006973;Санкт-Петербургский филиал ФГОБУ ВО "Финансовый университет при Правительстве Российской Федерации";;;16,23;13,64;13,64;15,15;17,5;19,34;20,4
10006975;Филиал Международного института экономики и права в городе Астрахани;;;2,09;2,13;;;;;
10006976;Филиал Международного института экономики и права в городе Белорецке;;;5,46;4,87;;;;;
10006977;Филиал Международного института экономики и права в городе Владивостоке;;;15,57;6;;;;;
10006978;Филиал Международного института экономики и права в городе Волгограде;;;14,96;4,36;;;;;
10006979;Филиал Международного института экономики и права в городе Екатеринбурге;;;15,23;12,96;;;;;
10006980;Филиал Международного института экономики и права в городе Киселевске;;;19,96;4,23;;;;;
10006981;Филиал Международного института экономики и права в городе Магнитогорске;;;1,29;5,23;;;;;
10006982;Филиал Международного института экономики и права в городе Мурманске;;;3,9;;;;;;
10006983;Филиал Международного института экономики и права в городе Омске;;;15,37;2,93;;;;;
10006984;Филиал Международного института экономики и права в городе Челябинске;;;14,24;4,54;;;;;
10006985;Филиал Международного института экономики и права в городе Ярославле;;;15,15;12,01;;;;;
10006986;Сибирский филиал Международного института экономики и права;;;5,5;5,76;;;;;
10006987;Вологодский филиал ОО ВПО (частное учреждение) "Международная академия бизнеса и новых технологий (МУБиНТ)";;;;7,01;;;;;
10006988;Московский филиал РМАТ;;;;20,73;20,39;26,98;29,76;36,72;40,82
10006993;Филиал ФГБОУ ВО "Ивановский государственный политехнический университет" в г. Краснодаре;;;;;;;;;
10006994;Филиал ФГБОУ ВО "Ивановский государственный политехнический университет" в г. Нижнем Новгороде;;;;;;;;;
10006995;Филиал ФГБОУ ВПО "Ивановский государственный политехнический университет" в г. Рязани;;;;;;;;;
10006997;Институт сервиса и технологий (филиал) ФГБОУ ВПО "Донской государственнывй технический университет" в г. Пятигорске Ставропольского края;;;26,2;28,37;29,87;50,61;;;
10006998;Технологический институт сервиса (филиал)ФГБОУ ВО "Донской государственный технический университет" в г. Ставрополе Ставропольского края;;;14,64;19,1;12,42;15,07;20,02;29,5;20,36
10006999;Институт сферы обслуживания и предпринимательства (филиал) ФГОУ ВО "Донской государтсвенный технический университет" в г. Шахты Ростовской области;;;11,74;14,6;14,77;18,07;17,63;18,33;15,74
10007017;Филиал ФГБОУ ВПО "Уральский государственный педагогический университет" в г. Красноуфимске;;;;;;;;;
10007018;Филиал ФГБОУ ВПО "Уральский государственный педагогический университет" в г. Серове;;;;;;;;;
10007029;Тольяттинский филиал Самарского национального исследовательского университета имени академика С.П. Королева;;;;;;;;;
10007043;филиал ФГБОУ ВО "Санкт-Петербургский государственный экономический университет" в г. Великие Луки Псковской области;;;;;;;;;
10007044;филиал ФГБОУ ВО "Санкт-Петербургский государственный экономический университет" в г. Калининграде;;;;;;;;;
10007045;Калужский филиал ФГБОУ ВО "Санкт-Петербургский государственный экономический университет";;;;10,57;;;;;
10007046;Кировский филиал ФГБОУ ВО "Санкт-Петербургский государственный экономический университет";;;;;;;;;
10007047;филиал ФГБОУ ВО "Санкт-Петербургский государственный экономический университет" в г. Сосновый Бор Ленинградской области;;;;;;;;;
10007048;филиал ФГБОУ ВО "Санкт-Петербургский государственный экономический университет" в г. Старая Русса Новгородской области;;;;;;;;;
10007049;филиал ФГБОУ ВО "Санкт-Петербургский государственный экономический университет" в г. Сыктывкар Республики Коми;;;;;;;;;
10007050;филиал ФГБОУ ВО "Санкт-Петербургский государственный экономический университет" в г. Тихвине Ленинградской области;;;;;;;;;
10110172;Филиал АНОО ВПО "Воронежский экономико-правовой институт" в г.Орел;;;48,48;77,6;277,66;124,48;28,13;31,58;49,6
10110270;Орехово-Зуевский филиал НОУ ВПО "Институт экономики и предпринимательства";;;;;;;;;
10110303;Вышневолоцкий филиал ОАНО ВО "Международный славянский институт";;;;;;;;;
10110306;Калининградский филиал АНОО ВПО "Международный славянский институт";;;;;;;;;
10110307;Волгоградский филиал АНО ВО "Международный славянский институт";;;16,24;19,86;;;;;
10110311;Ростовский-на-Дону филиал НОЧУ ВО МОСКОВСКАЯ АКАДЕМИЯ ПРЕДПРИНИМАТЕЛЬСТВА при Правительстве Москвы;;;;;;;;;
10110312;Пермский филиал НОЧУ ВО МОСКОВСКАЯ АКАДЕМИЯ ПРЕДПРИНИМАТЕЛЬСТВА при Правительстве Москвы;;;24,05;;;;;;
10110322;Кировский филиал Московского гуманитарно-экономического института;;;;19,8;23,37;33,93;56,02;99,53;50,17
10110343;Филиал ОАНО ВО "Московский психолого-социальный университет" в станице Брюховецкая Краснодарского края;;;;;;;;;
10110356;Филиал ОАНО ВО "Московский психолого-социальный университет" в г.Одинцово Московской области;;;;;;;;;
10110385;Псковский филиал НОЧУ ВОП "Санкт-Петербургский институт управления и права";;;;;;;;;
10110397;Абаканский филиал НАЧОУ ВПО Современной гуманитарной академии;;;;;;;;;
10110405;Брянский филиал ЧОУ ВО Современной гуманитарной академии;;;;8,79;9,25;;;;
10110440;Самарский филиал ЧОУ ВО Современной гуманитарной академии;;;;;;;;;
10110442;Саранский филиал НАЧОУ ВПО Современной гуманитарной академии;;;;;;;;;
10110443;Саратовский филиал ЧОУ ВО Современной гуманитарной академии;;;;3,82;3,62;;;;
10110445;Северодвинский филиал ЧОУ ВО Современной гуманитарной академии;;;;;;;;;
10110446;Смоленский филиал ЧОУ ВО Современной гуманитарной академии;;;;120,09;;;;;
10110448;Сочинский филиал ЧОУ ВО Современной гуманитарной академии;;;;;;;;;
10110449;Старооскольский филиал НАЧОУ ВПО Современной гуманитарной академии;;;;;;;;;
