10006944;Северо-Кавказский филиал ФГБОУ ВО "Российский государственный университет правосудия"(г.Краснодар);;;;0;0;0;0;0;0
10006945;Восточно-Сибирский филиал ФГБОУ ВО "Российский государственный университет правосудия"(г. Иркутск);;;;0;0;0;0;0;0
10006946;Дальневосточный филиал ФГБОУ ВО "Российский государственный университет правосудия" (г. Хабаровск);;;;0;0;0;0;0;0
10006947;Западно-Сибирский филиал Федерального государственного образовательного учреждения высшего образования "Российский государственный университет правосудия" (г. Томск);;;;0;0;0;0;0;0
10006948;Казанский филиал ФГБОУ ВО "Российский государственный университет правосудия"(г. Казань);;;;0;0;0;0;0;0
10006949;Приволжский филиал ФГБОУ ВО "Российский государственный университет правосудия" (г. Нижний Новгород);;;;0;0;0;0;0;0
10006950;Ростовский филиал ФГБОУ ВПО "Российская академия правосудия" (г. Ростов-на-Дону);;;;0;0;0;0;0;0
10006951;Северо-Западный филиал ФГБОУ ВО "Российский государственный университет правосудия" (г. Санкт-Петербург);;;;0;0;0;0;0;0
10006952;Уральский филиал ФГБОУ ВО "Российский государственный университет правосудия" (г. Челябинск);;;;0;0;0;0;0;0
10006953;Центральный филиал ФГБОУ ВО "Российский государственный университет правосудия" (г. Воронеж);;;;0;0;0;0;0;0
10006954;Барнаульский филиал ФГОБУ ВО "Финансовый университет при Правительстве Российской Федерации" (Барнаульский филиал Финуниверситета);;;;0;0;0;0;0;0
10006955;Брянский филиал ФГОБУ ВО "Финансовый университет при Правительстве Российской Федерации";;;;0;0;;;;
10006956;Владимирский филиал ФГОБУ ВО "Финансовый университет при Правительстве Российской Федерации";;;;0;0;0;0;0;0
10006959;Краснодарский филиал ФГОБУ ВПО "Финансовый университет при Правительстве Российской Федерации";;;;0;0;0;0;0;0
10006960;Курский филиал ФГОБУ ВО "Финансовый университет при Правительстве Российской Федерации";;;;0;0;0;0;0;0
10006961;Липецкий филиал ФГОБУ ВО "Финансовый университет при Правительстве Российской Федерации";;;;0;0;0;0;0;0
10006962;Новороссийский филиал ФГОБУ ВО "Финансовый университет при Правительстве Российской Федерации";;;;0;0;0;0;0;0
10006963;Орловский филиал ФГОБУ ВО "Финансовый университет при Правительстве Российской Федерации";;;;0;0;0;0;0;0
10006964;Пензенский филиал ФГОБУ ВО "Финансовый университет при Правительстве Российской Федерации";;;;0;0;0;0;0;0
10006965;Смоленский филиал ФГОБУ ВО "Финансовый университет при Правительстве Российской Федерации";;;;0;0;0;0;0;0
10006966;Тульский филиал ФГОБУ ВО "Финансовый университет при Правительстве Российской Федерации";;;;0;0;0;0;0;0
10006967;Уфимский филиал ФГОБУ ВО "Финансовый университет при Правительстве Российской Федерации";;;;0;0;0;0;0;0
10006968;Челябинский филиал ФГОБУ ВО "Финансовый университет при Правительстве Российской Федерации";;;;0;0;0;0;0;0
10006969;Ярославский филиал ФГОБУ ВО "Финансовый университет при Правительстве Российской Федерации";;;;0;0;0;0;0;0
10006970;Владикавказский филиал ФГОБУ ВО "Финансовый университет при Правительстве Российской Федерации";;;;0;0;0;0;0;0
10006971;Калужский филиал ФГОБУ ВО "Финансовый университет при Правительстве Российской Федерации";;;;0;0;0;0;0;0
10006972;Омский филиал ФГОБУ ВО "Финансовый университет при Правительстве Российской Федерации";;;;0;0;0;0;0;0
10006973;Санкт-Петербургский филиал ФГОБУ ВО "Финансовый университет при Правительстве Российской Федерации";;;;0;0;0;0;0;0
10006975;Филиал Международного института экономики и права в городе Астрахани;;;;0;;;;;
10006976;Филиал Международного института экономики и права в городе Белорецке;;;;0;;;;;
10006977;Филиал Международного института экономики и права в городе Владивостоке;;;;0;;;;;
10006978;Филиал Международного института экономики и права в городе Волгограде;;;;0;;;;;
10006979;Филиал Международного института экономики и права в городе Екатеринбурге;;;;0;;;;;
10006980;Филиал Международного института экономики и права в городе Киселевске;;;;0;;;;;
10006981;Филиал Международного института экономики и права в городе Магнитогорске;;;;0;;;;;
10006982;Филиал Международного института экономики и права в городе Мурманске;;;;;;;;;
10006983;Филиал Международного института экономики и права в городе Омске;;;;0;;;;;
10006984;Филиал Международного института экономики и права в городе Челябинске;;;;0;;;;;
10006985;Филиал Международного института экономики и права в городе Ярославле;;;;0;;;;;
10006986;Сибирский филиал Международного института экономики и права;;;;0;;;;;
10006987;Вологодский филиал ОО ВПО (частное учреждение) "Международная академия бизнеса и новых технологий (МУБиНТ)";;;;0;;;;;
10006988;Московский филиал РМАТ;;;;0;0;0;0;0;0
10006993;Филиал ФГБОУ ВО "Ивановский государственный политехнический университет" в г. Краснодаре;;;;;;;;;
10006994;Филиал ФГБОУ ВО "Ивановский государственный политехнический университет" в г. Нижнем Новгороде;;;;;;;;;
10006995;Филиал ФГБОУ ВПО "Ивановский государственный политехнический университет" в г. Рязани;;;;;;;;;
10006997;Институт сервиса и технологий (филиал) ФГБОУ ВПО "Донской государственнывй технический университет" в г. Пятигорске Ставропольского края;;;;0;0;0;;;
10006998;Технологический институт сервиса (филиал)ФГБОУ ВО "Донской государственный технический университет" в г. Ставрополе Ставропольского края;;;;0;0;0;0;0;0
10006999;Институт сферы обслуживания и предпринимательства (филиал) ФГОУ ВО "Донской государтсвенный технический университет" в г. Шахты Ростовской области;;;;6;2;0;4;3;3
10007017;Филиал ФГБОУ ВПО "Уральский государственный педагогический университет" в г. Красноуфимске;;;;;;;;;
10007018;Филиал ФГБОУ ВПО "Уральский государственный педагогический университет" в г. Серове;;;;;;;;;
10007029;Тольяттинский филиал Самарского национального исследовательского университета имени академика С.П. Королева;;;;;;;;;
10007043;филиал ФГБОУ ВО "Санкт-Петербургский государственный экономический университет" в г. Великие Луки Псковской области;;;;;;;;;
10007044;филиал ФГБОУ ВО "Санкт-Петербургский государственный экономический университет" в г. Калининграде;;;;;;;;;
10007045;Калужский филиал ФГБОУ ВО "Санкт-Петербургский государственный экономический университет";;;;0;;;;;
10007046;Кировский филиал ФГБОУ ВО "Санкт-Петербургский государственный экономический университет";;;;;;;;;
10007047;филиал ФГБОУ ВО "Санкт-Петербургский государственный экономический университет" в г. Сосновый Бор Ленинградской области;;;;;;;;;
10007048;филиал ФГБОУ ВО "Санкт-Петербургский государственный экономический университет" в г. Старая Русса Новгородской области;;;;;;;;;
10007049;филиал ФГБОУ ВО "Санкт-Петербургский государственный экономический университет" в г. Сыктывкар Республики Коми;;;;;;;;;
10007050;филиал ФГБОУ ВО "Санкт-Петербургский государственный экономический университет" в г. Тихвине Ленинградской области;;;;;;;;;
10110172;Филиал АНОО ВПО "Воронежский экономико-правовой институт" в г.Орел;;;;0;0;0;0;0;0
10110270;Орехово-Зуевский филиал НОУ ВПО "Институт экономики и предпринимательства";;;;;;;;;
10110303;Вышневолоцкий филиал ОАНО ВО "Международный славянский институт";;;;;;;;;
10110306;Калининградский филиал АНОО ВПО "Международный славянский институт";;;;;;;;;
10110307;Волгоградский филиал АНО ВО "Международный славянский институт";;;;0;;;;;
10110311;Ростовский-на-Дону филиал НОЧУ ВО МОСКОВСКАЯ АКАДЕМИЯ ПРЕДПРИНИМАТЕЛЬСТВА при Правительстве Москвы;;;;;;;;;
10110312;Пермский филиал НОЧУ ВО МОСКОВСКАЯ АКАДЕМИЯ ПРЕДПРИНИМАТЕЛЬСТВА при Правительстве Москвы;;;;;;;;;
10110322;Кировский филиал Московского гуманитарно-экономического института;;;;0;0;0;0;0;0
10110343;Филиал ОАНО ВО "Московский психолого-социальный университет" в станице Брюховецкая Краснодарского края;;;;;;;;;
10110356;Филиал ОАНО ВО "Московский психолого-социальный университет" в г.Одинцово Московской области;;;;;;;;;
10110385;Псковский филиал НОЧУ ВОП "Санкт-Петербургский институт управления и права";;;;;;;;;
10110397;Абаканский филиал НАЧОУ ВПО Современной гуманитарной академии;;;;;;;;;
10110405;Брянский филиал ЧОУ ВО Современной гуманитарной академии;;;;0;0;;;;
10110440;Самарский филиал ЧОУ ВО Современной гуманитарной академии;;;;;;;;;
10110442;Саранский филиал НАЧОУ ВПО Современной гуманитарной академии;;;;;;;;;
10110443;Саратовский филиал ЧОУ ВО Современной гуманитарной академии;;;;0;0;;;;
10110445;Северодвинский филиал ЧОУ ВО Современной гуманитарной академии;;;;;;;;;
10110446;Смоленский филиал ЧОУ ВО Современной гуманитарной академии;;;;0;;;;;
10110448;Сочинский филиал ЧОУ ВО Современной гуманитарной академии;;;;;;;;;
10110449;Старооскольский филиал НАЧОУ ВПО Современной гуманитарной академии;;;;;;;;;
10110450;Стерлитамакский филиал НАЧОУ ВПО Современной гуманитарной академии;;;;;;;;;
10110451;Сыктывкарский филиал НАЧОУ ВПО Современной гуманитарной академии;;;;;;;;;
10110452;Тамбовский филиал ЧОУ ВО Современной гуманитарной академии;;;;0;0;;;;
10110455;Улан-Удэнский филиал ЧОУ ВО Современной гуманитарной академии;;;;0;;;;;
10110457;Уфимский филиал ЧОУ ВО Современной гуманитарной академии;;;;0;0;;;;
10110458;Ухтинский филиал НАЧОУ ВПО Современной гуманитарной академии;;;;;;;;;
10110459;Хабаровский филиал ЧОУ ВО Современной гуманитарной академии;;;;;;;;;
10110460;Хасавюртовский филиал НАЧОУ ВПО Современной гуманитарной академии;;;;0;;;;;
10110462;Черкесский филиал НАЧОУ ВПО Современной гуманитарной академии;;;;0;;;;;
10110902;Магаданский филиал АНО ВПО "Российская академия предпринимательства";;;;0;;0;0;;
10110903;Новосибирский филиал АНО ВПО Российская академия предпринимательства;;;;;;;;;
10110906;Челябинский филиал АНО ВПО "Российская академия предпринимательства";;;;;;0;0;0;0
12000444;Коломенский институт (филиал) ФГБОУ ВПО "Московский государственный машиностроительный университет (МАМИ)" в г. Коломне Московской области;;;;0;;;;;
12000448;Рязанский институт (филиал) ФГБОУ ВПО "Московский государственный машиностроительный университет (МАМИ)";;;;0;;;;;
12000450;Губкинский институт (филиал) ФГБОУ ВПО "Московский государственный машиностроительный университет (МАМИ)" в г.Губкине Белгородской области;;;;;;;;;
12000452;Филиал ФГБОУ ВПО "Московский государственный машиностроительный университет (МАМИ)" в г.Воскресенске Московской области;;;;0;;;;;
12000459;филиал ФГБОУ ВПО "Московский государственный машиностроительный университет (МАМИ)" в г. Сафоново Смоленской области;;;;0;;;;;
12000463;Филиал ФГБОУ ВПО "Московский государственный машиностроительный университет (МАМИ)" в г. Прокопьевске Кемеровской области;;;;;;;;;
12000464;Филиал ФГБОУ ВПО "Московский государственный машиностроительный университет (МАМИ)" в г. Махачкале Республики Дагестан;;;;;;;;;
12000465;филиал ФГБОУ ВПО "Московский государственный машиностроительный университет (МАМИ)" в г. Смоленске;;;;;;;;;
12003257;Чебоксарский политехнический институт (филиал) ФГБОУ ВПО "Московский государственный машиностроительный университет (МАМИ)" в г.Чебоксары Чувашской Республики;;;;0;;;;;
12006915;Таганрогский филиал НОУ ВПО "Российский новый университет";;;;0;0;0;0;0;0
12006918;Александровский филиал НОУ ВПО "Российский новый университет";;;;0;;;;;
12006919;Волоколамский филиал НОУ ВПО "Российский новый университет";;;;;;;;;
12006920;Гагаринский филиал НОУ ВПО "Российский новый университет";;;;;;;;;
12006925;Орехово-Зуевский филиал ОЧУ ВО "Академия МНЭПУ";;;;;;;;;
12006927;Воскресенский филиал НОУ ВПО "Российский новый университет";;;;0;;;;;
12006928;Новоуренгойский филиал НОУ ВПО "Российский новый университет";;;;;;;;;
12006930;Кубанский институт социоэкономики и права (филиал) ОУ профсоюзов ВО "Академия труда и социальных отношений" (КубИСЭП (филиал) ОУП ВО "АТиСО");;;;;0;0;0;0;0
12006936;Волгоградский филиал ОУ профсоюзов ВО "Академия труда и социальных отношений";;;;;0;;;;
12006939;Красноярский филиал ОУ профсоюзов ВО "Академия труда и социальных отношений";;;;0;0;0;0;0;0
12006987;Филиал Международного института экономики и права в городе Петрозаводске;;;;0;;;;;
12006988;Рыбинский филиал ОО ВО (частное учреждение) "Международная академия бизнеса и новых технологий (МУБиНТ)";;;;;;;;;
12006989;Костромской филиал ОО ВПО (частное учреждение) "Международная академия бизнеса и новых технологий (МУБиНТ)";;;;0;;;;;
12006990;Волоколамский институт гостеприимства - филиал РМАТ;;;;0;;;;;
12006996;Центральный институт управления и экономики туристского бизнеса - филиал НОУ ВПО Российская международная академия туризма;;;;;;;;;
12007008;Владимирский филиал РМАТ;;;;;;;;;
12007010;Тульский филиал РМАТ;;;;;;;;;
12007011;Воскресенский институт туризма - филиал РМАТ;;;;0;0;0;0;0;0
12007013;Западно-Подмосковный институт туризма - филиал РМАТ;;;;0;0;0;0;0;0
12007014;Карельский институт туризма - филиал РМАТ;;;;;;;;;
12007015;Псковский филиал РМАТ;;;;0;0;0;0;0;0
12007034;Подольский институт (филиал) ФГБОУ ВПО "Московский государственный машиностроительный университет (МАМИ)" в г.Подольске Московской области.;;;;;;;;;
12011608;Тувинский филиал ФГБОУ ВПО "Восточно-Сибирская государственная академия культуры и искусств";;;;;;;;;
12011930;Ступинский филиал НОУ ВПО "Российский новый университет";;;;0;0;0;0;;
12012670;Ростовский-на-Дону институт физической культуры и спорта (филиал) ФГБОУ ВПО "Кубанский государственный университет физической культуры, спорта и туризма";;;;;;;;;
12012671;Екатеринбургский филиал ФГБОУ ВПО "Уральский государственный университет физической культуры ";;;;0;0;0;0;0;0
12012672;Башкирский институт физической культуры (филиал) ФГБОУ ВО "Уральский государственный университет физической культуры";;;;1;1;1;1;1;0
12012673;Стерлитамакский институт физической культуры (филиал) ФГОУ ВПО "Уральский государственный университет физической культуры";;;;0;0;0;0;;
12012674;Филиал ФГБОУ ВПО "Иркутский государственный университет путей сообщения" в г. Братск;;;;;;;;;
12012682;Филиал ФГБОУ ВПО "Российский государственный университет физической культуры, спорта, молодежи и туризма (ГЦОЛИФК)" в г. Новочебоскарске;;;;;;;;;
12012688;Филиал НОУ ВПО "Институт профессиональных инноваций" в Республике Саха Якутия г. Нерюнгри;;;;;;;;;
12012689;Филиал НОУ ВПО "Институт профессиональных инноваций" в г.Волгограде;;;;;;;;;
12012690;Филиал НОУ ВПО "Институт профессиональных инноваций" в г. Мирный;;;;;;;;;
12012695;Коломенский филиал НОУ ВПО "Московская академия экономики и права";;;;;;;;;
12012696;Моздокский филиал НОУ ВПО "Московская академия экономики и права";;;;0;0;;;;
12012697;Рязанский филиал НОУ ВПО "Московская академия экономики и права";;;;;;;;;
12012699;Воронежский филиал НОУ ВПО "Московская академия экономики и права";;;;;;;;;
12012700;Смоленский филиал НОУ ВПО "Московская академия экономики и права";;;;0;0;;;;
12012701;Калмыцкий филиал НОУ ВПО "Московская академия экономики и права";;;;0;0;;;;
12012705;Ивановский филиал АНОО ВО Центросоюза Российской Федерации "Российский университет кооперации";;;;;;;;;
12012706;Новгородский филиал АНОО ВО Центросоюза Российской Федерации "Российский университет кооперации";;;;0;0;0;;;
12012707;Смоленский филиал АНОО ВО Центросоюза Российской Федерации "Российский университет кооперации";;;;0;0;0;0;0;0
12012708;Ижевский филиал АНОО ВО Центросоюза Российской Федерации "Российский университет кооперации";;;;0;;0;0;0;0
12012709;Владимирский филиал АНОО ВО Центросоюза Российской Федерации "Российский университет кооперации";;;;0;0;0;0;0;0
