1971;ЮЖНЫЙ УНИВЕРСИТЕТ (ИУБиП);;62,04;55,95;54,71;56,3;56,74;57,82;58,16;53,37
1972;Новосибирский институт экономики и менеджмента;;;;;;;;;
1973;Московский экономический институт;;60,8;51,9;54,42;54,78;52,95;67,47;68,86;69,24
1974;Миссионерский институт;;;;;;0;0;0;0
1975;Тульский институт управления и бизнеса имени Никиты Демидовича Демидова;;49,9;45,2;55;0;56,65;65,43;55;0
1976;Международный институт менеджмента ЛИНК;;54,3;50,43;52,22;;58,62;;;
1977;Санкт-Петербургская юридическая академия;;66,2;;67,3;67,9;67,9;67,9;67,7;69
1978;Самарский институт бизнеса и управления;;52,5;;;;;;;
1979;Южно-Сахалинский институт экономики, права и информатики;;46,37;45,71;52;0;54,9;;;
1981;Московский институт мировой экономики и международных отношений;;;;;;;;;
1982;ИНСТИТУТ ТЕАТРАЛЬНОГО ИСКУССТВА им. П.М. ЕРШОВА;;62;;66;65;63,4;69,59;68,8;
1983;Смольный институт Российской академии образования;;;67,64;77,63;83,34;69,34;68,25;;
1984;Московский финансово-правовой интитут;;52,46;;;;;;;
1985;Российская школа частного права;;0;;;;;;;
1986;Сергиево-Посадский гуманитарный институт;;;52,74;52,98;44,87;;;;
1987;Московский институт управления;;51;;;;;;;
1988;Владикавказский институт управления;;63,48;51,51;;;48,64;48,11;51,77;48,19
1990;Межрегиональный институт экономики и права;;59,53;58,01;58,18;60,47;59,99;60,82;60,95;62,09
1991;Восточно-Сибирский институт экономики и права;;;;67,8;64,3;62,53;65,35;66,45;0
1992;Московский институт банковского дела;;59,3;;;;;;;
1994;Институт экономики и управления;;;;0;0;0;0;0;0
1995;Московский Институт Телевидения и Радиовещания Останкино;;69,32;71,57;72,4;67,08;;;;
1996;Международный институт компьютерных технологий;;53,41;49,69;54;49,88;47,83;49,68;51,41;47,49
1997;Московский институт физической культуры и спорта;;51,68;;;;;;;
1998;Подольский социально-спортивный институт;;56,32;61,15;62,16;66,32;;;;
1999;Балаковский институт бизнеса и управления;;0;;;;;;;
2000;ИНСТИТУТ ДРУЖБЫ НАРОДОВ КАВКАЗА;;;52,67;44,19;51,79;61,81;60,04;60,04;63,63
2001;Московский экономико-финансовый институт;;52,29;;;;;;;
2002;Невский институт языка и культуры;;63,1;;62,98;;;67,43;63,41;63,38
2003;Московский институт юриспруденции;;46,77;;;;;;;
2004;Негосудрственное Алтайский экономико-юридический институт;;60,03;60,52;60,44;61,39;;;;
2005;Прикамский социальный институт;;60,73;54,55;54,4;;54,6;56,46;55,12;60,36
2007;Сибирский институт международных отношений и регионоведения;;;61,68;64,7;66,32;62,11;62,07;;
2008;Волгоградский институт бизнеса;;56,18;51,62;57,28;56,86;58,49;59,43;0;0
2009;Негосударственное Армавирский лингвистический социальный институт;;46,47;46,53;50,98;47,86;52,05;58,4;53,67;52,76
2010;Институт гостиничного и туристического менеджмента;50,4;;;;;;;;
2011;Московский архитектурно-строительный институт;;52,72;48,56;52,14;;;;;
2012;Международный гуманитарно-лингвистический институт;;59,5;;58,18;55,51;52,65;62,89;55,84;52,36
2015;Пермский институт муниципального управления;;;;;;;;;
2016;Институт менеджмента и рынка;;;;;;;;;
2017;ТУЛЬСКИЙ УНИВЕРСИТЕТ (ТИЭИ);;60,09;48,65;56,54;54,3;54,29;63,51;;0
2018;Санкт–Петербургский медико-социальный институт;;;;;71,12;71,97;71,99;72,45;71,18
2019;Уральский институт коммерции и права;;97;;56,6;;0;0;0;
2022;Владикавказский институт Моды и Дизайна;;58,29;55,5;;;;;;
2023;Высшая школа бизнеса, безопасности и управления;;0;;;;;;;
2024;Омский институт международного менеджмента и иностранных языков Ин.яз. - Омск;;65,4;43,5;;;;;;
2025;Сибирский университет потребительской кооперации;;51,29;55,56;49,66;50,35;50,14;50,59;52,41;51,51
2026;Международная Гуманитарно-Техническая Академия (институт);;;;0;;;;;
2027;Московская международная академия;;65,67;;58,18;60,38;60,42;60,77;54,91;56,73
2028;Московский институт государственного управления и права;;;49,05;;65,67;65,52;66,34;;
2029;Институт современных технологий и экономики;;51,25;;;;;;;
2030;Евразийский институт экономики, менеджмента, информатики;;0;;;;;;;
2032;Ростовский институт иностранных языков;;73;;;;;;;
2033;Открытый технологический институт;;;;56,77;;;;0;55,49
2034;Институт социально-экономического прогнозирования и моделирования;;100;78,4;65;51,52;;;;
2035;Сибирский институт бизнеса, управления и психологии;;;50,92;52,28;50,36;52,5;54,97;54,39;53,18
2036;Новый гуманитарный институт;;70;0;61;65,6;60;65,4;;
2039;Столичный институт переводчиков;;;;;;;;;
2040;Казанский институт финансов, экономики и информатики;;63,49;62,2;0;0;0;0;;
2041;Челябинский институт экономики и права им. М.В. Ладошина;;63,27;60,79;60,27;0;;;;
2042;Институт специальной педагогики и психологии;;52,1;;59,67;;51,7;;;
2043;Балтийский Гуманитарный Институт;;;;53,4;54,1;0;53;0;53,17
2044;Институт бизнеса, информационных технологий и финансов;;;;;;;;;
2045;Московская академия творчества;;64,45;;;;;;;
2046;Московский технологический институт ВТУ;;37;72;77,6;0;0;;;
2047;Московский финансово-экономический инcтитут;;52,04;;56,2;53,98;52,02;52,89;;
2048;Институт экономики;;0;67,61;0;;;;;
2049;Институт экономики и управления (г. Пятигорск);;56,65;;53,72;;;;;
2050;Рязанский институт открытого образования;;0;;;;;;;
2051;Томский экономико-юридический институт;;54,64;;51,26;;;;;
2052;Экономико-правовой институт;;;;;;;;;
2053;Институт международных экономических связей;;63,1;;50,51;49,63;52,01;58,79;51,41;54,64
2054;Санкт-Петербургский институт гуманитарного образования;;;;;;;;;
2055;Московский университет государственного управления;;54,16;48,19;49,04;;;;;
2056;Кисловодский институт экономики и права;;0;0;;;;;;
2057;Невский институт управления и дизайна;;63,3;63,72;60,81;;;;;
2059;АЛТАЙСКАЯ АКАДЕМИЯ ЭКОНОМИКИ И ПРАВА (ИНСТИТУТ);;57,32;54,34;55,31;;;;;
2060;Межрегиональный открытый социальный институт;;55,3;49,9;51,52;51,43;54,39;43;0;0
2062;Институт Индустрии Моды;;;;;;;;;
2063;Санкт-Петербургский институт экономики и управления;;;;;64,8;64,57;68,4;68,03;69,1
2064;Калининградский институт управления;;;;;51,3;57,2;52,59;49,42;54,7
2065;Сантк-Петербургский Гуманитарный университет профсоюзов;;65,8;;;68,3;68,17;68,54;70,47;67,96
2066;Владимирский институт туризма и гостеприимства;;54,2;50,7;57,5;61,12;;;;
2067;Уральский институт экономики, управления и права;;63,11;65;64,71;0;0;0;0;72
2068;Московский институт предпринимательства и права;;54,79;;;;;;;
2069;ростовский международный институт экономики и управления;;56,86;55,66;48,73;;;;;
2070;Ростовский институт защиты предпринимателя;;55,67;49,24;;52,11;53,6;56,88;63,72;63,75
2071;Региональный финансово-экономический институт;;62,23;61,2;63,68;0;65,7;0;0;
2072;Среднерусский гуманитарно-технологический институт;;51,91;47,66;54,11;0;0;65,3;69;0
2073;Московский гуманитарный институт имени Е.Р.Дашковой;;54,59;49,48;51,07;;;;;
2074;Кавказский светский институт;;;;;;;;;
2075;Западно-Сибирский Институт Финансов и Права;;45,2;;;;;;;
2076;Московский новый юридический институт;;0;;;;;;;
2077;Томский заочный финансово-юридический институт;;0;;0;;;;;
2078;Российская экономическая школа (институт);;93,5;96;96;94,2;88,1;90,3;90,1;90
2079;Санкт-Петербургский институт внешнеэкономических связей, экономики и права;;59,64;;56,14;59,34;57,09;0;;
2080;Институт бизнеса и права;;;;;;;;;
2081;Сочинский институт моды, бизнеса и права ;;62,28;63,5;62,16;61,96;62;;;
2082;Институт управления;;;;51,24;52,98;54;56,6;55,5;58,1
2083;Гуманитарно-экономический и информационно-технологический институт;;0;;;;;;;
2084;МЕЖДУНАРОДНЫЙ УНИВЕРСИТЕТ В МОСКВЕ;;62,98;63,34;59,26;63,18;59,35;65,27;64,62;62,2
2085;Московская гуманитарно-техническая академия;;72,81;67,03;67,45;67,1;67,16;68,12;;
2086;Экономико-юридический институт;;;;;;;;;
2087;СИБИРСКАЯ АКАДЕМИЯ УПРАВЛЕНИЯ И МАССОВЫХ КОММУНИКАЦИЙ (ИНСТИТУТ);;;;51,98;;;;;
2089;Международный еврейский институт экономики, финансов и права;;;;60,4;55,77;60,55;58,68;59,2;55,83
2090;Институт международных экономических отношений;;;0;;;;;;
2092;Приамурский институт агроэкономики и бизнеса;;0;;0;;;0;0;
2093;Белгородский инженрено-экономический институт;;48,56;44,62;;;;;;
2094;Дагестанская академия образования и культуры;;49,64;;53,92;0;63,29;0;0;
2095;Уральский гуманитарный институт;;61,48;59,68;59,62;;;;;
2096;Институт государственного администрирования;;;;;;67,7;65,4;0;65,55
2151;Московский государственный психолого-педагогический университет;;61,37;56,79;64,72;62,4;62,09;63,21;61,99;67,06
2155;Московская государственная академия делового администрирования;;;;;;;;;
2183;Московский городской педагогический университет;;62,94;59,74;65,29;67,49;66,62;70,23;68,83;72,37
2189;Московский институт открытого образования;;;;;;;;;
2197;Институт искусства реставрации;;0;68,25;;;0;0;;
2198;Ивановский государственный политехнический университет;;53,4;48,82;52,64;52,44;53,76;49,94;52,46;55,28
5516;Крымский инженерно-педагогический университет;;;;;0;49,16;56,97;47,77;47,13
5517;Крымский университет культуры, искусств и туризма;;;;59,4;42;61,11;56,28;43;
5518;Крымский институт бизнеса;;;;;;;;;
5519;Образовательная организация высшего образования Университет экономики и управления;;;;;;55,74;49,6;50,25;47,52
5542;Керченский государственный морской технологический университет;;;;;;;;;
5572;Профессиональный институт управления;;0;;;;;;;
5616;Институт иностранных языков;;68,42;;68,86;67,57;;;;
5618;Санкт-Петербургский институт искусств и реставрации;;55,43;;59,71;;55,63;71;68,6;0
5625;Северо-Западный открытый технический университет;;0;;0;;0;0;;
5631;Московский институт управления;;0;;;;;;;
5635;Московский институт государственного и муниципального управления;;0;;;;;;;
5636;Московский институт психологии;;0;;;;;;;
5637;Московский юридический институт;;0;;;;;;;
5664;Институт языков и культур имени Льва Толстого;;0;;;0;;;;
5675;Сколковский институт науки и технологий;;;;;;;;;
5802;Московский исламский институт;;0;49,7;57,6;;;;;
5961;Пензенская духовная семинария Пензенской Епархии Русской Православной Церкви;;;;;;;58,5;55,3;61
100256;Санкт-Петербургский государственный экономический университет;;66,18;61,84;66,82;67,09;67,39;67,49;68,27;70,71
100345;Исследовательский центр частного права имени С.С. Алексеева при Президенте Российской Федерации;;;;0;0;0;0;0;0
110134;Мордовский гуманитарный институт;;;;;52,34;51,58;;;
110135;Институт международных связей;;63,15;57,02;56,63;;60,51;58,98;59,3;55,76
110136;Институт права и экономики;;;49,05;48,43;66,7;;;;
110138;Академический Гуманитарный Институт;;;;;;;;;
110139;Академический институт прикладной энергетики;;0;73,3;66;64;65,3;;;
110140;Академический международный институт;;70,3;;0;;;;;
110141;Академический правовой институт;;0;;0;;;;;
110142;Академия гражданской защиты и медицины катастроф;;54,1;;;;;;;
110144;Академия социального образования;;62,36;47,18;54;54,37;55,37;57,63;65,5;59,1
110145;Академия социального управления;;59,98;58,49;61,3;61,54;59,21;55,74;61,96;60,56
110147;Академия сферы социальных отношений;;;;;;;;;
110148;Академия труда и социальных отношений;;55,94;;54,63;53,99;54,85;55,61;54,19;57,41
110152;Алтайский институт финансового управления;;61;61,06;54,8;;;;;
110153;Альметьевский государственный институт муниципальной службы;;;;;;;;;
110154;Альметьевский государственный нефтяной институт;;58,12;56,22;53,67;52,7;54,49;58,77;53,49;0
110155;Астраханский инженерно-строительный институт;;52,35;47,73;53,5;52,5;53,21;47,94;50,91;48,96
110156;Байкальский гуманитарный институт;;;;;68,37;;54,07;0;0
110157;Байкальский экономико-правовой институт;;;;;;0;0;;
110158;Балтийский институт иностранных языков и межкультурного сотрудничества;;68,67;;63;63,79;65,4;;;
110159;Балтийский институт экологии, политики и права;;66,38;;58,43;0;63,14;;;
110160;Башкирская академия государственной службы и управления при Президенте Республики Башкортотстан;;58,07;60,63;53,76;53,49;0;0;0;62,4
110161;Белгородский государственный институт искусств и культуры (БГИИК);;58,5;54,97;65,64;59,72;60,7;58,98;63,94;63,06
110162;Владикавказский   институт   экономики, управления    и  права (г. Владикавказ);;55,8;44,25;0;;;;;
110163;Владимирский институт бизнеса (ВИБ);;55,72;;;;;;;
110164;Волгоградский государственный институт искусств и культуры;;;54,5;63,28;58,09;54,18;58,35;58,78;53
110165;Волгоградская консерватория (институт) имени П.А.Серебрякова;;;0;0;0;0;0;0;0
110166;Волгоградский юридический институт;;0;;;;;;;
110167;Волжский институт экономики, педагогики и права;;;47,81;52,04;55,74;51,27;54,45;52,27;50,24
110168;Воронежский институт инновационных систем;;0;;;;;;;
110169;Воронежский институт экономики и социального управления;;59,98;49,3;54,53;57,62;55,72;60;61,22;70,14
110170;Воронежский экономико-правовой институт;;55,54;52,9;61,58;61,1;62,52;63,58;60,63;60,45
110171;Восточно-Европейский институт;;51,74;53,28;;56,29;0;0;0;
110173;Высшая школа музыки Республики Саха (Якутия) (институт) имени В. А. Босикова;;0;0;64,5;69,47;78,6;78,3;60;67,15
110174;Высшая школа предпринимательства (институт);;60,65;51,37;62,7;0;61,7;62,6;65,3;65,6
110176;Высшая школа психологии (Институт);;;;;;;;;
110180;Государственный институт экономики, финансов, права и технологий;;57,53;58,41;59,96;57,67;53,05;60,07;60,39;60,24
110182;Гуманитарно-Прогностический Институт;;;;;;;;;
110183; Гуманитарно-социальный институт;;50,71;48,61;46,29;50,83;53,05;54,7;55,09;53,12
110185;Гуманитарно-Экологический Институт;0;;;;;;;;
110186;Открытый Институт - Высшая профессиональная школа;;66,73;;;;0;58;55,83;74,44
110187;Гуманитарный институт имени П.А.Столыпина;;;;65,18;64,68;71;66,57;70,8;75,3
110188;Гуманитарный институт;;;;;;74;71,38;71,18;
110189;Дагестанский государственный институт народного хозяйства;;0;46,86;45,59;44,54;46,43;48,36;46,77;48,33
110190;Дагестанский медицинский стоматологический институт;;;;;;53,3;0;0;51,7
110192;Дальневосточный институт коммуникаций;;0;0;0;0;0;0;0;0
110193;Дальневосточный институт международного бизнеса;;51,29;;;;;;;
110194;Дальневосточный институт международных отношений;;45,3;;58,32;0;;;;
110196;Донской институт дистанционного образования;;;;;;;;;
110197;Донской юридический институт;;60;61;;;;;;
110199;Европейско-Азиатский институт управления и предпринимательства;;;;;;;;;
110200;Екатеринбургская академия современного искусства (институт) ;;52;50,95;53,25;52,7;53,5;52,3;54,44;54,12
110202;Ессентукский институт управления, бизнеса и права;;53,97;;60,22;60;66,41;60,05;61,56;65,96
110203;Заокский христианский гуманитарно-экономический институт;;60,04;54,16;;;61,39;;;
110204;Западно-Уральский институт экономики и права;;;52,89;50,6;53;55,6;54,2;58,9;52,86
110207;Ижевский институт управления;;;;;;;;;
110209;Институт адвокатуры, нотариата и международных отношений;;0;;;;;;;
110212;Институт бизнеса, психологии и управления;;51,7;0;0;;;;;
110214;Институт гуманитарного образования и информационных технологий;;;;58,47;63,28;59,81;60,16;60,7;74,81
110216;Институт деловой карьеры;;;;0;0;50,82;53,5;65,2;64,57
110218;Институт журналистики и литературного творчества;;;;;;63;65;;66
110219;Институт законоведения и управления ВПА;;;;;;60,26;56,57;;
110221;ИНСТИТУТ ИНОСТРАННЫХ ЯЗЫКОВ;;66,2;;63,8;;72,8;0;65,7;68,6
110222;Институт информационных технологий, экономики и менеджмента;;59,64;;72,61;55,39;57,3;56,68;58;0
110224;Институт Коммерции и Права;;;0;;;;;;
110227;Институт международного права и экономики имени А.С. Грибоедова;;66,55;59,12;59,06;59,15;60,31;67,95;71,25;75,43
110229;Институт международной торговли и права;;;56,84;;0;0;56,45;;
110230;Институт менеджмента, экономики и инноваций;;;67,8;0;50,34;;50,3;0;0
110231;Институт мировой экономики и финансов;;44,4;51,5;49,77;51;60,3;54,6;0;
110232;Институт открытого бизнес-образования и дизайна;;;;;64,77;65,05;69,88;42,46;57,28
110236;Институт программных систем УГП имени А.К.Айламазяна;;68,8;53,38;;45,5;;;;
110237;Московский институт психологии;;;;0;0;;;;
110238;Институт психологии и педагогики;;61,1;;;;;;;
110239;Институт радиоэлектроники, сервиса и диагностики;;47;;0;0;0;0;0;0
110240;Институт русского театра;;;;61,6;;;;;
110241;Институт систем управления экономикой и международного права;;;;;;;;;
110243;Институт современного искусства;;66,71;66,34;68,54;67,72;68,25;68,5;69,08;72,81
110244;Институт современного права и экономики;;;;;;;;;
110245;Институт современного управления, кино и телевидения;;20;;;;;;;
110248;Институт социальных наук;;;;;74;69,2;73,47;83,5;70
110250;Институт технологии туризма;;0;64,14;;;;;;
110251;Институт международных отношений;;;;0;;;;;
110252;Институт Уник;;;;;;;;;
110254;Институт управления и права;;;;;;0;;;
110255;Институт Управления, Бизнеса и Права (г.Пятигорск);;32;;;0;57,5;54;56,4;
110261;Институт финансов и права;;71;0;67,3;72,78;70,52;0;0;0
110263;Институт финансового контроля и аудита;;;;;;;;;
110264;Институт цивилизации;;62,6;56,08;;;;;;
110265;Институт Экономики Бизнеса;;;57,23;60,8;0;;;;
110266;Институт экономики и культуры;;;;;;66,72;65,9;66,26;67,27
110267;Институт экономики и права (г. Воронеж);;;;52;0;0;0;0;
110269;Институт экономики и предпринимательства;;68,99;;;;;;;
