miccedu_id;clear_name;ind_2013_value;ind_2014_value;ind_2015_value;ind_2016_value;ind_2017_value;ind_2018_value;ind_2019_value;ind_2020_value;ind_2021_value
1;Адыгейский государственный университет;;;2 931;3 041;2 915;2 688;2 443;2 467;2549
2;Алтайская государственная педагогическая академия;;;0;0;0;0;0;0;0
3;Алтайский государственный технический университет им. И.И. Ползунова;;;219;352;409;480;518;685;790
4;Алтайский государственный университет;;;1 491;860;1 597;1 174;1 299;1 545;2282
5;Амурский государственный университет;;;0;596;541;484;607;772;1128
6;Амурский гуманитарно-педагогический государственный университет;;;0;0;0;0;0;0;46
7;Ангарская государственная техническая академия;;;0;0;0;0;0;0;0
9;Армавирская государственная педагогическая академия;;;0;0;0;0;0;0;0
11;Астраханский государственный университет;;;1 241;1 211;1 123;1 129;1 214;1 363;1619
12;Байкальский государственный университет экономики и права;;;2 701;2 500;2 500;2 276;2 152;2 694;3422
13;Балтийский государствнный технический университет ВОЕНМЕХ им. Д.Ф. Устинова;;;0;0;0;0;0;0;0
14;Башкирский государственный педагогический университет им. М. Акмуллы;;;1 430;1 491;1 571;1 624;1 606;1 718;1838
15;Башкирский государственный университет;;;180;232;251;226;173;234;538
16;Белгородский государственный технологический университет им. В.Г. Шухова;;;0;0;0;0;30;122;253
17;Белгородский государственный национальный исследовательский университет;;;1 345;1 491;1 801;2 290;2 787;3 310;4037
19;Алтайская государственная академия образования имени В.М. Шукшина;;;0;0;0;0;0;0;0
21;Благовещенский государственный педагогический университет;;;0;0;0;0;0;0;0
23;Братский государственный университет;;;1 423;1 410;1 413;1 318;1 217;1 052;1238
24;Брянская государственная инженерно-технологическая академия;;;0;0;0;10;9;8;11
25;Брянский государственный технический университет;;;582;513;546;585;608;690;755
26;Брянский государственный университет имени академика И.Г. Петровского.;;;0;0;0;0;0;0;0
27;Бурятский государственный университет;;;203;298;452;521;748;871;1082
28;Владивостокский государственный университет экономики и сервиса;;;3 972;2 652;2 696;2 881;3 030;3 144;3410
30;Владимирский государственный университет имени Александра Григорьевича и Николая Григорьевича Столетовых;;;824;985;1 056;1 090;1 093;1 152;1276
33;Волгоградский государственный архитектурно-строительный университет;;;0;;;;;;
34;Волгоградский государственный социально-педагогический университет;;;0;;0;0;0;0;0
35;Волгоградский государственный технический университет;;;0;0;0;0;0;0;0
36;Волгоградский государственный университет;;;0;0;0;0;93;224;366
39;Вологодский государственный университет;;;919;855;794;790;747;859;1002
40;Воронежский государственный лесотехнический университете имени Г.Ф. Морозова;;;0;0;0;183;284;497;1271
41;Воронежский государственный университет инженерных технологий;;;790;734;719;707;723;803;976
42;Воронежский государственный архитектурно-строительный университет;;;268;;;;;;
43;Воронежский государственный педагогический университет;;;17;17;0;0;0;0;0
44;Воронежский государственный технический университет;;;674;685;1 384;1 547;1 660;1 828;2281
45;Воронежский государственный университет ;;;340;401;463;569;664;740;896
46;Восточно-Сибирский государственный университет технологий и управления;;;725;1 240;1 508;1 525;1 405;1 630;1839
48;Высшая школа народных искусств (институт);;;49;44;57;47;43;25;21
49;Вятский государственный гуманитарный университет;;;348;;;;;;
50;Вятский государственный университет;;;88;524;567;704;801;961;1060
51;Гжельский государственный художественно-промышленный институт;;;1 095;1 196;1 277;1 340;1 399;1 490;1742
52;Глазовский государственный педагогический институт имени В.Г. Короленко;;;66;84;83;71;62;66;81
53;Горно-Алтайский государственный университет;;;643;593;586;535;522;454;467
54;Государственная академия славянской культуры;;;0;;;;;;
55;Государственная классическая академия имени Маймонида;;;;;;;;;
56;Государственная полярная академия;;;0;;;;;;
57;Государственный академический университет гуманитарных наук;;;0;0;0;0;0;0;0
58;Государственный институт русского языка им. А.С. Пушкина;;;0;0;0;0;0;0;0
59;Национальный исследовательский технологический университет МИСиС;;;0;0;0;0;0;0;0
60;Государтвенный университет управления;;;0;0;0;0;0;0;0
61;Грозненский государственный нефтяной технический университет имени академика М.Д. Миллионщикова;;;1 568;1 892;2 363;2 587;2 765;2 472;3320
62;Дагестанский государственный педагогический университет;;;0;0;0;0;0;0;0
63;Дагестанский государственный технический университет;;;0;0;0;0;0;0;0
64;Дагестанский государственный университет;;;198;339;475;616;677;854;972
66;Приамурский государственный университет имени Шолом-Алейхема;;;900;865;904;796;834;762;857
67;Дальневосточный государственный гуманитарный университет;;;;;;;;;
70;Донской государственный технический университет;;;2 043;4 112;2 394;2 292;2 324;2 485;2832
72;Елецкий государственный университет им. И.А. Бунина;;;189;330;435;467;497;556;668
76;Ивановский государственный университет;;;0;0;0;0;0;0;0
77;Ивановский государственный химико-технологический университет;;;0;0;0;0;0;0;0
78;Ивановский государственный энергетический университет имени В.И. Ленина;;;257;255;0;0;292;317;355
79;Ижевский государственный технический университет имени М.Т. Калашникова;;;533;954;1 048;1 090;1 143;1 193;1598
80;Ингушский государственный университет;;;0;0;0;0;0;713;1316
82;Иркутский национальный исследовательский технический университет;;;1 245;1 228;1 268;1 311;1 435;1 903;2036
83;Иркутский государственный университет;;;29;0;0;0;0;14;44
85;Кабардино-Балкарский государственный университет им. Х.М. Бербекова;;;3 336;3 325;7 244;4 115;4 480;4 822;5062
86;Казанский государственный архитектурно-строительный университет;;;0;0;0;0;0;0;0
87;Казанский национальный исследовательский технический университет им. А.Н.Туполева-КАИ;;;805;819;988;1 119;1 212;1 460;1651
88;Казанский национальный исследовательский технологический университет;;;1 593;1 661;1 670;1 432;1 313;1 355;1541
91;Казанский государственный энергетический университет;;;349;181;90;0;0;0;0
92;Калмыцкий государственный университет;;;877;920;941;874;846;839;971
93;Калужский государственный университет им. К.Э. Циолковского;;;0;0;0;0;0;0;0
95;Камчатский государственный университет имени Витуса Беринга;;;151;176;106;86;99;84;
96;Северо-Кавказская государственная гуманитарно-технологическая академия;;;1 125;1 095;1 052;1 012;941;920;936
97;Карачаево-Черкесского государственного университета имени У.Д. Алиева;;;0;0;0;0;0;0;0
99;Кемеровский государственный университет;;;0;0;0;0;1 160;1 066;1067
100;Кемеровский технологический институт пищевой промышленности;;;1 254;1 205;1 205;1 186;;;
101;Ковровская государственная технологическая академия имени В.А.Дегтярева;;;331;332;405;470;497;535;559
103;Комсомольский-на-Амуре государственный технический университет;;;473;104;85;198;253;317;412
104;Костромской государственный технологический университет.;;;101;128;115;97;77;68;77
105;Костромской государственный университет имени Н.А. Некрасова;;;0;;;;;;
106;Красноярский государственный педагогический университетим. В.П. Астафьева;;;0;0;0;0;0;0;0
108;Кубанский государственный технологический университет;;;127;44;23;133;461;778;957
109;Кубанский государственный университет;;;1 994;1 521;2 641;2 832;2 838;2 751;2822
111;Кузбасский государственный технический университет имени Т.Ф.Горбачева;;;0;0;0;0;148;388;589
112;Курганский государственный университет;;;0;0;0;0;0;0;0
113;Юго-Западный государственный университет;;;113;109;90;71;73;78;93
114;Курский государственный университет;;;0;732;587;418;401;420;470
116;Липецкий государственный педагогический университет;;;0;0;0;0;0;0;0
117;Липецкий государственный технический университет;;;48;42;35;70;229;437;665
118;Литературный институт имени А.М. Горького;;;0;0;0;0;0;0;0
119;МАТИ - Российский государственный технологический университет имени К.Э. Циолковского;;;;;;;;;
120;Магнитогорский государственный технический университет им. Г.И. Носова;;;3 520;3 351;2 925;2 628;2 444;2 395;2786
122;Майкопский государственный технологический университет;;;1 182;1 133;1 088;1 022;978;858;863
123;Поволжский государственный технологический университет;;;1 268;1 128;1 218;1 241;1 289;1 590;1856
124;Марийский государственный университет;;;0;0;0;0;26;41;58
126;Мордовский государственный педагогический институт имени М.Е. Евсевьева;;;183;291;379;471;640;727;816
127;Мордовский государственный университет им. Н.П. Огарёва;;;652;659;727;751;724;769;857
129;Московский государственный университет тонких химических технологий имени М.В. Ломоносова;;;0;;;;;;
130;Московский государственный юридический университет имени О.Е. Кутафина;;;365;421;402;396;397;453;532
131;Московский авиационный институт (национальный исследовательский университет);;;0;0;516;0;0;0;0
132;Московский автомобильно-дорожный государственный технический университет (МАДИ);;;0;0;0;13;18;0;0
133;Московский архитектурный институт (государственная академия);;;0;0;0;0;0;0;0
134;МИРЭА - Российский технологический университет;;;0;324;637;849;1 061;1 077;1177
136;Московский государственный горный университет;;;;;;;;;
137;Московский государственный гуманитарный университет имени М.А. Шолохова;;;;;;;;;
138;Московский государственный индустриальный университет;;;;;;;;;
140;Национальный исследовательский университет МИЭТ;;;0;0;0;0;0;0;0
141;Московский государственный лингвистический университет;;;0;0;0;0;0;0;0
143;Московский государственный гуманитарно-экономический университет;;;0;0;1 408;0;0;0;0
144;Московский государственный строительный университет;;;0;0;0;0;0;0;0
146;Московский государственный машиностроительный университет (МАМИ);;;0;;;;;;
147;Московский государственный технический университет имени Н.Э. Баумана;;;0;706;876;1 089;1 217;1 242;1306
148;Московский государственный технологический университет СТАНКИН;;;0;0;0;0;0;0;0
149;Московский государственный университет экономики, статистики и информатики (МЭСИ);;;;;;;;;
150;Московский государственный университет геодезии и картографии (МИИГАиК);;;1 043;1 397;1 341;1 398;1 426;1 282;1245
151;Российский государственный университет им. А.Н. Косыгина (Технологии. Дизайн. Искусство);;;371;396;381;306;329;414;579
153;Московский государственный университет леса;;;0;;;;;;
154;Московский государственный университет печати имени Ивана Федорова;;;0;;;;;;
155;Московский государственный университет пищевых производств;;;0;;0;0;127;326;551
156;Московский государственный университет приборостроения и информатики;;;;;;;;;
158;Московский государственный университет технологий и управления имени К.Г.Разумовского;;;973;0;1 074;1 189;1 175;1 122;1118
159;Московская государственная художественно-промышленная академия имени С.Г. Строганова;;;260;338;419;1 248;473;499;538
160;Московский педагогический государственный университет;;;0;96;31;12;56;271;471
161;Московский физико-технический институт (государственный университет);;;0;0;0;0;0;0;0
162;Национальный исследовательский университет МЭИ;;;0;0;0;0;0;0;0
163;Мурманский арктический государственный университет;;;0;0;479;25;93;225;329
164;Набережночелнинский институт социально-педагогических технологий и ресурсов;;;426;567;573;585;552;493;560
165;Национальный исследовательский ядерный университет МИФИ;;;83;0;0;0;0;0;0
166;Нижегородский  осударственный архитектурно-строительный университет;;;0;0;0;0;0;0;0
167;Нижегородский государственный лингвистический университет им. Н.А.Добролюбова;;;0;0;0;0;0;0;0
168;Нижегородский государственный педагогический университет имени Козьмы Минина (Мининский университет);;;129;113;86;67;46;47;44
169;Нижегородский государственный технический университет им. Р.Е. Алексеева;;;0;0;0;0;0;0;0
170;Нижегородский государственный университет им. Н.И.Лобачевского;;;1 124;1 285;2 034;2 000;1 666;1 412;1517
172;Нижнетагильская государственная социально-педагогическая академия;;;;;;;;;
173;Новгородский государственный университет имени Ярослава Мудрого.;;;1 492;1 733;1 854;1 877;1 969;1 975;2138
174;Новосибирская государственная архитектурно-художественная академия;;;0;0;0;0;0;0;0
175;Новосибирский государственный архитектурно-строительный университет (Сибстрин);;;0;0;0;0;0;0;0
176;Новосибирский государственный педагогический университет;;;0;0;0;0;0;0;0
177;Новосибирский государственный технический университет;;;202;217;230;289;335;392;647
178;Новосибирский национальный исследовательский государственный университет;;;438;510;588;717;880;963;1054
179;Новосибирский государственный университет экономики и управления НИНХ;;;1 481;1 863;2 188;2 072;2 486;3 402;4638
180;Норильский индустриальный институт;;;935;902;974;1 060;1 092;1 056;1104
181;Омский государственный институт сервиса;;;0;;;;;;
182;Омский государственный педагогичесий университет;;;500;516;466;376;383;437;485
183;Омский государственный технический университет;;;0;0;236;186;117;89;270
184;Омский государственный университет им. Ф.М. Достоевского;;;294;269;264;307;317;389;386
185;Оренбургский государственный институт менеджмента;;;;;;;;;
186;Оренбургский государственный педагогический университет;;;0;0;0;0;0;0;0
187;Оренбургский государственный университет;;;0;0;0;0;0;1;1
189;Орловский государственный институт экономики и торговли;;;395;421;455;484;422;352;341
190;Государственный университет-учебно-научно-производственный комплекс;;;1 004;;;;;;
191;Орловский государственный университет;;;0;0;808;743;728;705;779
192;Пензенский государственный технологический университет;;;1 449;1 248;1 209;1 053;983;968;1014
194;Пензенский государственный университет;;;582;918;1 179;1 258;1 327;1 482;1877
195;Пензенский государственный университет архитектуры и строительства;;;0;0;0;0;0;0;0
196;Пермский государственный гуманитарно-педагогический университет;;;0;0;0;0;0;0;0
197;Пермский национальный исследовательский политехнический университет;;;72;45;30;0;0;0;0
198;Пермский государственный национальный исследовательский университет;;;0;0;376;734;949;1 035;1056
199;Петрозаводский государственный университет;;;0;0;0;0;0;0;0
201;Поволжская государственная социально-гуманитарная академия;;;0;0;0;0;0;0;0
202;Поволжский государственный университет сервиса;;;875;820;737;588;596;627;683
206;Пущинский государственый естественно-научный институт;;;0;0;0;0;0;0;0
207;Пятигорский государственный лингвистический университет;;;543;498;490;451;514;638;842
209;Российский экономический университет имени Г.В. Плеханова;;;3 131;2 965;3 462;3 962;4 422;4 821;4986
210;Российский государственный геологоразведочный университет имени Серго Орджоникидзе;;;0;0;0;0;0;0;0
211;Российский государственный гидрометеорологический университет;;;0;0;0;0;0;0;0
212;Российский государственный гуманитарный университет;;;358;362;399;379;352;364;373
213;Российский государственный педагогический университет им. А. И. Герцена;;;0;0;0;0;0;0;0
214;Российский государственный профессионально-педагогический университет;;;1 141;1 004;912;887;918;894;1108
215;Российский государственный социальный университет;;;662;786;833;775;910;949;1092
217;Балтийский федеральный университет имени Иммануила Канта;;;2 618;2 593;2 718;2 827;2 787;2 696;2618
219;Российский государственный университет нефти и газа имени И.М. Губкина;;;0;0;0;0;0;0;0
220;Российский государственный университет туризма и сервиса;;;1 184;1 133;1 302;1 304;1 276;1 340;1415
222;Российский университет дружбы народов;;;0;0;0;0;0;0;0
223;Российский химико-технологический университет имени Д.И. Менделеева;;;0;0;0;0;0;0;0
227;Ростовский государственный строительный университет;;;0;;;;;;
228;Ростовский государственный экономический университет(РИНХ);;;1 372;1 242;1 227;1 294;1 430;1 621;1986
229;Рыбинский государственный авиационный технический университет имени П.А. Соловьева;;;646;682;792;820;775;789;801
230;Рязанский государственный радиотехнический университет;;;683;674;681;686;669;745;853
231;Рязанский государственный университет имени С.А. Есенина;;;0;0;0;0;0;0;0
232;Санкт-Петербургский государственный лесотехнический университет имини С.М.Кирова;;;438;559;443;451;464;486;491
233;Санкт-Петербургская государственная художественно-промышленная академия имени А.Л. Штиглица;;;0;0;0;0;0;0;0
