miccedu_id;clear_name;ind_2013_value;ind_2014_value;ind_2015_value;ind_2016_value;ind_2017_value;ind_2018_value;ind_2019_value;ind_2020_value;ind_2021_value
1;Адыгейский государственный университет;5 879;5 756;5 473;5 065;5 118;5 724;6 227;6 654;6667
2;Алтайская государственная педагогическая академия;6 761;6 287;6 378;6 573;6 538;6 695;6 854;7 026;7061
3;Алтайский государственный технический университет им. И.И. Ползунова;12 868;12 527;11 846;11 152;9 991;9 554;9 023;8 410;7938
4;Алтайский государственный университет;11 533;11 473;10 866;10 600;11 909;12 078;11 748;11 405;11621
5;Амурский государственный университет;7 065;6 581;6 109;5 385;5 541;5 270;4 879;4 768;4551
6;Амурский гуманитарно-педагогический государственный университет;3 218;3 142;3 081;2 789;2 622;2 711;2 532;2 795;2769
7;Ангарская государственная техническая академия;3 104;3 074;2 827;2 331;2 077;2 071;2 109;2 083;1967
9;Армавирская государственная педагогическая академия;6 275;7 007;6 544;6 008;6 052;6 151;6 193;6 283;6257
11;Астраханский государственный университет;13 717;13 494;12 379;11 683;11 090;11 090;11 122;11 263;10868
12;Байкальский государственный университет экономики и права;15 137;14 383;14 030;12 364;11 975;11 550;10 596;10 038;9209
13;Балтийский государствнный технический университет ВОЕНМЕХ им. Д.Ф. Устинова;5 109;5 066;4 872;4 991;5 634;6 021;6 357;6 545;7257
14;Башкирский государственный педагогический университет им. М. Акмуллы;9 617;8 363;7 707;8 231;8 785;9 405;9 912;9 980;10247
15;Башкирский государственный университет;14 957;14 304;14 266;13 332;15 045;15 609;14 804;14 896;14801
16;Белгородский государственный технологический университет им. В.Г. Шухова;16 154;16 250;15 255;15 124;15 502;14 821;14 519;14 319;13186
17;Белгородский государственный национальный исследовательский университет;21 206;20 133;19 105;17 461;16 973;16 670;16 395;16 294;16520
19;Алтайская государственная академия образования имени В.М. Шукшина;4 443;3 860;3 107;2 479;2 275;2 232;2 374;2 632;3050
21;Благовещенский государственный педагогический университет;3 954;3 681;3 670;3 301;3 482;3 476;3 269;3 188;3427
23;Братский государственный университет;6 259;5 763;5 176;4 548;3 981;3 837;3 662;3 434;3307
24;Брянская государственная инженерно-технологическая академия;4 163;3 638;3 461;2 923;2 804;2 764;2 474;2 338;2319
25;Брянский государственный технический университет;7 231;7 268;6 991;6 404;6 824;6 651;6 374;6 317;6171
26;Брянский государственный университет имени академика И.Г. Петровского.;9 606;8 534;7 180;6 704;6 709;6 965;7 063;6 766;6600
27;Бурятский государственный университет;10 222;9 754;9 497;9 883;8 825;8 283;7 948;7 170;6644
28;Владивостокский государственный университет экономики и сервиса;10 768;10 456;9 384;7 699;7 461;7 390;7 698;7 704;7750
30;Владимирский государственный университет имени Александра Григорьевича и Николая Григорьевича Столетовых;19 501;19 878;18 041;18 082;17 199;16 822;17 099;16 496;15580
33;Волгоградский государственный архитектурно-строительный университет;6 717;6 370;5 921;;;;;;
34;Волгоградский государственный социально-педагогический университет;8 661;7 698;7 003;;6 860;7 001;7 134;7 010;7214
35;Волгоградский государственный технический университет;11 606;10 902;10 496;10 368;14 830;14 289;14 043;14 019;13529
36;Волгоградский государственный университет;7 829;7 609;7 893;7 490;7 602;7 575;7 685;7 222;7339
39;Вологодский государственный университет;7 120;7 180;10 519;9 775;8 831;8 182;7 414;6 896;6602
40;Воронежский государственный лесотехнический университете имени Г.Ф. Морозова;6 260;5 574;5 191;4 782;4 469;5 054;5 432;5 746;6265
41;Воронежский государственный университет инженерных технологий;7 437;7 338;7 512;6 936;6 699;6 577;6 547;6 406;6428
42;Воронежский государственный архитектурно-строительный университет;9 883;9 984;9 942;;;;;;
43;Воронежский государственный педагогический университет;5 932;5 833;6 026;5 885;6 285;6 586;6 819;6 901;7040
44;Воронежский государственный технический университет;10 189;9 755;8 944;7 995;16 861;17 055;17 210;17 057;16412
45;Воронежский государственный университет ;18 495;18 877;18 384;16 845;17 810;17 515;17 135;17 164;17267
46;Восточно-Сибирский государственный университет технологий и управления;13 835;11 233;10 410;9 707;8 696;8 426;7 752;7 429;7426
48;Высшая школа народных искусств (институт);262;259;238;219;206;217;212;220;212
49;Вятский государственный гуманитарный университет;10 071;9 533;9 260;;;;;;
50;Вятский государственный университет;10 976;12 257;12 404;22 398;22 053;21 907;20 981;19 763;17915
51;Гжельский государственный художественно-промышленный институт;1 201;1 493;1 823;2 163;2 333;2 631;3 086;3 108;3149
52;Глазовский государственный педагогический институт имени В.Г. Короленко;1 612;1 637;1 698;1 937;1 997;2 023;1 968;2 148;2229
53;Горно-Алтайский государственный университет;4 731;3 860;3 490;3 334;3 069;2 939;2 770;2 659;2647
54;Государственная академия славянской культуры;666;653;507;;;;;;
55;Государственная классическая академия имени Маймонида;2 188;2 136;;;;;;;
56;Государственная полярная академия;;;1 623;;;;;;
57;Государственный академический университет гуманитарных наук;1 325;1 342;1 252;1 226;1 377;1 607;1 963;2 123;2301
58;Государственный институт русского языка им. А.С. Пушкина;441;377;443;504;545;578;616;682;767
59;Национальный исследовательский технологический университет МИСиС;4 977;4 873;9 532;8 241;8 411;7 757;7 635;7 825;8193
60;Государтвенный университет управления;13 579;12 894;12 024;10 665;10 374;9 603;9 177;9 608;10559
61;Грозненский государственный нефтяной технический университет имени академика М.Д. Миллионщикова;7 399;7 650;8 171;7 526;7 511;7 030;7 467;7 583;7931
62;Дагестанский государственный педагогический университет;10 399;10 798;10 366;11 658;11 150;10 391;10 011;9 646;9630
63;Дагестанский государственный технический университет;7 371;6 328;5 594;4 823;4 235;4 236;3 713;3 498;3592
64;Дагестанский государственный университет;12 400;12 204;12 543;11 769;10 959;10 901;10 911;10 941;10469
66;Приамурский государственный университет имени Шолом-Алейхема;2 537;2 568;2 622;2 318;2 177;2 100;2 053;2 017;1947
67;Дальневосточный государственный гуманитарный университет;;;;;;;;;
70;Донской государственный технический университет;18 978;18 878;21 333;19 785;29 751;29 887;30 054;28 974;29031
72;Елецкий государственный университет им. И.А. Бунина;6 605;6 184;5 230;4 362;4 034;4 010;3 956;3 755;3581
76;Ивановский государственный университет;4 866;4 333;3 781;4 536;3 892;3 489;3 366;3 329;3302
77;Ивановский государственный химико-технологический университет;5 087;4 934;4 698;4 556;4 434;4 265;3 800;3 740;3788
78;Ивановский государственный энергетический университет имени В.И. Ленина;6 871;6 817;6 698;6 162;5 624;5 287;5 118;4 953;4786
79;Ижевский государственный технический университет имени М.Т. Калашникова;14 377;13 068;12 386;12 070;10 978;10 321;10 421;10 130;9794
80;Ингушский государственный университет;10 790;10 168;8 978;7 418;6 988;6 925;6 970;7 035;7548
82;Иркутский национальный исследовательский технический университет;20 868;17 991;16 673;15 824;15 684;16 184;15 991;15 056;15742
83;Иркутский государственный университет;10 647;10 278;14 554;12 681;14 698;13 909;14 686;15 059;15531
85;Кабардино-Балкарский государственный университет им. Х.М. Бербекова;9 788;9 310;8 802;8 399;8 735;9 258;10 086;10 958;11268
86;Казанский государственный архитектурно-строительный университет;7 249;7 169;6 928;6 654;6 741;6 983;6 733;5 963;5509
87;Казанский национальный исследовательский технический университет им. А.Н.Туполева-КАИ;10 951;10 225;9 804;9 583;9 842;9 630;9 444;9 384;9487
88;Казанский национальный исследовательский технологический университет;20 772;20 479;19 729;20 219;20 897;21 649;19 494;17 935;16506
91;Казанский государственный энергетический университет;10 072;9 671;9 597;9 186;9 283;9 826;10 129;10 116;9696
92;Калмыцкий государственный университет;6 940;6 887;6 721;6 919;7 097;7 466;7 815;7 432;7472
93;Калужский государственный университет им. К.Э. Циолковского;4 264;4 457;4 564;4 549;5 147;5 527;5 721;6 107;6639
95;Камчатский государственный университет имени Витуса Беринга;1 792;1 719;1 483;1 326;1 336;1 283;1 340;1 414;
96;Северо-Кавказская государственная гуманитарно-технологическая академия;4 240;4 409;4 311;4 221;4 130;4 175;4 321;4 358;4530
97;Карачаево-Черкесского государственного университета имени У.Д. Алиева;5 515;6 071;5 726;5 891;5 576;5 328;5 425;5 552;5344
99;Кемеровский государственный университет;8 998;8 556;8 281;8 133;8 278;8 862;14 239;13 761;12421
100;Кемеровский технологический институт пищевой промышленности;6 419;5 854;5 585;5 267;4 596;4 942;;;
101;Ковровская государственная технологическая академия имени В.А.Дегтярева;2 266;2 043;1 826;1 681;1 599;1 607;1 556;1 575;1541
103;Комсомольский-на-Амуре государственный технический университет;9 487;8 237;6 351;5 618;4 906;5 415;5 124;4 684;4740
104;Костромской государственный технологический университет.;5 335;4 996;4 286;3 746;7 756;7 453;7 274;6 810;6426
105;Костромской государственный университет имени Н.А. Некрасова;6 559;5 920;5 381;;;;;;
106;Красноярский государственный педагогический университетим. В.П. Астафьева;8 317;7 511;7 045;7 007;7 098;6 991;6 884;6 613;6452
108;Кубанский государственный технологический университет;16 491;16 072;15 709;15 716;15 680;14 698;13 635;12 628;11800
109;Кубанский государственный университет;17 654;18 485;18 095;18 308;19 780;20 872;21 813;22 526;22823
111;Кузбасский государственный технический университет имени Т.Ф.Горбачева;8 990;8 621;8 248;7 339;7 431;7 498;7 283;7 075;7127
112;Курганский государственный университет;11 984;10 583;9 709;8 510;7 873;8 101;7 878;6 797;7084
113;Юго-Западный государственный университет;11 181;11 436;10 878;11 247;11 106;11 312;10 829;10 923;11106
114;Курский государственный университет;9 014;9 203;9 516;10 046;9 783;12 052;11 373;10 685;10432
116;Липецкий государственный педагогический университет;4 962;4 538;4 324;3 929;3 922;4 181;4 394;4 358;4344
117;Липецкий государственный технический университет;6 352;6 005;5 856;5 868;6 321;6 636;6 685;6 449;6078
118;Литературный институт имени А.М. Горького;829;783;767;789;760;713;684;732;755
119;МАТИ - Российский государственный технологический университет имени К.Э. Циолковского;7 288;6 902;;;;;;;
120;Магнитогорский государственный технический университет им. Г.И. Носова;10 426;21 006;17 422;14 737;12 702;12 250;11 396;11 146;10638
122;Майкопский государственный технологический университет;7 228;6 986;6 856;6 572;6 086;6 147;6 383;6 859;6887
123;Поволжский государственный технологический университет;10 472;9 832;9 142;9 229;9 363;9 271;9 000;8 585;8136
124;Марийский государственный университет;9 114;8 335;7 846;7 305;7 087;7 648;8 262;8 234;7951
126;Мордовский государственный педагогический институт имени М.Е. Евсевьева;5 503;5 672;5 787;5 891;6 024;6 159;6 294;6 066;6003
127;Мордовский государственный университет им. Н.П. Огарёва;19 484;17 858;16 528;15 637;15 706;16 268;16 182;15 679;14900
129;Московский государственный университет тонких химических технологий имени М.В. Ломоносова;3 131;3 136;3 023;;;;;;
130;Московский государственный юридический университет имени О.Е. Кутафина;7 376;7 241;7 322;7 674;8 365;9 237;9 453;9 673;9704
131;Московский авиационный институт (национальный исследовательский университет);14 993;14 328;14 341;19 556;19 066;18 841;18 959;19 099;18914
132;Московский автомобильно-дорожный государственный технический университет (МАДИ);8 911;8 539;8 748;9 425;9 704;9 562;9 179;8 797;8333
133;Московский архитектурный институт (государственная академия);2 452;2 314;2 133;2 390;2 371;2 613;2 676;2 669;2826
134;МИРЭА - Российский технологический университет;5 294;5 088;5 610;16 221;20 596;24 515;24 807;25 458;25999
136;Московский государственный горный университет;5 705;;;;;;;;
137;Московский государственный гуманитарный университет имени М.А. Шолохова;8 377;7 455;;;;;;;
138;Московский государственный индустриальный университет;21 902;19 653;;;;;;;
140;Национальный исследовательский университет МИЭТ;5 202;4 888;4 494;4 259;4 197;4 100;4 281;4 291;4556
141;Московский государственный лингвистический университет;5 876;6 321;5 648;5 859;5 891;6 418;6 369;6 178;6033
143;Московский государственный гуманитарно-экономический университет;961;948;898;831;876;854;1 116;1 203;1309
144;Московский государственный строительный университет;16 083;21 382;14 491;11 502;10 191;11 205;10 898;11 178;11767
146;Московский государственный машиностроительный университет (МАМИ);17 966;33 286;31 734;;;;;;
147;Московский государственный технический университет имени Н.Э. Баумана;15 815;15 677;17 138;18 557;19 759;21 021;21 728;21 955;22349
148;Московский государственный технологический университет СТАНКИН;3 904;3 537;3 486;3 418;3 603;3 845;4 105;4 202;4248
149;Московский государственный университет экономики, статистики и информатики (МЭСИ);48 288;42 782;;;;;;;
150;Московский государственный университет геодезии и картографии (МИИГАиК);4 733;4 266;4 069;3 907;3 625;3 969;3 873;3 948;3932
151;Российский государственный университет им. А.Н. Косыгина (Технологии. Дизайн. Искусство);7 767;7 156;6 907;6 183;7 608;8 349;8 678;9 083;9302
153;Московский государственный университет леса;7 806;7 488;7 301;;;;;;
154;Московский государственный университет печати имени Ивана Федорова;6 145;5 444;4 247;;;;;;
155;Московский государственный университет пищевых производств;8 176;8 431;7 287;;4 368;3 992;3 913;4 436;5254
156;Московский государственный университет приборостроения и информатики;12 522;13 062;;;;;;;
158;Московский государственный университет технологий и управления имени К.Г.Разумовского;18 565;17 460;16 104;12 079;12 515;9 924;9 466;8 432;6190
159;Московская государственная художественно-промышленная академия имени С.Г. Строганова;1 424;1 441;1 562;1 536;1 520;1 590;1 643;1 749;1830
160;Московский педагогический государственный университет;16 463;15 055;14 460;21 682;20 617;20 210;20 530;21 292;21350
161;Московский физико-технический институт (государственный университет);5 130;5 326;5 611;5 878;6 095;6 240;6 483;6 730;7178
162;Национальный исследовательский университет МЭИ;11 214;11 590;12 270;12 761;12 874;13 343;14 069;16 128;16666
163;Мурманский арктический государственный университет;3 377;3 477;3 411;2 871;4 580;2 941;2 612;2 327;2219
164;Набережночелнинский институт социально-педагогических технологий и ресурсов;3 873;3 804;3 717;3 905;4 049;3 815;3 945;3 952;4080
165;Национальный исследовательский ядерный университет МИФИ;8 745;8 510;8 093;7 398;7 064;6 355;5 586;5 666;5709
166;Нижегородский  осударственный архитектурно-строительный университет;12 800;11 068;10 319;9 726;9 048;5 891;5 779;5 466;5213
167;Нижегородский государственный лингвистический университет им. Н.А.Добролюбова;3 064;2 663;2 620;2 506;2 458;3 150;2 935;3 036;3399
168;Нижегородский государственный педагогический университет имени Козьмы Минина (Мининский университет);10 199;9 561;8 720;8 204;8 090;8 876;8 956;8 780;8809
169;Нижегородский государственный технический университет им. Р.Е. Алексеева;12 659;11 586;11 269;11 120;10 251;10 106;9 898;9 632;9503
170;Нижегородский государственный университет им. Н.И.Лобачевского;24 429;22 396;18 404;18 705;18 410;18 204;17 397;17 839;18767
172;Нижнетагильская государственная социально-педагогическая академия;;;;;;;;;
173;Новгородский государственный университет имени Ярослава Мудрого.;9 881;9 508;8 443;7 884;7 523;7 198;7 115;7 396;7792
174;Новосибирская государственная архитектурно-художественная академия;1 233;1 220;1 222;1 188;1 062;1 093;1 130;1 144;1224
175;Новосибирский государственный архитектурно-строительный университет (Сибстрин);5 414;5 260;5 159;5 015;4 781;4 624;4 141;4 026;4237
176;Новосибирский государственный педагогический университет;18 203;16 678;15 436;14 595;13 860;13 696;12 911;13 146;13137
177;Новосибирский государственный технический университет;16 222;14 960;14 293;13 631;13 433;13 577;13 234;13 742;14037
178;Новосибирский национальный исследовательский государственный университет;6 540;6 620;6 485;6 413;6 904;7 211;7 690;8 003;8114
179;Новосибирский государственный университет экономики и управления НИНХ;11 513;10 946;9 331;9 280;9 500;8 498;8 136;8 006;8676
180;Норильский индустриальный институт;1 610;1 571;1 384;1 343;1 273;1 312;1 272;1 311;1393
181;Омский государственный институт сервиса;3 127;2 991;2 734;;;;;;
182;Омский государственный педагогичесий университет;9 433;9 267;8 373;8 583;8 526;8 072;7 679;7 137;6857
183;Омский государственный технический университет;13 075;13 152;13 525;15 107;16 752;16 552;16 034;15 822;15491
184;Омский государственный университет им. Ф.М. Достоевского;9 677;9 529;9 203;8 645;8 543;8 255;7 853;7 366;7320
185;Оренбургский государственный институт менеджмента;3 844;3 349;;;;;;;
186;Оренбургский государственный педагогический университет;6 764;6 958;6 294;5 706;5 402;5 382;5 498;5 201;4897
187;Оренбургский государственный университет;20 494;19 727;17 616;16 772;15 500;15 069;15 493;14 620;14131
189;Орловский государственный институт экономики и торговли;4 599;4 075;3 626;3 653;3 629;3 612;3 673;3 148;2842
190;Государственный университет-учебно-научно-производственный комплекс;7 864;7 299;7 146;;;;;;
191;Орловский государственный университет;10 400;9 758;9 565;9 555;16 564;16 843;16 262;15 139;14759
192;Пензенский государственный технологический университет;7 003;6 381;5 798;5 220;4 953;4 551;4 215;4 039;4287
194;Пензенский государственный университет;22 672;21 041;21 490;20 461;20 391;19 979;19 534;19 140;18300
195;Пензенский государственный университет архитектуры и строительства;6 442;6 034;5 246;5 215;4 700;4 661;4 582;4 378;4118
