10006944;Северо-Кавказский филиал ФГБОУ ВО "Российский государственный университет правосудия"(г.Краснодар);;;63,42;64,69;63,94;61,6;56,47;59,1;65,01
10006945;Восточно-Сибирский филиал ФГБОУ ВО "Российский государственный университет правосудия"(г. Иркутск);;;55,4;57,5;58;69;65,52;62,59;62,08
10006946;Дальневосточный филиал ФГБОУ ВО "Российский государственный университет правосудия" (г. Хабаровск);;;55,9;57;59;58,6;60,4;60,1;62,03
10006947;Западно-Сибирский филиал Федерального государственного образовательного учреждения высшего образования "Российский государственный университет правосудия" (г. Томск);;;55,1;57,9;57,9;56,34;61,7;56,77;62,72
10006948;Казанский филиал ФГБОУ ВО "Российский государственный университет правосудия"(г. Казань);;;60,22;61,11;62;64,22;66,31;64,37;68,01
10006949;Приволжский филиал ФГБОУ ВО "Российский государственный университет правосудия" (г. Нижний Новгород);;;59,3;61,3;59,2;64,1;64,04;66,45;61,3
10006950;Ростовский филиал ФГБОУ ВПО "Российская академия правосудия" (г. Ростов-на-Дону);;;65,2;62,9;63;62,8;62,71;61,6;61,94
10006951;Северо-Западный филиал ФГБОУ ВО "Российский государственный университет правосудия" (г. Санкт-Петербург);;;61;62;66;66;66,4;66,97;66,79
10006952;Уральский филиал ФГБОУ ВО "Российский государственный университет правосудия" (г. Челябинск);;;58,3;61,2;59,6;59,9;60;57,5;60,72
10006953;Центральный филиал ФГБОУ ВО "Российский государственный университет правосудия" (г. Воронеж);;;59,54;60,14;60,35;61,67;62,54;62,71;62,12
10006954;Барнаульский филиал ФГОБУ ВО "Финансовый университет при Правительстве Российской Федерации" (Барнаульский филиал Финуниверситета);;;56,38;53,37;56,53;56,08;57,08;63,1;56,21
10006955;Брянский филиал ФГОБУ ВО "Финансовый университет при Правительстве Российской Федерации";;;57;56,23;56;;;;
10006956;Владимирский филиал ФГОБУ ВО "Финансовый университет при Правительстве Российской Федерации";;;58,5;58,8;56,61;56,92;56,86;81,24;62,13
10006959;Краснодарский филиал ФГОБУ ВПО "Финансовый университет при Правительстве Российской Федерации";;;65;57,13;56,64;58,72;58,86;57,66;61,14
10006960;Курский филиал ФГОБУ ВО "Финансовый университет при Правительстве Российской Федерации";;;56,31;54,93;54,63;58,8;58,7;57,7;62,45
10006961;Липецкий филиал ФГОБУ ВО "Финансовый университет при Правительстве Российской Федерации";;;58,2;60;58,57;59,63;57,08;59,27;62,87
10006962;Новороссийский филиал ФГОБУ ВО "Финансовый университет при Правительстве Российской Федерации";;;62,09;61,6;60,89;59,26;58,62;58,78;61,46
10006963;Орловский филиал ФГОБУ ВО "Финансовый университет при Правительстве Российской Федерации";;;0;54,87;56,1;55,8;56,28;52;57,6
10006964;Пензенский филиал ФГОБУ ВО "Финансовый университет при Правительстве Российской Федерации";;;58,2;59,56;61,77;62,43;62,74;63,65;57,32
10006965;Смоленский филиал ФГОБУ ВО "Финансовый университет при Правительстве Российской Федерации";;;71;61,35;61,2;60,8;62,15;63,12;63,94
10006966;Тульский филиал ФГОБУ ВО "Финансовый университет при Правительстве Российской Федерации";;;57,64;57,27;59,12;59,6;63,38;62,45;60,1
10006967;Уфимский филиал ФГОБУ ВО "Финансовый университет при Правительстве Российской Федерации";;;58,7;58,15;58,75;58,07;62,79;63,86;62,53
10006968;Челябинский филиал ФГОБУ ВО "Финансовый университет при Правительстве Российской Федерации";;;60,18;60,33;58,89;61,05;59,65;60,1;59,16
10006969;Ярославский филиал ФГОБУ ВО "Финансовый университет при Правительстве Российской Федерации";;;59,6;60,12;62,5;58,5;62,85;63,47;63,13
10006970;Владикавказский филиал ФГОБУ ВО "Финансовый университет при Правительстве Российской Федерации";;;51,55;56,64;62,09;57,68;60,63;58,91;61,26
10006971;Калужский филиал ФГОБУ ВО "Финансовый университет при Правительстве Российской Федерации";;;57,75;57,71;57,26;54,92;58,07;57,02;59,5
10006972;Омский филиал ФГОБУ ВО "Финансовый университет при Правительстве Российской Федерации";;;59,78;58,99;64,09;60,09;59,2;65,84;61,21
10006973;Санкт-Петербургский филиал ФГОБУ ВО "Финансовый университет при Правительстве Российской Федерации";;;63;63,28;59,66;67,51;69,2;61,28;64,91
10006975;Филиал Международного института экономики и права в городе Астрахани;;;0;0;;;;;
10006976;Филиал Международного института экономики и права в городе Белорецке;;;0;0;;;;;
10006977;Филиал Международного института экономики и права в городе Владивостоке;;;0;0;;;;;
10006978;Филиал Международного института экономики и права в городе Волгограде;;;0;0;;;;;
10006979;Филиал Международного института экономики и права в городе Екатеринбурге;;;0;0;;;;;
10006980;Филиал Международного института экономики и права в городе Киселевске;;;0;0;;;;;
10006981;Филиал Международного института экономики и права в городе Магнитогорске;;;0;0;;;;;
10006982;Филиал Международного института экономики и права в городе Мурманске;;;0;;;;;;
10006983;Филиал Международного института экономики и права в городе Омске;;;0;0;;;;;
10006984;Филиал Международного института экономики и права в городе Челябинске;;;0;0;;;;;
10006985;Филиал Международного института экономики и права в городе Ярославле;;;0;0;;;;;
10006986;Сибирский филиал Международного института экономики и права;;;53,68;53,68;;;;;
10006987;Вологодский филиал ОО ВПО (частное учреждение) "Международная академия бизнеса и новых технологий (МУБиНТ)";;;;48,4;;;;;
10006988;Московский филиал РМАТ;;;;57,41;55,77;60,8;61,3;55;57,6
10006993;Филиал ФГБОУ ВО "Ивановский государственный политехнический университет" в г. Краснодаре;;;;;;;;;
10006994;Филиал ФГБОУ ВО "Ивановский государственный политехнический университет" в г. Нижнем Новгороде;;;;;;;;;
10006995;Филиал ФГБОУ ВПО "Ивановский государственный политехнический университет" в г. Рязани;;;;;;;;;
10006997;Институт сервиса и технологий (филиал) ФГБОУ ВПО "Донской государственнывй технический университет" в г. Пятигорске Ставропольского края;;;47,86;46;0;0;;;
10006998;Технологический институт сервиса (филиал)ФГБОУ ВО "Донской государственный технический университет" в г. Ставрополе Ставропольского края;;;52,81;52,14;0;50,95;50,38;38,76;57,7
10006999;Институт сферы обслуживания и предпринимательства (филиал) ФГОУ ВО "Донской государтсвенный технический университет" в г. Шахты Ростовской области;;;52,91;55,66;54,65;52,94;50,16;52,71;56,32
10007017;Филиал ФГБОУ ВПО "Уральский государственный педагогический университет" в г. Красноуфимске;;;;;;;;;
10007018;Филиал ФГБОУ ВПО "Уральский государственный педагогический университет" в г. Серове;;;;;;;;;
10007029;Тольяттинский филиал Самарского национального исследовательского университета имени академика С.П. Королева;;;;;;;;;
10007043;филиал ФГБОУ ВО "Санкт-Петербургский государственный экономический университет" в г. Великие Луки Псковской области;;;;;;;;;
10007044;филиал ФГБОУ ВО "Санкт-Петербургский государственный экономический университет" в г. Калининграде;;;;;;;;;
10007045;Калужский филиал ФГБОУ ВО "Санкт-Петербургский государственный экономический университет";;;;0;;;;;
10007046;Кировский филиал ФГБОУ ВО "Санкт-Петербургский государственный экономический университет";;;;;;;;;
10007047;филиал ФГБОУ ВО "Санкт-Петербургский государственный экономический университет" в г. Сосновый Бор Ленинградской области;;;;;;;;;
10007048;филиал ФГБОУ ВО "Санкт-Петербургский государственный экономический университет" в г. Старая Русса Новгородской области;;;;;;;;;
10007049;филиал ФГБОУ ВО "Санкт-Петербургский государственный экономический университет" в г. Сыктывкар Республики Коми;;;;;;;;;
10007050;филиал ФГБОУ ВО "Санкт-Петербургский государственный экономический университет" в г. Тихвине Ленинградской области;;;;;;;;;
10110172;Филиал АНОО ВПО "Воронежский экономико-правовой институт" в г.Орел;;;42,7;0;0;0;62;60,3;60,3
10110270;Орехово-Зуевский филиал НОУ ВПО "Институт экономики и предпринимательства";;;;;;;;;
10110303;Вышневолоцкий филиал ОАНО ВО "Международный славянский институт";;;;;;;;;
10110306;Калининградский филиал АНОО ВПО "Международный славянский институт";;;;;;;;;
10110307;Волгоградский филиал АНО ВО "Международный славянский институт";;;61;61;;;;;
10110311;Ростовский-на-Дону филиал НОЧУ ВО МОСКОВСКАЯ АКАДЕМИЯ ПРЕДПРИНИМАТЕЛЬСТВА при Правительстве Москвы;;;;;;;;;
10110312;Пермский филиал НОЧУ ВО МОСКОВСКАЯ АКАДЕМИЯ ПРЕДПРИНИМАТЕЛЬСТВА при Правительстве Москвы;;;0;;;;;;
10110322;Кировский филиал Московского гуманитарно-экономического института;;;;57,38;54,83;58,16;61,74;62,17;62,62
10110343;Филиал ОАНО ВО "Московский психолого-социальный университет" в станице Брюховецкая Краснодарского края;;;;;;;;;
10110356;Филиал ОАНО ВО "Московский психолого-социальный университет" в г.Одинцово Московской области;;;;;;;;;
10110385;Псковский филиал НОЧУ ВОП "Санкт-Петербургский институт управления и права";;;;;;;;;
10110397;Абаканский филиал НАЧОУ ВПО Современной гуманитарной академии;;;;;;;;;
10110405;Брянский филиал ЧОУ ВО Современной гуманитарной академии;;;;0;0;;;;
10110440;Самарский филиал ЧОУ ВО Современной гуманитарной академии;;;;;;;;;
10110442;Саранский филиал НАЧОУ ВПО Современной гуманитарной академии;;;;;;;;;
10110443;Саратовский филиал ЧОУ ВО Современной гуманитарной академии;;;;0;0;;;;
10110445;Северодвинский филиал ЧОУ ВО Современной гуманитарной академии;;;;;;;;;
10110446;Смоленский филиал ЧОУ ВО Современной гуманитарной академии;;;;0;;;;;
10110448;Сочинский филиал ЧОУ ВО Современной гуманитарной академии;;;;;;;;;
10110449;Старооскольский филиал НАЧОУ ВПО Современной гуманитарной академии;;;;;;;;;
10110450;Стерлитамакский филиал НАЧОУ ВПО Современной гуманитарной академии;;;;;;;;;
10110451;Сыктывкарский филиал НАЧОУ ВПО Современной гуманитарной академии;;;;;;;;;
10110452;Тамбовский филиал ЧОУ ВО Современной гуманитарной академии;;;;0;0;;;;
10110455;Улан-Удэнский филиал ЧОУ ВО Современной гуманитарной академии;;;;0;;;;;
10110457;Уфимский филиал ЧОУ ВО Современной гуманитарной академии;;;;0;0;;;;
10110458;Ухтинский филиал НАЧОУ ВПО Современной гуманитарной академии;;;;;;;;;
10110459;Хабаровский филиал ЧОУ ВО Современной гуманитарной академии;;;;;;;;;
10110460;Хасавюртовский филиал НАЧОУ ВПО Современной гуманитарной академии;;;;0;;;;;
10110462;Черкесский филиал НАЧОУ ВПО Современной гуманитарной академии;;;;0;;;;;
10110902;Магаданский филиал АНО ВПО "Российская академия предпринимательства";;;;0;;0;0;;
10110903;Новосибирский филиал АНО ВПО Российская академия предпринимательства;;;;;;;;;
10110906;Челябинский филиал АНО ВПО "Российская академия предпринимательства";;;;;;0;0;0;0
12000444;Коломенский институт (филиал) ФГБОУ ВПО "Московский государственный машиностроительный университет (МАМИ)" в г. Коломне Московской области;;;59,71;58,56;;;;;
12000448;Рязанский институт (филиал) ФГБОУ ВПО "Московский государственный машиностроительный университет (МАМИ)";;;57,74;54,69;;;;;
12000450;Губкинский институт (филиал) ФГБОУ ВПО "Московский государственный машиностроительный университет (МАМИ)" в г.Губкине Белгородской области;;;;;;;;;
12000452;Филиал ФГБОУ ВПО "Московский государственный машиностроительный университет (МАМИ)" в г.Воскресенске Московской области;;;;0;;;;;
12000459;филиал ФГБОУ ВПО "Московский государственный машиностроительный университет (МАМИ)" в г. Сафоново Смоленской области;;;;0;;;;;
12000463;Филиал ФГБОУ ВПО "Московский государственный машиностроительный университет (МАМИ)" в г. Прокопьевске Кемеровской области;;;;;;;;;
12000464;Филиал ФГБОУ ВПО "Московский государственный машиностроительный университет (МАМИ)" в г. Махачкале Республики Дагестан;;;0;;;;;;
12000465;филиал ФГБОУ ВПО "Московский государственный машиностроительный университет (МАМИ)" в г. Смоленске;;;;;;;;;
12003257;Чебоксарский политехнический институт (филиал) ФГБОУ ВПО "Московский государственный машиностроительный университет (МАМИ)" в г.Чебоксары Чувашской Республики;;;59,48;0;;;;;
12006915;Таганрогский филиал НОУ ВПО "Российский новый университет";;;;0;0;0;0;0;0
12006918;Александровский филиал НОУ ВПО "Российский новый университет";;;0;0;;;;;
12006919;Волоколамский филиал НОУ ВПО "Российский новый университет";;;;;;;;;
12006920;Гагаринский филиал НОУ ВПО "Российский новый университет";;;;;;;;;
12006925;Орехово-Зуевский филиал ОЧУ ВО "Академия МНЭПУ";;;;;;;;;
12006927;Воскресенский филиал НОУ ВПО "Российский новый университет";;;;0;;;;;
12006928;Новоуренгойский филиал НОУ ВПО "Российский новый университет";;;;;;;;;
12006930;Кубанский институт социоэкономики и права (филиал) ОУ профсоюзов ВО "Академия труда и социальных отношений" (КубИСЭП (филиал) ОУП ВО "АТиСО");;;;;0;0;0;0;0
12006936;Волгоградский филиал ОУ профсоюзов ВО "Академия труда и социальных отношений";;;;;0;;;;
12006939;Красноярский филиал ОУ профсоюзов ВО "Академия труда и социальных отношений";;;;0;0;0;0;0;0
12006987;Филиал Международного института экономики и права в городе Петрозаводске;;;0;0;;;;;
12006988;Рыбинский филиал ОО ВО (частное учреждение) "Международная академия бизнеса и новых технологий (МУБиНТ)";;;;;;;;;
12006989;Костромской филиал ОО ВПО (частное учреждение) "Международная академия бизнеса и новых технологий (МУБиНТ)";;;;0;;;;;
12006990;Волоколамский институт гостеприимства - филиал РМАТ;;;;0;;;;;
12006996;Центральный институт управления и экономики туристского бизнеса - филиал НОУ ВПО Российская международная академия туризма;;;;;;;;;
12007008;Владимирский филиал РМАТ;;;;;;;;;
12007010;Тульский филиал РМАТ;;;52,22;;;;;;
12007011;Воскресенский институт туризма - филиал РМАТ;;;50,5;50,7;61,9;74,7;52,7;54,7;51,7
12007013;Западно-Подмосковный институт туризма - филиал РМАТ;;;47,88;60,19;59,76;56,63;58,35;48,7;58,3
12007014;Карельский институт туризма - филиал РМАТ;;;;;;;;;
12007015;Псковский филиал РМАТ;;;;60,1;60;51,84;62,3;60;61,7
12007034;Подольский институт (филиал) ФГБОУ ВПО "Московский государственный машиностроительный университет (МАМИ)" в г.Подольске Московской области.;;;;;;;;;
12011608;Тувинский филиал ФГБОУ ВПО "Восточно-Сибирская государственная академия культуры и искусств";;;;;;;;;
12011930;Ступинский филиал НОУ ВПО "Российский новый университет";;;45,58;48,39;46;0;0;;
12012670;Ростовский-на-Дону институт физической культуры и спорта (филиал) ФГБОУ ВПО "Кубанский государственный университет физической культуры, спорта и туризма";;;;;;;;;
12012671;Екатеринбургский филиал ФГБОУ ВПО "Уральский государственный университет физической культуры ";;;49,3;51,75;51,52;58,34;56,61;52,67;54,11
12012672;Башкирский институт физической культуры (филиал) ФГБОУ ВО "Уральский государственный университет физической культуры";;;49,43;50,28;50,52;50,6;53,77;52,62;58,8
12012673;Стерлитамакский институт физической культуры (филиал) ФГОУ ВПО "Уральский государственный университет физической культуры";;;47,62;63,52;53,56;57,6;0;;
12012674;Филиал ФГБОУ ВПО "Иркутский государственный университет путей сообщения" в г. Братск;;;;;;;;;
12012682;Филиал ФГБОУ ВПО "Российский государственный университет физической культуры, спорта, молодежи и туризма (ГЦОЛИФК)" в г. Новочебоскарске;;;;;;;;;
12012688;Филиал НОУ ВПО "Институт профессиональных инноваций" в Республике Саха Якутия г. Нерюнгри;;;;;;;;;
12012689;Филиал НОУ ВПО "Институт профессиональных инноваций" в г.Волгограде;;;;;;;;;
12012690;Филиал НОУ ВПО "Институт профессиональных инноваций" в г. Мирный;;;;;;;;;
12012695;Коломенский филиал НОУ ВПО "Московская академия экономики и права";;;;;;;;;
12012696;Моздокский филиал НОУ ВПО "Московская академия экономики и права";;;0;0;0;;;;
12012697;Рязанский филиал НОУ ВПО "Московская академия экономики и права";;;;;;;;;
12012699;Воронежский филиал НОУ ВПО "Московская академия экономики и права";;;;;;;;;
12012700;Смоленский филиал НОУ ВПО "Московская академия экономики и права";;;48,3;0;0;;;;
12012701;Калмыцкий филиал НОУ ВПО "Московская академия экономики и права";;;50,79;61;62,45;;;;
