10006932;Северо-Кавказский филиал ФГОБУ ВПО Московского технического университета связи и информатики;;;;36,14;41,17;56,46;55,32;57,99;60,72
10006933;Филиал ФГБОУ ВПО "Уральский государственный университет путей сообщения" в г. Тюмени;;;;51,55;59,38;;0,00;94,75;96,01
10006934;Филиал ФГБОУ ВПО "Уральский государственный университет путей сообщения" в. г. Нижнем Тагиле;;;;43,17;54,25;;0,00;74,17;87,62
10006935;Улан-Удэнский институт железнодорожного транспорта - филиал ФГБОУ ВПО "Иркутский государственный университет путей сообщения";;;;40,92;47,63;58,17;;;
10006936;Забайкальский институт железнодорожного транспорта - филиал ФГБОУ ВПО "Иркутский государственный университет путей сообщения";;;;43,25;51,92;63,83;65,02;75,32;76,31
10006937;Красноярский институт железнодорожного транспорта - филиал ФГБОУ ВПО "Иркутский государственный университет путей сообщения";;;;50,49;62,22;81,17;80,25;86,22;98,86
10006938;Хакасский филиал ФГБОУ ВПО "Красноярский государственный аграрный университет";;;;;;;;;
10006939;Ачинский филиал ФГБОУ ВПО "Красноярский государственный аграрный университет";;;;53,56;64,72;72,07;79,34;87,66;92,25
10006940;Калужский филиал ФГБОУ ВО "Российский государственный аграрный университет - МСХА имени К.А. Тимирязева";;;;37,68;46,18;56,39;63,95;70,01;73,62
10006943;Филиал ФГБОУ ВПО "Российский государственный университет физической культуры, спорта, молодежи и туризма (ГЦОЛИФК)" в г. Иркутске;;;;50,55;53,89;56,66;73,34;78,96;101,31
10006944;Северо-Кавказский филиал ФГБОУ ВО "Российский государственный университет правосудия"(г.Краснодар);;;;35,99;45,32;50,54;57,34;62,44;62,5
10006945;Восточно-Сибирский филиал ФГБОУ ВО "Российский государственный университет правосудия"(г. Иркутск);;;;60,02;54,62;60,14;73,92;79,14;85,28
10006946;Дальневосточный филиал ФГБОУ ВО "Российский государственный университет правосудия" (г. Хабаровск);;;;53,30;67,74;85,63;85,42;93,60;93,88
10006947;Западно-Сибирский филиал Федерального государственного образовательного учреждения высшего образования "Российский государственный университет правосудия" (г. Томск);;;;47,16;55,26;73,95;76,06;77,40;79,61
10006948;Казанский филиал ФГБОУ ВО "Российский государственный университет правосудия"(г. Казань);;;;42,18;45,50;61,94;63,44;68,11;69,1
10006949;Приволжский филиал ФГБОУ ВО "Российский государственный университет правосудия" (г. Нижний Новгород);;;;36,69;43,00;49,55;58,98;63,35;68,75
10006950;Ростовский филиал ФГБОУ ВПО "Российская академия правосудия" (г. Ростов-на-Дону);;;;30,77;41,43;46,95;52,93;58,14;61,62
10006951;Северо-Западный филиал ФГБОУ ВО "Российский государственный университет правосудия" (г. Санкт-Петербург);;;;80,65;95,10;90,58;101,53;109,70;109,95
10006952;Уральский филиал ФГБОУ ВО "Российский государственный университет правосудия" (г. Челябинск);;;;44,88;55,60;57,15;63,50;65,91;69,5
10006953;Центральный филиал ФГБОУ ВО "Российский государственный университет правосудия" (г. Воронеж);;;;34,91;42,21;45,44;53,79;60,56;62,72
10006954;Барнаульский филиал ФГОБУ ВО "Финансовый университет при Правительстве Российской Федерации" (Барнаульский филиал Финуниверситета);;;;42,15;44,44;41,71;44,39;48,52;53,45
10006955;Брянский филиал ФГОБУ ВО "Финансовый университет при Правительстве Российской Федерации";;;;37,21;41,31;;;;
10006956;Владимирский филиал ФГОБУ ВО "Финансовый университет при Правительстве Российской Федерации";;;;36,04;37,52;47,88;55,62;58,49;71,36
10006959;Краснодарский филиал ФГОБУ ВПО "Финансовый университет при Правительстве Российской Федерации";;;;38,88;45,46;61,56;57,10;65,58;65,96
10006960;Курский филиал ФГОБУ ВО "Финансовый университет при Правительстве Российской Федерации";;;;31,00;39,15;44,77;52,21;55,91;60,04
10006961;Липецкий филиал ФГОБУ ВО "Финансовый университет при Правительстве Российской Федерации";;;;44,10;45,68;61,99;55,43;60,01;62,09
10006962;Новороссийский филиал ФГОБУ ВО "Финансовый университет при Правительстве Российской Федерации";;;;39,24;50,82;62,67;59,15;65,00;72
10006963;Орловский филиал ФГОБУ ВО "Финансовый университет при Правительстве Российской Федерации";;;;33,55;39,58;48,95;50,24;54,25;54,2
10006964;Пензенский филиал ФГОБУ ВО "Финансовый университет при Правительстве Российской Федерации";;;;32,90;41,80;47,20;51,00;55,07;55,1
10006965;Смоленский филиал ФГОБУ ВО "Финансовый университет при Правительстве Российской Федерации";;;;38,12;40,72;53,95;58,51;68,83;67,53
10006966;Тульский филиал ФГОБУ ВО "Финансовый университет при Правительстве Российской Федерации";;;;53,25;59,46;64,23;61,21;66,38;64,89
10006967;Уфимский филиал ФГОБУ ВО "Финансовый университет при Правительстве Российской Федерации";;;;43,05;44,39;49,20;62,15;66,14;66,25
10006968;Челябинский филиал ФГОБУ ВО "Финансовый университет при Правительстве Российской Федерации";;;;42,86;52,06;62,97;61,00;64,00;64,32
10006969;Ярославский филиал ФГОБУ ВО "Финансовый университет при Правительстве Российской Федерации";;;;38,97;54,06;59,52;64,92;66,97;63,08
10006970;Владикавказский филиал ФГОБУ ВО "Финансовый университет при Правительстве Российской Федерации";;;;43,06;50,01;48,00;47,45;48,74;49,46
10006971;Калужский филиал ФГОБУ ВО "Финансовый университет при Правительстве Российской Федерации";;;;42,12;47,82;57,72;66,72;69,92;72,93
10006972;Омский филиал ФГОБУ ВО "Финансовый университет при Правительстве Российской Федерации";;;;44,71;41,77;48,42;57,04;60,00;60
10006973;Санкт-Петербургский филиал ФГОБУ ВО "Финансовый университет при Правительстве Российской Федерации";;;;65,93;82,84;127,83;146,27;130,05;143,01
10006975;Филиал Международного института экономики и права в городе Астрахани;;;;44,56;;;;;
10006976;Филиал Международного института экономики и права в городе Белорецке;;;;42,01;;;;;
10006977;Филиал Международного института экономики и права в городе Владивостоке;;;;49,19;;;;;
10006978;Филиал Международного института экономики и права в городе Волгограде;;;;42,48;;;;;
10006979;Филиал Международного института экономики и права в городе Екатеринбурге;;;;56,49;;;;;
10006980;Филиал Международного института экономики и права в городе Киселевске;;;;51,29;;;;;
10006981;Филиал Международного института экономики и права в городе Магнитогорске;;;;53,26;;;;;
10006982;Филиал Международного института экономики и права в городе Мурманске;;;;;;;;;
10006983;Филиал Международного института экономики и права в городе Омске;;;;28,43;;;;;
10006984;Филиал Международного института экономики и права в городе Челябинске;;;;50,71;;;;;
10006985;Филиал Международного института экономики и права в городе Ярославле;;;;48,77;;;;;
10006986;Сибирский филиал Международного института экономики и права;;;;46,16;;;;;
10006987;Вологодский филиал ОО ВПО (частное учреждение) "Международная академия бизнеса и новых технологий (МУБиНТ)";;;;40,24;;;;;
10006988;Московский филиал РМАТ;;;;26,92;30,82;27,28;27,44;31,82;29,91
10006993;Филиал ФГБОУ ВО "Ивановский государственный политехнический университет" в г. Краснодаре;;;;;;;;;
10006994;Филиал ФГБОУ ВО "Ивановский государственный политехнический университет" в г. Нижнем Новгороде;;;;;;;;;
10006995;Филиал ФГБОУ ВПО "Ивановский государственный политехнический университет" в г. Рязани;;;;;;;;;
10006997;Институт сервиса и технологий (филиал) ФГБОУ ВПО "Донской государственнывй технический университет" в г. Пятигорске Ставропольского края;;;;31,07;34,54;46,14;;;
10006998;Технологический институт сервиса (филиал)ФГБОУ ВО "Донской государственный технический университет" в г. Ставрополе Ставропольского края;;;;32,35;36,82;39,87;49,66;54,06;60,12
10006999;Институт сферы обслуживания и предпринимательства (филиал) ФГОУ ВО "Донской государтсвенный технический университет" в г. Шахты Ростовской области;;;;37,13;40,66;49,05;54,06;60,28;65,87
10007017;Филиал ФГБОУ ВПО "Уральский государственный педагогический университет" в г. Красноуфимске;;;;;;;;;
10007018;Филиал ФГБОУ ВПО "Уральский государственный педагогический университет" в г. Серове;;;;;;;;;
10007029;Тольяттинский филиал Самарского национального исследовательского университета имени академика С.П. Королева;;;;;;;;;
10007043;филиал ФГБОУ ВО "Санкт-Петербургский государственный экономический университет" в г. Великие Луки Псковской области;;;;;;;;;
10007044;филиал ФГБОУ ВО "Санкт-Петербургский государственный экономический университет" в г. Калининграде;;;;;;;;;
10007045;Калужский филиал ФГБОУ ВО "Санкт-Петербургский государственный экономический университет";;;;31,83;;;;;
10007046;Кировский филиал ФГБОУ ВО "Санкт-Петербургский государственный экономический университет";;;;;;;;;
10007047;филиал ФГБОУ ВО "Санкт-Петербургский государственный экономический университет" в г. Сосновый Бор Ленинградской области;;;;;;;;;
10007048;филиал ФГБОУ ВО "Санкт-Петербургский государственный экономический университет" в г. Старая Русса Новгородской области;;;;;;;;;
10007049;филиал ФГБОУ ВО "Санкт-Петербургский государственный экономический университет" в г. Сыктывкар Республики Коми;;;;;;;;;
10007050;филиал ФГБОУ ВО "Санкт-Петербургский государственный экономический университет" в г. Тихвине Ленинградской области;;;;;;;;;
10110172;Филиал АНОО ВПО "Воронежский экономико-правовой институт" в г.Орел;;;;33,34;36,05;60,69;51,91;61,19;68,6
10110270;Орехово-Зуевский филиал НОУ ВПО "Институт экономики и предпринимательства";;;;;;;;;
10110303;Вышневолоцкий филиал ОАНО ВО "Международный славянский институт";;;;;;;;;
10110306;Калининградский филиал АНОО ВПО "Международный славянский институт";;;;;;;;;
10110307;Волгоградский филиал АНО ВО "Международный славянский институт";;;;35,32;;;;;
10110311;Ростовский-на-Дону филиал НОЧУ ВО МОСКОВСКАЯ АКАДЕМИЯ ПРЕДПРИНИМАТЕЛЬСТВА при Правительстве Москвы;;;;;;;;;
10110312;Пермский филиал НОЧУ ВО МОСКОВСКАЯ АКАДЕМИЯ ПРЕДПРИНИМАТЕЛЬСТВА при Правительстве Москвы;;;;;;;;;
10110322;Кировский филиал Московского гуманитарно-экономического института;;;;28,52;33,46;53,16;77,92;53,06;94,5
10110343;Филиал ОАНО ВО "Московский психолого-социальный университет" в станице Брюховецкая Краснодарского края;;;;;;;;;
10110356;Филиал ОАНО ВО "Московский психолого-социальный университет" в г.Одинцово Московской области;;;;;;;;;
10110385;Псковский филиал НОЧУ ВОП "Санкт-Петербургский институт управления и права";;;;;;;;;
10110397;Абаканский филиал НАЧОУ ВПО Современной гуманитарной академии;;;;;;;;;
10110405;Брянский филиал ЧОУ ВО Современной гуманитарной академии;;;;45,19;102,46;;;;
10110440;Самарский филиал ЧОУ ВО Современной гуманитарной академии;;;;;;;;;
10110442;Саранский филиал НАЧОУ ВПО Современной гуманитарной академии;;;;;;;;;
10110443;Саратовский филиал ЧОУ ВО Современной гуманитарной академии;;;;0,00;0,00;;;;
10110445;Северодвинский филиал ЧОУ ВО Современной гуманитарной академии;;;;;;;;;
10110446;Смоленский филиал ЧОУ ВО Современной гуманитарной академии;;;;0,00;;;;;
10110448;Сочинский филиал ЧОУ ВО Современной гуманитарной академии;;;;;;;;;
10110449;Старооскольский филиал НАЧОУ ВПО Современной гуманитарной академии;;;;;;;;;
10110450;Стерлитамакский филиал НАЧОУ ВПО Современной гуманитарной академии;;;;;;;;;
10110451;Сыктывкарский филиал НАЧОУ ВПО Современной гуманитарной академии;;;;;;;;;
10110452;Тамбовский филиал ЧОУ ВО Современной гуманитарной академии;;;;57,37;0,00;;;;
10110455;Улан-Удэнский филиал ЧОУ ВО Современной гуманитарной академии;;;;0,00;;;;;
10110457;Уфимский филиал ЧОУ ВО Современной гуманитарной академии;;;;204,04;24,67;;;;
10110458;Ухтинский филиал НАЧОУ ВПО Современной гуманитарной академии;;;;;;;;;
10110459;Хабаровский филиал ЧОУ ВО Современной гуманитарной академии;;;;;;;;;
10110460;Хасавюртовский филиал НАЧОУ ВПО Современной гуманитарной академии;;;;0,00;;;;;
10110462;Черкесский филиал НАЧОУ ВПО Современной гуманитарной академии;;;;0,00;;;;;
10110902;Магаданский филиал АНО ВПО "Российская академия предпринимательства";;;;60,08;;80,00;85,00;;
10110903;Новосибирский филиал АНО ВПО Российская академия предпринимательства;;;;;;;;;
10110906;Челябинский филиал АНО ВПО "Российская академия предпринимательства";;;;;;34,32;38,12;48,93;0
12000444;Коломенский институт (филиал) ФГБОУ ВПО "Московский государственный машиностроительный университет (МАМИ)" в г. Коломне Московской области;;;;39,57;;;;;
12000448;Рязанский институт (филиал) ФГБОУ ВПО "Московский государственный машиностроительный университет (МАМИ)";;;;35,29;;;;;
12000450;Губкинский институт (филиал) ФГБОУ ВПО "Московский государственный машиностроительный университет (МАМИ)" в г.Губкине Белгородской области;;;;;;;;;
12000452;Филиал ФГБОУ ВПО "Московский государственный машиностроительный университет (МАМИ)" в г.Воскресенске Московской области;;;;29,34;;;;;
12000459;филиал ФГБОУ ВПО "Московский государственный машиностроительный университет (МАМИ)" в г. Сафоново Смоленской области;;;;19,40;;;;;
12000463;Филиал ФГБОУ ВПО "Московский государственный машиностроительный университет (МАМИ)" в г. Прокопьевске Кемеровской области;;;;;;;;;
12000464;Филиал ФГБОУ ВПО "Московский государственный машиностроительный университет (МАМИ)" в г. Махачкале Республики Дагестан;;;;;;;;;
12000465;филиал ФГБОУ ВПО "Московский государственный машиностроительный университет (МАМИ)" в г. Смоленске;;;;;;;;;
12003257;Чебоксарский политехнический институт (филиал) ФГБОУ ВПО "Московский государственный машиностроительный университет (МАМИ)" в г.Чебоксары Чувашской Республики;;;;28,85;;;;;
12006915;Таганрогский филиал НОУ ВПО "Российский новый университет";;;;35,03;41,07;67,28;60,15;62,53;64,87
12006918;Александровский филиал НОУ ВПО "Российский новый университет";;;;22,88;;;;;
12006919;Волоколамский филиал НОУ ВПО "Российский новый университет";;;;;;;;;
12006920;Гагаринский филиал НОУ ВПО "Российский новый университет";;;;;;;;;
12006925;Орехово-Зуевский филиал ОЧУ ВО "Академия МНЭПУ";;;;;;;;;
12006927;Воскресенский филиал НОУ ВПО "Российский новый университет";;;;54,19;;;;;
12006928;Новоуренгойский филиал НОУ ВПО "Российский новый университет";;;;;;;;;
12006930;Кубанский институт социоэкономики и права (филиал) ОУ профсоюзов ВО "Академия труда и социальных отношений" (КубИСЭП (филиал) ОУП ВО "АТиСО");;;;;41,21;47,26;55,04;64,11;73,7
12006936;Волгоградский филиал ОУ профсоюзов ВО "Академия труда и социальных отношений";;;;;0,00;;;;
12006939;Красноярский филиал ОУ профсоюзов ВО "Академия труда и социальных отношений";;;;49,22;57,56;67,71;63,82;0,00;60,39
12006987;Филиал Международного института экономики и права в городе Петрозаводске;;;;35,32;;;;;
12006988;Рыбинский филиал ОО ВО (частное учреждение) "Международная академия бизнеса и новых технологий (МУБиНТ)";;;;;;;;;
12006989;Костромской филиал ОО ВПО (частное учреждение) "Международная академия бизнеса и новых технологий (МУБиНТ)";;;;32,93;;;;;
12006990;Волоколамский институт гостеприимства - филиал РМАТ;;;;38,07;;;;;
12006996;Центральный институт управления и экономики туристского бизнеса - филиал НОУ ВПО Российская международная академия туризма;;;;;;;;;
12007008;Владимирский филиал РМАТ;;;;;;;;;
12007010;Тульский филиал РМАТ;;;;;;;;;
12007011;Воскресенский институт туризма - филиал РМАТ;;;;30,79;35,70;36,88;44,65;38,24;31,25
12007013;Западно-Подмосковный институт туризма - филиал РМАТ;;;;31,37;66,82;86,40;88,75;54,92;70,63
12007014;Карельский институт туризма - филиал РМАТ;;;;;;;;;
12007015;Псковский филиал РМАТ;;;;29,27;31,81;42,55;51,00;39,08;46,15
12007034;Подольский институт (филиал) ФГБОУ ВПО "Московский государственный машиностроительный университет (МАМИ)" в г.Подольске Московской области.;;;;;;;;;
12011608;Тувинский филиал ФГБОУ ВПО "Восточно-Сибирская государственная академия культуры и искусств";;;;;;;;;
12011930;Ступинский филиал НОУ ВПО "Российский новый университет";;;;59,30;60,96;47,29;99,49;;
12012670;Ростовский-на-Дону институт физической культуры и спорта (филиал) ФГБОУ ВПО "Кубанский государственный университет физической культуры, спорта и туризма";;;;;;;;;
